NOMBRE;DOCUMENTO;CARGO;INSTITUCION;OBSERVACIONES
SOCIEDAD ADMINISTRADORA DE FONDOS DE CESANTIA DE CHILE II S.A.;76237243-6;DTE.;Juzgado de Letras de Cauquenes;RIT: P-18-2021 | Tribunal: Juzgado de Letras de Cauquenes | Caratulado: ADM. DE FONDOS DE CESANTIA CHILE II S.A. CON JUAN ENRIQ | Fecha Ingreso: 17/03/2021 | Estado Procesal: Tramitación | RIT: P-18-2021 | Fecha Ing.: 17/03/2021 | RUC: 21- 3-0056394-2 | Est. Adm.: Sin archivar | Proc.: Ejecutivo Previsional | Forma Inicio.: Demanda | Estado Proc.: Tramitación | Etapa: Ingreso | Titulo Ejec.:  | Juez Asignado: ANDREA DEL PILAR SUAZO QUIROZ | Tribunal: Juzgado de Letras de Cauquenes
JUAN ENRIQUE MORALES CONTRERAS;7321868-3;DDO.;Juzgado de Letras de Cauquenes;RIT: P-18-2021 | Tribunal: Juzgado de Letras de Cauquenes | Caratulado: ADM. DE FONDOS DE CESANTIA CHILE II S.A. CON JUAN ENRIQ | Fecha Ingreso: 17/03/2021 | Estado Procesal: Tramitación | RIT: P-18-2021 | Fecha Ing.: 17/03/2021 | RUC: 21- 3-0056394-2 | Est. Adm.: Sin archivar | Proc.: Ejecutivo Previsional | Forma Inicio.: Demanda | Estado Proc.: Tramitación | Etapa: Ingreso | Titulo Ejec.:  | Juez Asignado: ANDREA DEL PILAR SUAZO QUIROZ | Tribunal: Juzgado de Letras de Cauquenes
Raúl Horacio Troncoso Delpiano;7072258-5;AB.DTE;Juzgado de Letras de Cauquenes;RIT: P-18-2021 | Tribunal: Juzgado de Letras de Cauquenes | Caratulado: ADM. DE FONDOS DE CESANTIA CHILE II S.A. CON JUAN ENRIQ | Fecha Ingreso: 17/03/2021 | Estado Procesal: Tramitación | RIT: P-18-2021 | Fecha Ing.: 17/03/2021 | RUC: 21- 3-0056394-2 | Est. Adm.: Sin archivar | Proc.: Ejecutivo Previsional | Forma Inicio.: Demanda | Estado Proc.: Tramitación | Etapa: Ingreso | Titulo Ejec.:  | Juez Asignado: ANDREA DEL PILAR SUAZO QUIROZ | Tribunal: Juzgado de Letras de Cauquenes
Administradora de Fondos de Pensiones Provida;76265736-8;DTE.;Juzgado de Letras de Cauquenes;RIT: P-12-2021 | Tribunal: Juzgado de Letras de Cauquenes | Caratulado: A.F.P. PROVIDA S.A. CON BIOMAULE LOGISTICS SPA | Fecha Ingreso: 15/03/2021 | Estado Procesal: Concluido | RIT: P-12-2021 | Fecha Ing.: 15/03/2021 | RUC: 21- 3-0053359-8 | Est. Adm.: Archivada | Proc.: Ejecutivo Previsional | Forma Inicio.: Demanda | Estado Proc.: Concluido | Etapa: Terminada | Titulo Ejec.:  | Juez Asignado: ANDREA DEL PILAR SUAZO QUIROZ | Tribunal: Juzgado de Letras de Cauquenes
BIOMAULE LOGISTICS SPA;77182128-6;DDO.;Juzgado de Letras de Cauquenes;RIT: P-12-2021 | Tribunal: Juzgado de Letras de Cauquenes | Caratulado: A.F.P. PROVIDA S.A. CON BIOMAULE LOGISTICS SPA | Fecha Ingreso: 15/03/2021 | Estado Procesal: Concluido | RIT: P-12-2021 | Fecha Ing.: 15/03/2021 | RUC: 21- 3-0053359-8 | Est. Adm.: Archivada | Proc.: Ejecutivo Previsional | Forma Inicio.: Demanda | Estado Proc.: Concluido | Etapa: Terminada | Titulo Ejec.:  | Juez Asignado: ANDREA DEL PILAR SUAZO QUIROZ | Tribunal: Juzgado de Letras de Cauquenes
Eduardo Penafiel Pena;8853160-4;AB.DTE;Juzgado de Letras de Cauquenes;RIT: P-12-2021 | Tribunal: Juzgado de Letras de Cauquenes | Caratulado: A.F.P. PROVIDA S.A. CON BIOMAULE LOGISTICS SPA | Fecha Ingreso: 15/03/2021 | Estado Procesal: Concluido | RIT: P-12-2021 | Fecha Ing.: 15/03/2021 | RUC: 21- 3-0053359-8 | Est. Adm.: Archivada | Proc.: Ejecutivo Previsional | Forma Inicio.: Demanda | Estado Proc.: Concluido | Etapa: Terminada | Titulo Ejec.:  | Juez Asignado: ANDREA DEL PILAR SUAZO QUIROZ | Tribunal: Juzgado de Letras de Cauquenes
