NOMBRE;DOCUMENTO;CARGO;INSTITUCION;OBSERVACIONES
JEANNETTE DEL PILAR COFRÉ SOTO;10549951-5;Ab.Recurrente;C.A. de La Serena;Rol: Amparo-68-2023 | Corte: C.A. de La Serena | Caratulado: VASQUEZ VASQUEZ JOSE ALFREDO/COMISIÓN DE LIBETAD CONDICIONAL | Fecha Ingreso: 11/02/2023 | Estado Causa: Fallada-Terminada | Fecha Ubicación: 17/02/0023 | Ubicación: Archivo
GENDARMERÍA DE CHILE (ALCAIDE CCP CONCEPCIÓN);61004000-4;Recurrido;C.A. de La Serena;Rol: Amparo-68-2023 | Corte: C.A. de La Serena | Caratulado: VASQUEZ VASQUEZ JOSE ALFREDO/COMISIÓN DE LIBETAD CONDICIONAL | Fecha Ingreso: 11/02/2023 | Estado Causa: Fallada-Terminada | Fecha Ubicación: 17/02/0023 | Ubicación: Archivo
JOSÉ ALFREDO VÁSQUEZ VÁSQUEZ;16082547-2;Ampdo.;C.A. de La Serena;Rol: Amparo-68-2023 | Corte: C.A. de La Serena | Caratulado: VASQUEZ VASQUEZ JOSE ALFREDO/COMISIÓN DE LIBETAD CONDICIONAL | Fecha Ingreso: 11/02/2023 | Estado Causa: Fallada-Terminada | Fecha Ubicación: 17/02/0023 | Ubicación: Archivo
ELIZABETH SOLANGE FREDES ROSALES;12239582-0;Ab.Recurrente;C.A. de La Serena;Rol: Amparo-69-2023 | Corte: C.A. de La Serena | Caratulado: EDGAR ALEXANDER LARA RODRIGUEZ/SERVICIO NACIONAL DE MIGRACIONES DEPENDIENTE DEL MINISTERIO DEL INTERIOR Y SEGURIDAD PUBLICA | Fecha Ingreso: 11/02/2023 | Estado Causa: Fallada-Terminada | Fecha Ubicación: 11/02/2023 | Ubicación: Archivo
EDGAR ALEXANDER LARA RODRIGUEZ;14883887-9;Ampdo.;C.A. de La Serena;Rol: Amparo-69-2023 | Corte: C.A. de La Serena | Caratulado: EDGAR ALEXANDER LARA RODRIGUEZ/SERVICIO NACIONAL DE MIGRACIONES DEPENDIENTE DEL MINISTERIO DEL INTERIOR Y SEGURIDAD PUBLICA | Fecha Ingreso: 11/02/2023 | Estado Causa: Fallada-Terminada | Fecha Ubicación: 11/02/2023 | Ubicación: Archivo
SERVICIO NACIONAL DE MIGRACIONES DEPENDIENTE DEL MINISTERIO DEL INTERIOR Y SEGURIDAD PUBLICA;60501000-8;Recurrido;C.A. de La Serena;Rol: Amparo-69-2023 | Corte: C.A. de La Serena | Caratulado: EDGAR ALEXANDER LARA RODRIGUEZ/SERVICIO NACIONAL DE MIGRACIONES DEPENDIENTE DEL MINISTERIO DEL INTERIOR Y SEGURIDAD PUBLICA | Fecha Ingreso: 11/02/2023 | Estado Causa: Fallada-Terminada | Fecha Ubicación: 11/02/2023 | Ubicación: Archivo
