NOMBRE;DOCUMENTO;CARGO;INSTITUCION;OBSERVACIONES
CAMILA CONSTANZA TAPIA NEIRA;17617822-1;Recurrente;C.A. de Puerto Montt;Rol: Protección-131-2021 | Corte: C.A. de Puerto Montt | Caratulado: TAPIA/ISAPRE COLMENA GOLDEN CROSS S. A.. | Fecha Ingreso: 14/03/2021 | Estado Causa: Fallada-Terminada | Fecha Ubicación: 14/03/2021 | Ubicación: Corte apelaciones
RONALD ANDRÉS BELTRÁN CLARK;15593181-7;Ab.Recurrente;C.A. de Puerto Montt;Rol: Protección-131-2021 | Corte: C.A. de Puerto Montt | Caratulado: TAPIA/ISAPRE COLMENA GOLDEN CROSS S. A.. | Fecha Ingreso: 14/03/2021 | Estado Causa: Fallada-Terminada | Fecha Ubicación: 14/03/2021 | Ubicación: Corte apelaciones
ISAPRE COLMENA GOLDEN CROSS S. A..;76296619-0;Recurrido;C.A. de Puerto Montt;Rol: Protección-131-2021 | Corte: C.A. de Puerto Montt | Caratulado: TAPIA/ISAPRE COLMENA GOLDEN CROSS S. A.. | Fecha Ingreso: 14/03/2021 | Estado Causa: Fallada-Terminada | Fecha Ubicación: 14/03/2021 | Ubicación: Corte apelaciones
NATALY JOHANA ÁGUILA VILLARROEL;16893939-6;Recurrente;C.A. de Puerto Montt;Rol: Protección-132-2021 | Corte: C.A. de Puerto Montt | Caratulado: ÁGUILA/POLICIA DE INVESTIGACIONES D | Fecha Ingreso: 14/03/2021 | Estado Causa: Fallada-Terminada | Fecha Ubicación: 14/03/2021 | Ubicación: Archivo
POLICIA DE INVESTIGACIONES D;60506000-5;Recurrido;C.A. de Puerto Montt;Rol: Protección-132-2021 | Corte: C.A. de Puerto Montt | Caratulado: ÁGUILA/POLICIA DE INVESTIGACIONES D | Fecha Ingreso: 14/03/2021 | Estado Causa: Fallada-Terminada | Fecha Ubicación: 14/03/2021 | Ubicación: Archivo
