NOMBRE;DOCUMENTO;CARGO;INSTITUCION;OBSERVACIONES
NICOLÁS ANDRÉS NAVARRO BARRÍA;17680412-2;Ab.Recurrente;C.A. de Puerto Montt;Rol: Protección-993-2023 | Corte: C.A. de Puerto Montt | Caratulado: JOSEPH/DIRECCION REGIONAL VALPARAISO, SERVICIO NACIONAL MIGRACIONES | Fecha Ingreso: 23/07/2023 | Estado Causa: Fallada-Terminada | Fecha Ubicación: 23/07/2023 | Ubicación: Corte apelaciones
THEODOR JOSEPH;25877748-4;Recurrente;C.A. de Puerto Montt;Rol: Protección-993-2023 | Corte: C.A. de Puerto Montt | Caratulado: JOSEPH/DIRECCION REGIONAL VALPARAISO, SERVICIO NACIONAL MIGRACIONES | Fecha Ingreso: 23/07/2023 | Estado Causa: Fallada-Terminada | Fecha Ubicación: 23/07/2023 | Ubicación: Corte apelaciones
DIRECCION REGIONAL VALPARAISO, SERVICIO NACIONAL MIGRACIONES;60511000-2;Recurrido;C.A. de Puerto Montt;Rol: Protección-993-2023 | Corte: C.A. de Puerto Montt | Caratulado: JOSEPH/DIRECCION REGIONAL VALPARAISO, SERVICIO NACIONAL MIGRACIONES | Fecha Ingreso: 23/07/2023 | Estado Causa: Fallada-Terminada | Fecha Ubicación: 23/07/2023 | Ubicación: Corte apelaciones
ROSAMEL JEAN-POOL YÁÑEZ MENESES;16158786-9;Ampdo.;C.A. de Puerto Montt;Rol: Amparo-322-2023 | Corte: C.A. de Puerto Montt | Caratulado: /YÁÑEZ | Fecha Ingreso: 23/07/2023 | Estado Causa: Fallada-Terminada | Fecha Ubicación: 11/08/2023 | Ubicación: Archivo
JESICA ANDREA YÁÑEZ SANHUEZA;14448207-7;Recurrido;C.A. de Puerto Montt;Rol: Amparo-322-2023 | Corte: C.A. de Puerto Montt | Caratulado: /YÁÑEZ | Fecha Ingreso: 23/07/2023 | Estado Causa: Fallada-Terminada | Fecha Ubicación: 11/08/2023 | Ubicación: Archivo
VALERIA CONSTANZA DEVILAT GARCÍA;17043838-8;Ab.Recurrente;C.A. de Puerto Montt;Rol: Amparo-322-2023 | Corte: C.A. de Puerto Montt | Caratulado: /YÁÑEZ | Fecha Ingreso: 23/07/2023 | Estado Causa: Fallada-Terminada | Fecha Ubicación: 11/08/2023 | Ubicación: Archivo
MARTHA CAROLA LOZANO ECHEVERRIA;27047115-3;Recurrente;C.A. de Puerto Montt;Rol: Protección-994-2023 | Corte: C.A. de Puerto Montt | Caratulado: LOZANO/DEPARTAMENTO DE EXTRANJERIA Y MIGRACIÓN DEL MINISTERIO DEL INTERIOR Y SEGURIDAD PUBLICA | Fecha Ingreso: 23/07/2023 | Estado Causa: Fallada-Terminada | Fecha Ubicación: 23/07/2023 | Ubicación: Corte apelaciones
DEPARTAMENTO DE EXTRANJERIA Y MIGRACIÓN DEL MINISTERIO DEL INTERIOR Y SEGURIDAD PUBLICA;60501000-8;Recurrido;C.A. de Puerto Montt;Rol: Protección-994-2023 | Corte: C.A. de Puerto Montt | Caratulado: LOZANO/DEPARTAMENTO DE EXTRANJERIA Y MIGRACIÓN DEL MINISTERIO DEL INTERIOR Y SEGURIDAD PUBLICA | Fecha Ingreso: 23/07/2023 | Estado Causa: Fallada-Terminada | Fecha Ubicación: 23/07/2023 | Ubicación: Corte apelaciones
