NOMBRE;DOCUMENTO;CARGO;INSTITUCION;OBSERVACIONES
ROCÍO BELÉN MARCELA FIGUEROA PROVOST;17727646-4;Ab.Recurrente;C.A. de San Miguel;Rol: Protección-301-2023 | Corte: C.A. de San Miguel | Caratulado: SARRIA/ISAPRE CRUZBLANCA S.A. | Fecha Ingreso: 22/01/2023 | Estado Causa: Fallada-Terminada | Fecha Ubicación: 09/07/0025 | Ubicación: Archivo
NATTALIA ANDREA SARRIA NÚÑEZ;16336474-3;Recurrente;C.A. de San Miguel;Rol: Protección-301-2023 | Corte: C.A. de San Miguel | Caratulado: SARRIA/ISAPRE CRUZBLANCA S.A. | Fecha Ingreso: 22/01/2023 | Estado Causa: Fallada-Terminada | Fecha Ubicación: 09/07/0025 | Ubicación: Archivo
ISAPRE CRUZBLANCA S.A.;96501450-0;Recurrido;C.A. de San Miguel;Rol: Protección-301-2023 | Corte: C.A. de San Miguel | Caratulado: SARRIA/ISAPRE CRUZBLANCA S.A. | Fecha Ingreso: 22/01/2023 | Estado Causa: Fallada-Terminada | Fecha Ubicación: 09/07/0025 | Ubicación: Archivo
RODRIGO ALEJANDRO CORONADO RAMÍREZ;18458858-7;Ab.Recurrente;C.A. de San Miguel;Rol: Amparo-55-2023 | Corte: C.A. de San Miguel | Caratulado: STEFANO UMBERTO GOMEZ CORTES/COMISION DE LIBERTAD CONDICIONAL | Fecha Ingreso: 22/01/2023 | Estado Causa: Fallada-Terminada | Fecha Ubicación: 13/12/0023 | Ubicación: Archivo
COMISIO´N DE LIBERTAD CONDICIONAL;0-0;Recurrido;C.A. de San Miguel;Rol: Amparo-55-2023 | Corte: C.A. de San Miguel | Caratulado: STEFANO UMBERTO GOMEZ CORTES/COMISION DE LIBERTAD CONDICIONAL | Fecha Ingreso: 22/01/2023 | Estado Causa: Fallada-Terminada | Fecha Ubicación: 13/12/0023 | Ubicación: Archivo
STEFANO UMBERTO GÓMEZ CORTÉS;16078702-3;Ampdo.;C.A. de San Miguel;Rol: Amparo-55-2023 | Corte: C.A. de San Miguel | Caratulado: STEFANO UMBERTO GOMEZ CORTES/COMISION DE LIBERTAD CONDICIONAL | Fecha Ingreso: 22/01/2023 | Estado Causa: Fallada-Terminada | Fecha Ubicación: 13/12/0023 | Ubicación: Archivo
