NOMBRE;DOCUMENTO;CARGO;INSTITUCION;OBSERVACIONES
JAVIER ANTONIO RUIZ ISLA;17046752-3;Ab.Recurrente;C.A. de Concepción;Rol: Protección-16447-2023 | Corte: C.A. de Concepción | Caratulado: DEL ANGEL/SERVICIO NACIONAL DE MIGRACIONES | Fecha Ingreso: 13/08/2023 | Estado Causa: Fallada-Terminada | Fecha Ubicación: 13/08/2023 | Ubicación: Corte apelaciones
ZOILA FLOR DEL ANGEL SANCHEZ;26013933-9;Recurrente;C.A. de Concepción;Rol: Protección-16447-2023 | Corte: C.A. de Concepción | Caratulado: DEL ANGEL/SERVICIO NACIONAL DE MIGRACIONES | Fecha Ingreso: 13/08/2023 | Estado Causa: Fallada-Terminada | Fecha Ubicación: 13/08/2023 | Ubicación: Corte apelaciones
SERVICIO NACIONAL DE MIGRACIONES, DEPENDIENTE DEL MINISTERIO DEL INTERIOR Y SEGURIDAD PÚBLICA.;60501000-8;Recurrido;C.A. de Concepción;Rol: Protección-16447-2023 | Corte: C.A. de Concepción | Caratulado: DEL ANGEL/SERVICIO NACIONAL DE MIGRACIONES | Fecha Ingreso: 13/08/2023 | Estado Causa: Fallada-Terminada | Fecha Ubicación: 13/08/2023 | Ubicación: Corte apelaciones
RAÚL EDUARDO VENEGAS ORTIZ;5902305-5;Ab.Recurrente;C.A. de Concepción;Rol: Protección-16448-2023 | Corte: C.A. de Concepción | Caratulado: CONSTANZA DEL PILAR VENEGAS SÁNCHEZ/ISAPRE CRUZ BLANCA S.A. (PR15) | Fecha Ingreso: 13/08/2023 | Estado Causa: Fallada-Terminada | Fecha Ubicación: 13/08/2023 | Ubicación: Corte apelaciones
CONSTANZA DEL PILAR VENEGAS SÁNCHEZ;17199611-2;Recurrente;C.A. de Concepción;Rol: Protección-16448-2023 | Corte: C.A. de Concepción | Caratulado: CONSTANZA DEL PILAR VENEGAS SÁNCHEZ/ISAPRE CRUZ BLANCA S.A. (PR15) | Fecha Ingreso: 13/08/2023 | Estado Causa: Fallada-Terminada | Fecha Ubicación: 13/08/2023 | Ubicación: Corte apelaciones
ISAPRE CRUZ BLANCA S.A.;96501450-0;Recurrido;C.A. de Concepción;Rol: Protección-16448-2023 | Corte: C.A. de Concepción | Caratulado: CONSTANZA DEL PILAR VENEGAS SÁNCHEZ/ISAPRE CRUZ BLANCA S.A. (PR15) | Fecha Ingreso: 13/08/2023 | Estado Causa: Fallada-Terminada | Fecha Ubicación: 13/08/2023 | Ubicación: Corte apelaciones
ERIC ADOLFO URREA ARAYA;16690641-5;Ab.Recurrente;C.A. de Concepción;Rol: Contencioso Administrativo-33-2023 | Corte: C.A. de Concepción | Caratulado: Soliz/DELEGACIÓN PRESIDENCIAL REGIONAL DE TARAPACA | Fecha Ingreso: 13/08/2023 | Estado Causa: Fallada-Terminada | Fecha Ubicación: 13/08/2023 | Ubicación: Corte apelaciones
CARMEN CAROLA SOLIZ FICHER;0-0;Recurrente;C.A. de Concepción;Rol: Contencioso Administrativo-33-2023 | Corte: C.A. de Concepción | Caratulado: Soliz/DELEGACIÓN PRESIDENCIAL REGIONAL DE TARAPACA | Fecha Ingreso: 13/08/2023 | Estado Causa: Fallada-Terminada | Fecha Ubicación: 13/08/2023 | Ubicación: Corte apelaciones
DELEGACIÓN PRESIDENCIAL REGIONAL DE TARAPACA;60511010-K;Recurrido;C.A. de Concepción;Rol: Contencioso Administrativo-33-2023 | Corte: C.A. de Concepción | Caratulado: Soliz/DELEGACIÓN PRESIDENCIAL REGIONAL DE TARAPACA | Fecha Ingreso: 13/08/2023 | Estado Causa: Fallada-Terminada | Fecha Ubicación: 13/08/2023 | Ubicación: Corte apelaciones
