NOMBRE;DOCUMENTO;CARGO;INSTITUCION;OBSERVACIONES
RONALD RIGOBERTO HERNANDEZ BETANCOURT;26445918-4;Recurrente;C.A. de San Miguel;Rol: Protección-418-2021 | Corte: C.A. de San Miguel | Caratulado: HERNANDEZ/SUBSECRETARÍA DEL INTERIOR, DEPARTAMENTO DE EXTRANJERÍA Y MIGRACIÓN | Fecha Ingreso: 04/04/2021 | Estado Causa: Fallada-Terminada | Fecha Ubicación: 15/03/0022 | Ubicación: Archivo
SUBSECRETARÍA DEL INTERIOR, DEPARTAMENTO DE EXTRANJERÍA Y MIGRACIÓN;60501000-8;Recurrido;C.A. de San Miguel;Rol: Protección-418-2021 | Corte: C.A. de San Miguel | Caratulado: HERNANDEZ/SUBSECRETARÍA DEL INTERIOR, DEPARTAMENTO DE EXTRANJERÍA Y MIGRACIÓN | Fecha Ingreso: 04/04/2021 | Estado Causa: Fallada-Terminada | Fecha Ubicación: 15/03/0022 | Ubicación: Archivo
GABRIEL EDGARDO BENNETT MONTOYA;17599238-3;Ab. Recurrido;C.A. de San Miguel;Rol: Protección-418-2021 | Corte: C.A. de San Miguel | Caratulado: HERNANDEZ/SUBSECRETARÍA DEL INTERIOR, DEPARTAMENTO DE EXTRANJERÍA Y MIGRACIÓN | Fecha Ingreso: 04/04/2021 | Estado Causa: Fallada-Terminada | Fecha Ubicación: 15/03/0022 | Ubicación: Archivo
ANTONIO EMILIO HENRÍQUEZ BELTRÁN;18122390-1;Ab. Recurrido;C.A. de San Miguel;Rol: Protección-418-2021 | Corte: C.A. de San Miguel | Caratulado: HERNANDEZ/SUBSECRETARÍA DEL INTERIOR, DEPARTAMENTO DE EXTRANJERÍA Y MIGRACIÓN | Fecha Ingreso: 04/04/2021 | Estado Causa: Fallada-Terminada | Fecha Ubicación: 15/03/0022 | Ubicación: Archivo
ALMAZARA SANTA ROSA SPA;76810736-K;Recurrente;C.A. de San Miguel;Rol: Protección-419-2021 | Corte: C.A. de San Miguel | Caratulado: ALMAZARA SANTA ROSA SPA/CONTRALORÍA REGIONAL | Fecha Ingreso: 04/04/2021 | Estado Causa: Fallada-Terminada | Fecha Ubicación: 08/11/0021 | Ubicación: Corte Suprema
JUAN ENRIQUE COEYMANS ZABALA;13830780-8;Ab.Recurrente;C.A. de San Miguel;Rol: Protección-419-2021 | Corte: C.A. de San Miguel | Caratulado: ALMAZARA SANTA ROSA SPA/CONTRALORÍA REGIONAL | Fecha Ingreso: 04/04/2021 | Estado Causa: Fallada-Terminada | Fecha Ubicación: 08/11/0021 | Ubicación: Corte Suprema
MARÍA JOSÉ BERGER GARCÍA;16937811-8;Ab.Recurrente;C.A. de San Miguel;Rol: Protección-419-2021 | Corte: C.A. de San Miguel | Caratulado: ALMAZARA SANTA ROSA SPA/CONTRALORÍA REGIONAL | Fecha Ingreso: 04/04/2021 | Estado Causa: Fallada-Terminada | Fecha Ubicación: 08/11/0021 | Ubicación: Corte Suprema
CONTRALORÍA REGIONAL;60400000-9;Recurrido;C.A. de San Miguel;Rol: Protección-419-2021 | Corte: C.A. de San Miguel | Caratulado: ALMAZARA SANTA ROSA SPA/CONTRALORÍA REGIONAL | Fecha Ingreso: 04/04/2021 | Estado Causa: Fallada-Terminada | Fecha Ubicación: 08/11/0021 | Ubicación: Corte Suprema
