NOMBRE;DOCUMENTO;CARGO;INSTITUCION;OBSERVACIONES
SOCIEDAD ADMINISTRADORA DE FONDOS DE CESANTIA DE CHILE II S.A.;76237243-6;DTE.;1º Juzgado de Letras de Puerto Varas;RIT: P-480-2021 | Tribunal: 1º Juzgado de Letras de Puerto Varas | Caratulado: ADM. DE FONDOS DE CESANTIA CHILE II S.A. CON CHILE SEAF | Fecha Ingreso: 17/06/2021 | Estado Procesal: Tramitación | RIT: P-480-2021 | Fecha Ing.: 17/06/2021 | RUC: 21- 3-0139234-3 | Est. Adm.: Sin archivar | Proc.: Ejecutivo Previsional | Forma Inicio.: Demanda | Estado Proc.: Tramitación | Etapa: Ingreso | Titulo Ejec.:  | Juez Asignado: RUBY YÁÑEZ KINZEL | Tribunal: 1º Juzgado de Letras de Puerto Varas
CHILE SEAFOODS COMERCIAL S P A;76053525-7;DDO.;1º Juzgado de Letras de Puerto Varas;RIT: P-480-2021 | Tribunal: 1º Juzgado de Letras de Puerto Varas | Caratulado: ADM. DE FONDOS DE CESANTIA CHILE II S.A. CON CHILE SEAF | Fecha Ingreso: 17/06/2021 | Estado Procesal: Tramitación | RIT: P-480-2021 | Fecha Ing.: 17/06/2021 | RUC: 21- 3-0139234-3 | Est. Adm.: Sin archivar | Proc.: Ejecutivo Previsional | Forma Inicio.: Demanda | Estado Proc.: Tramitación | Etapa: Ingreso | Titulo Ejec.:  | Juez Asignado: RUBY YÁÑEZ KINZEL | Tribunal: 1º Juzgado de Letras de Puerto Varas
Raúl Horacio Troncoso Delpiano;7072258-5;AB.DTE;1º Juzgado de Letras de Puerto Varas;RIT: P-480-2021 | Tribunal: 1º Juzgado de Letras de Puerto Varas | Caratulado: ADM. DE FONDOS DE CESANTIA CHILE II S.A. CON CHILE SEAF | Fecha Ingreso: 17/06/2021 | Estado Procesal: Tramitación | RIT: P-480-2021 | Fecha Ing.: 17/06/2021 | RUC: 21- 3-0139234-3 | Est. Adm.: Sin archivar | Proc.: Ejecutivo Previsional | Forma Inicio.: Demanda | Estado Proc.: Tramitación | Etapa: Ingreso | Titulo Ejec.:  | Juez Asignado: RUBY YÁÑEZ KINZEL | Tribunal: 1º Juzgado de Letras de Puerto Varas
A.F.P UNO S.A;76960424-3;DTE.;1º Juzgado de Letras de Puerto Varas;RIT: P-461-2021 | Tribunal: 1º Juzgado de Letras de Puerto Varas | Caratulado: A.F.P UNO S.A/VILLARROEL | Fecha Ingreso: 14/06/2021 | Estado Procesal: Concluido | RIT: P-461-2021 | Fecha Ing.: 14/06/2021 | RUC: 21- 3-0136882-5 | Est. Adm.: Archivada | Proc.: Ejecutivo Previsional | Forma Inicio.: Demanda | Estado Proc.: Concluido | Etapa: Terminada | Titulo Ejec.:  | Juez Asignado: RUBY YÁÑEZ KINZEL | Tribunal: 1º Juzgado de Letras de Puerto Varas
JUAN MOISÉS VILLARROEL VARGAS;13824432-6;DDO.;1º Juzgado de Letras de Puerto Varas;RIT: P-461-2021 | Tribunal: 1º Juzgado de Letras de Puerto Varas | Caratulado: A.F.P UNO S.A/VILLARROEL | Fecha Ingreso: 14/06/2021 | Estado Procesal: Concluido | RIT: P-461-2021 | Fecha Ing.: 14/06/2021 | RUC: 21- 3-0136882-5 | Est. Adm.: Archivada | Proc.: Ejecutivo Previsional | Forma Inicio.: Demanda | Estado Proc.: Concluido | Etapa: Terminada | Titulo Ejec.:  | Juez Asignado: RUBY YÁÑEZ KINZEL | Tribunal: 1º Juzgado de Letras de Puerto Varas
MANUEL JESÚS FIGUEROA SAAVEDRA;2415267-7;AB.DTE;1º Juzgado de Letras de Puerto Varas;RIT: P-461-2021 | Tribunal: 1º Juzgado de Letras de Puerto Varas | Caratulado: A.F.P UNO S.A/VILLARROEL | Fecha Ingreso: 14/06/2021 | Estado Procesal: Concluido | RIT: P-461-2021 | Fecha Ing.: 14/06/2021 | RUC: 21- 3-0136882-5 | Est. Adm.: Archivada | Proc.: Ejecutivo Previsional | Forma Inicio.: Demanda | Estado Proc.: Concluido | Etapa: Terminada | Titulo Ejec.:  | Juez Asignado: RUBY YÁÑEZ KINZEL | Tribunal: 1º Juzgado de Letras de Puerto Varas
