NOMBRE;DOCUMENTO;CARGO;INSTITUCION;OBSERVACIONES
Administradora de Fondos de Pensiones Habitat;98000100-8;DTE.;Juzgado de Letras y Garantía de Pucón;RIT: E-46-2021 | Tribunal: Juzgado de Letras y Garantía de Pucón | Caratulado: A.F.P. HABITAT S.A. CON COMERCIALIZADORA E INMOBILIARIA | Fecha Ingreso: 30/11/2021 | Estado Procesal: Concluido | RIT: E-46-2021 | Fecha Ing.: 30/11/2021 | RUC: 17- 3-0096092-8 | Est. Adm.: Archivada | Proc.: Exhorto | Forma Inicio.: Exhorto | Estado Proc.: Concluido | Etapa: Terminada | Titulo Ejec.:  | Juez Asignado: ANJA CONSTANCE WENDT HELLE | Tribunal: Juzgado de Letras y Garantía de Pucón
COMERCIALIZADORA E INMOBILIARIA RICARDO CRISTOBAL;76052003-9;DDO.;Juzgado de Letras y Garantía de Pucón;RIT: E-46-2021 | Tribunal: Juzgado de Letras y Garantía de Pucón | Caratulado: A.F.P. HABITAT S.A. CON COMERCIALIZADORA E INMOBILIARIA | Fecha Ingreso: 30/11/2021 | Estado Procesal: Concluido | RIT: E-46-2021 | Fecha Ing.: 30/11/2021 | RUC: 17- 3-0096092-8 | Est. Adm.: Archivada | Proc.: Exhorto | Forma Inicio.: Exhorto | Estado Proc.: Concluido | Etapa: Terminada | Titulo Ejec.:  | Juez Asignado: ANJA CONSTANCE WENDT HELLE | Tribunal: Juzgado de Letras y Garantía de Pucón
Manuel Jesus Figueroa Saavedra;2415267-7;AB.DTE;Juzgado de Letras y Garantía de Pucón;RIT: E-46-2021 | Tribunal: Juzgado de Letras y Garantía de Pucón | Caratulado: A.F.P. HABITAT S.A. CON COMERCIALIZADORA E INMOBILIARIA | Fecha Ingreso: 30/11/2021 | Estado Procesal: Concluido | RIT: E-46-2021 | Fecha Ing.: 30/11/2021 | RUC: 17- 3-0096092-8 | Est. Adm.: Archivada | Proc.: Exhorto | Forma Inicio.: Exhorto | Estado Proc.: Concluido | Etapa: Terminada | Titulo Ejec.:  | Juez Asignado: ANJA CONSTANCE WENDT HELLE | Tribunal: Juzgado de Letras y Garantía de Pucón
Antonio Ricardo Alamos Avendano;8270154-0;AB.DTE;Juzgado de Letras y Garantía de Pucón;RIT: E-46-2021 | Tribunal: Juzgado de Letras y Garantía de Pucón | Caratulado: A.F.P. HABITAT S.A. CON COMERCIALIZADORA E INMOBILIARIA | Fecha Ingreso: 30/11/2021 | Estado Procesal: Concluido | RIT: E-46-2021 | Fecha Ing.: 30/11/2021 | RUC: 17- 3-0096092-8 | Est. Adm.: Archivada | Proc.: Exhorto | Forma Inicio.: Exhorto | Estado Proc.: Concluido | Etapa: Terminada | Titulo Ejec.:  | Juez Asignado: ANJA CONSTANCE WENDT HELLE | Tribunal: Juzgado de Letras y Garantía de Pucón
SOCIEDAD ADMINISTRADORA DE FONDOS DE CESANTIA DE CHILE II S.A.;76237243-6;DTE.;Juzgado de Letras y Garantía de Pucón;RIT: P-132-2021 | Tribunal: Juzgado de Letras y Garantía de Pucón | Caratulado: ADM. DE FONDOS DE CESANTIA CHILE II S.A. CON INVERSIONE | Fecha Ingreso: 26/11/2021 | Estado Procesal: Tramitación | RIT: P-132-2021 | Fecha Ing.: 26/11/2021 | RUC: 21- 3-0247610-9 | Est. Adm.: Sin archivar | Proc.: Ejecutivo Previsional | Forma Inicio.: Demanda | Estado Proc.: Tramitación | Etapa: Ingreso | Titulo Ejec.:  | Juez Asignado: ANJA CONSTANCE WENDT HELLE | Tribunal: Juzgado de Letras y Garantía de Pucón
INVERSIONES Y CONSTRUCCIONES DECOLACUSTRE II SPA;77147655-4;DDO.;Juzgado de Letras y Garantía de Pucón;RIT: P-132-2021 | Tribunal: Juzgado de Letras y Garantía de Pucón | Caratulado: ADM. DE FONDOS DE CESANTIA CHILE II S.A. CON INVERSIONE | Fecha Ingreso: 26/11/2021 | Estado Procesal: Tramitación | RIT: P-132-2021 | Fecha Ing.: 26/11/2021 | RUC: 21- 3-0247610-9 | Est. Adm.: Sin archivar | Proc.: Ejecutivo Previsional | Forma Inicio.: Demanda | Estado Proc.: Tramitación | Etapa: Ingreso | Titulo Ejec.:  | Juez Asignado: ANJA CONSTANCE WENDT HELLE | Tribunal: Juzgado de Letras y Garantía de Pucón
Raúl Horacio Troncoso Delpiano;7072258-5;AB.DTE;Juzgado de Letras y Garantía de Pucón;RIT: P-132-2021 | Tribunal: Juzgado de Letras y Garantía de Pucón | Caratulado: ADM. DE FONDOS DE CESANTIA CHILE II S.A. CON INVERSIONE | Fecha Ingreso: 26/11/2021 | Estado Procesal: Tramitación | RIT: P-132-2021 | Fecha Ing.: 26/11/2021 | RUC: 21- 3-0247610-9 | Est. Adm.: Sin archivar | Proc.: Ejecutivo Previsional | Forma Inicio.: Demanda | Estado Proc.: Tramitación | Etapa: Ingreso | Titulo Ejec.:  | Juez Asignado: ANJA CONSTANCE WENDT HELLE | Tribunal: Juzgado de Letras y Garantía de Pucón
