NOMBRE;DOCUMENTO;CARGO;INSTITUCION;OBSERVACIONES
FRANCISCA ANDREA ALLENDE BELMAR;15497147-5;Recurrente;C.A. de Talca;Rol: Protección-240-2021 | Corte: C.A. de Talca | Caratulado: ALLENDE/BANCO FALABELLA | Fecha Ingreso: 04/04/2021 | Estado Causa: Fallada-Terminada | Fecha Ubicación: 04/04/2021 | Ubicación: Archivo
BANCO FALABELLA;96509660-4;Recurrido;C.A. de Talca;Rol: Protección-240-2021 | Corte: C.A. de Talca | Caratulado: ALLENDE/BANCO FALABELLA | Fecha Ingreso: 04/04/2021 | Estado Causa: Fallada-Terminada | Fecha Ubicación: 04/04/2021 | Ubicación: Archivo
COMISIÓN PARA EL MERCADO FINANCIERO;60810000-8;OTRO;C.A. de Talca;Rol: Protección-240-2021 | Corte: C.A. de Talca | Caratulado: ALLENDE/BANCO FALABELLA | Fecha Ingreso: 04/04/2021 | Estado Causa: Fallada-Terminada | Fecha Ubicación: 04/04/2021 | Ubicación: Archivo
MARÍA FERNANDA CASTRO FERRADA;17410576-6;Ab.Recurrente;C.A. de Talca;Rol: Protección-241-2021 | Corte: C.A. de Talca | Caratulado: MONTERO/ISAPRE BANMEDICA S.A. | Fecha Ingreso: 04/04/2021 | Estado Causa: Fallada-Terminada | Fecha Ubicación: 04/04/2021 | Ubicación: Para archivo en Corte de Apelaciones
NOELIA ANDREA MONTERO MUÑOZ;16457199-8;Recurrente;C.A. de Talca;Rol: Protección-241-2021 | Corte: C.A. de Talca | Caratulado: MONTERO/ISAPRE BANMEDICA S.A. | Fecha Ingreso: 04/04/2021 | Estado Causa: Fallada-Terminada | Fecha Ubicación: 04/04/2021 | Ubicación: Para archivo en Corte de Apelaciones
ISAPRE BANMEDICA S.A.;96572800-7;Recurrido;C.A. de Talca;Rol: Protección-241-2021 | Corte: C.A. de Talca | Caratulado: MONTERO/ISAPRE BANMEDICA S.A. | Fecha Ingreso: 04/04/2021 | Estado Causa: Fallada-Terminada | Fecha Ubicación: 04/04/2021 | Ubicación: Para archivo en Corte de Apelaciones
OMAR DANIEL MATUS DE LA PARRA SARDA;6978398-8;Ab. Recurrido;C.A. de Talca;Rol: Protección-241-2021 | Corte: C.A. de Talca | Caratulado: MONTERO/ISAPRE BANMEDICA S.A. | Fecha Ingreso: 04/04/2021 | Estado Causa: Fallada-Terminada | Fecha Ubicación: 04/04/2021 | Ubicación: Para archivo en Corte de Apelaciones
