NOMBRE;DOCUMENTO;CARGO;INSTITUCION;OBSERVACIONES
SUSAN ANGELINA CALDERÓN CHOPPELO;12436792-1;Ab.Recurrente;C.A. de Arica;Rol: Protección-313-2023 | Corte: C.A. de Arica | Caratulado: LAZCANO/BANCO DEL ESTADO DE CHILE | Fecha Ingreso: 20/08/2023 | Estado Causa: Fallada-Terminada | Fecha Ubicación: 10/01/2024 | Ubicación: Archivo
MARIO HUMBERTO LAZCANO BRUNA;13226890-8;Recurrente;C.A. de Arica;Rol: Protección-313-2023 | Corte: C.A. de Arica | Caratulado: LAZCANO/BANCO DEL ESTADO DE CHILE | Fecha Ingreso: 20/08/2023 | Estado Causa: Fallada-Terminada | Fecha Ubicación: 10/01/2024 | Ubicación: Archivo
BANCO DEL ESTADO DE CHILE;97030000-7;Recurrido;C.A. de Arica;Rol: Protección-313-2023 | Corte: C.A. de Arica | Caratulado: LAZCANO/BANCO DEL ESTADO DE CHILE | Fecha Ingreso: 20/08/2023 | Estado Causa: Fallada-Terminada | Fecha Ubicación: 10/01/2024 | Ubicación: Archivo
VÍCTOR ANDRÉS ACEVEDO LÉNIZ;14206294-1;Ab. Recurrido;C.A. de Arica;Rol: Protección-313-2023 | Corte: C.A. de Arica | Caratulado: LAZCANO/BANCO DEL ESTADO DE CHILE | Fecha Ingreso: 20/08/2023 | Estado Causa: Fallada-Terminada | Fecha Ubicación: 10/01/2024 | Ubicación: Archivo
CLAUDIO SALDIAS NOVOA;0-0;Recurrente;C.A. de Arica;Rol: Protección-314-2023 | Corte: C.A. de Arica | Caratulado: CLAUDIO SALDIAS NOVOA CONTRA PRIMERA COMPAÑIA DE FUSILEROS BLINDADA DEL BATALLON BULNES N°27 | Fecha Ingreso: 20/08/2023 | Estado Causa: Fallada-Terminada | Fecha Ubicación: 20/08/2023 | Ubicación: Archivo
CRISTIAN ANDRÉS OPAZO OTÁROLA;14603116-1;Ab.Recurrente;C.A. de Arica;Rol: Protección-314-2023 | Corte: C.A. de Arica | Caratulado: CLAUDIO SALDIAS NOVOA CONTRA PRIMERA COMPAÑIA DE FUSILEROS BLINDADA DEL BATALLON BULNES N°27 | Fecha Ingreso: 20/08/2023 | Estado Causa: Fallada-Terminada | Fecha Ubicación: 20/08/2023 | Ubicación: Archivo
PRIMERA COMPAÑIA DE FUSILEROS BLINDADA DEL BATALLON;0-0;Recurrido;C.A. de Arica;Rol: Protección-314-2023 | Corte: C.A. de Arica | Caratulado: CLAUDIO SALDIAS NOVOA CONTRA PRIMERA COMPAÑIA DE FUSILEROS BLINDADA DEL BATALLON BULNES N°27 | Fecha Ingreso: 20/08/2023 | Estado Causa: Fallada-Terminada | Fecha Ubicación: 20/08/2023 | Ubicación: Archivo
