NOMBRE;DOCUMENTO;CARGO;INSTITUCION;OBSERVACIONES
PETER REYNALDO TOLEDO VERA;10636185-1;Recurrente;C.A. de Iquique;Rol: Protección-458-2023 | Corte: C.A. de Iquique | Caratulado: TOLEDO VERA/ISAPRE BANMEDICA S.A. | Fecha Ingreso: 29/04/2023 | Estado Causa: Fallada-Terminada | Fecha Ubicación: 29/04/2023 | Ubicación: Corte apelaciones
ISAPRE BANMEDICA S.A.;96572800-7;Recurrido;C.A. de Iquique;Rol: Protección-458-2023 | Corte: C.A. de Iquique | Caratulado: TOLEDO VERA/ISAPRE BANMEDICA S.A. | Fecha Ingreso: 29/04/2023 | Estado Causa: Fallada-Terminada | Fecha Ubicación: 29/04/2023 | Ubicación: Corte apelaciones
LUIS ALEXIS CANALES CABELLOS;17980522-7;Ab.Recurrente;C.A. de Iquique;Rol: Protección-458-2023 | Corte: C.A. de Iquique | Caratulado: TOLEDO VERA/ISAPRE BANMEDICA S.A. | Fecha Ingreso: 29/04/2023 | Estado Causa: Fallada-Terminada | Fecha Ubicación: 29/04/2023 | Ubicación: Corte apelaciones
GIPSY GREIS VARAS HERNÁNDEZ;17431166-8;Ab.Recurrente;C.A. de Iquique;Rol: Protección-459-2023 | Corte: C.A. de Iquique | Caratulado: GÓMEZ/ISAPRE CRUZBLANCA S.A. | Fecha Ingreso: 29/04/2023 | Estado Causa: Fallada-Terminada | Fecha Ubicación: 29/04/2023 | Ubicación: Corte apelaciones
CRISTIAN ALEXIS GÓMEZ REED;13009721-9;Recurrente;C.A. de Iquique;Rol: Protección-459-2023 | Corte: C.A. de Iquique | Caratulado: GÓMEZ/ISAPRE CRUZBLANCA S.A. | Fecha Ingreso: 29/04/2023 | Estado Causa: Fallada-Terminada | Fecha Ubicación: 29/04/2023 | Ubicación: Corte apelaciones
ISAPRE CRUZBLANCA S.A.;96501450-0;Recurrido;C.A. de Iquique;Rol: Protección-459-2023 | Corte: C.A. de Iquique | Caratulado: GÓMEZ/ISAPRE CRUZBLANCA S.A. | Fecha Ingreso: 29/04/2023 | Estado Causa: Fallada-Terminada | Fecha Ubicación: 29/04/2023 | Ubicación: Corte apelaciones
