NOMBRE;DOCUMENTO;CARGO;INSTITUCION;OBSERVACIONES
GLADYS ESTELLA CHAVARRIA LONDOÑO;0-0;Recurrente;C.A. de Puerto Montt;Rol: Protección-663-2023 | Corte: C.A. de Puerto Montt | Caratulado: CHAVARRIA/SERVICIO NACIONAL DE MIGRACIONES | Fecha Ingreso: 30/04/2023 | Estado Causa: Fallada-Terminada | Fecha Ubicación: 30/04/2023 | Ubicación: Corte apelaciones
JUAN CARLOS BASCUÑÁN LIZANA;17597249-8;Ab.Recurrente;C.A. de Puerto Montt;Rol: Protección-663-2023 | Corte: C.A. de Puerto Montt | Caratulado: CHAVARRIA/SERVICIO NACIONAL DE MIGRACIONES | Fecha Ingreso: 30/04/2023 | Estado Causa: Fallada-Terminada | Fecha Ubicación: 30/04/2023 | Ubicación: Corte apelaciones
SERVICIO NACIONAL DE MIGRACIONES;62000920-2;Recurrido;C.A. de Puerto Montt;Rol: Protección-663-2023 | Corte: C.A. de Puerto Montt | Caratulado: CHAVARRIA/SERVICIO NACIONAL DE MIGRACIONES | Fecha Ingreso: 30/04/2023 | Estado Causa: Fallada-Terminada | Fecha Ubicación: 30/04/2023 | Ubicación: Corte apelaciones
EVA CAROLA URRIAGA BAHAMONDES;13848600-1;Recurrente;C.A. de Puerto Montt;Rol: Protección-664-2023 | Corte: C.A. de Puerto Montt | Caratulado: URRIAGA/ISAPRE BANMÉDICA S.A. | Fecha Ingreso: 30/04/2023 | Estado Causa: Fallada-Terminada | Fecha Ubicación: 30/04/2023 | Ubicación: Corte apelaciones
ISAPRE BANMÉDICA S.A.;96572800-7;Recurrido;C.A. de Puerto Montt;Rol: Protección-664-2023 | Corte: C.A. de Puerto Montt | Caratulado: URRIAGA/ISAPRE BANMÉDICA S.A. | Fecha Ingreso: 30/04/2023 | Estado Causa: Fallada-Terminada | Fecha Ubicación: 30/04/2023 | Ubicación: Corte apelaciones
MARÍA JOSÉ SALINAS PADILLA;14122778-5;Ab.Recurrente;C.A. de Puerto Montt;Rol: Protección-664-2023 | Corte: C.A. de Puerto Montt | Caratulado: URRIAGA/ISAPRE BANMÉDICA S.A. | Fecha Ingreso: 30/04/2023 | Estado Causa: Fallada-Terminada | Fecha Ubicación: 30/04/2023 | Ubicación: Corte apelaciones
