NOMBRE;DOCUMENTO;CARGO;INSTITUCION;OBSERVACIONES
Administradora de Fondos de Pensiones Cuprum S.A.;76240079-0;DTE.;Jdo. de Letras y Garantía de Alto Hospicio;RIT: P-49-2021 | Tribunal: Jdo. de Letras y Garantía de Alto Hospicio | Caratulado: A.F.P. CUPRUM S.A. CON RUBEN PLAZA TIRADO OBRAS CIVILES | Fecha Ingreso: 22/03/2021 | Estado Procesal: Concluido | RIT: P-49-2021 | Fecha Ing.: 22/03/2021 | RUC: 21- 3-0061276-5 | Est. Adm.: Sin archivar | Proc.: Ejecutivo Previsional | Forma Inicio.: Demanda | Estado Proc.: Concluido | Etapa: Terminada | Titulo Ejec.:  | Juez Asignado: DANIELLA ANDREA PINTO CORTES | Tribunal: Jdo. de Letras y Garantía de Alto Hospicio
RUBEN PLAZA TIRADO OBRAS CIVILES Y VENTA DE ARIDOS;76733838-4;DDO.;Jdo. de Letras y Garantía de Alto Hospicio;RIT: P-49-2021 | Tribunal: Jdo. de Letras y Garantía de Alto Hospicio | Caratulado: A.F.P. CUPRUM S.A. CON RUBEN PLAZA TIRADO OBRAS CIVILES | Fecha Ingreso: 22/03/2021 | Estado Procesal: Concluido | RIT: P-49-2021 | Fecha Ing.: 22/03/2021 | RUC: 21- 3-0061276-5 | Est. Adm.: Sin archivar | Proc.: Ejecutivo Previsional | Forma Inicio.: Demanda | Estado Proc.: Concluido | Etapa: Terminada | Titulo Ejec.:  | Juez Asignado: DANIELLA ANDREA PINTO CORTES | Tribunal: Jdo. de Letras y Garantía de Alto Hospicio
Francisco Tocornal Fuenzalida;8352676-9;AB.DTE;Jdo. de Letras y Garantía de Alto Hospicio;RIT: P-49-2021 | Tribunal: Jdo. de Letras y Garantía de Alto Hospicio | Caratulado: A.F.P. CUPRUM S.A. CON RUBEN PLAZA TIRADO OBRAS CIVILES | Fecha Ingreso: 22/03/2021 | Estado Procesal: Concluido | RIT: P-49-2021 | Fecha Ing.: 22/03/2021 | RUC: 21- 3-0061276-5 | Est. Adm.: Sin archivar | Proc.: Ejecutivo Previsional | Forma Inicio.: Demanda | Estado Proc.: Concluido | Etapa: Terminada | Titulo Ejec.:  | Juez Asignado: DANIELLA ANDREA PINTO CORTES | Tribunal: Jdo. de Letras y Garantía de Alto Hospicio
Administradora de Fondos de Pensiones Habitat;98000100-8;DTE.;Jdo. de Letras y Garantía de Alto Hospicio;RIT: P-46-2021 | Tribunal: Jdo. de Letras y Garantía de Alto Hospicio | Caratulado: A.F.P. HABITAT S.A. CON TRANSPORTE,DISTRIBUIDORA Y COME | Fecha Ingreso: 19/03/2021 | Estado Procesal: Tramitación | RIT: P-46-2021 | Fecha Ing.: 19/03/2021 | RUC: 21- 3-0059613-1 | Est. Adm.: Sin archivar | Proc.: Ejecutivo Previsional | Forma Inicio.: Demanda | Estado Proc.: Tramitación | Etapa: Ingreso | Titulo Ejec.:  | Juez Asignado: RAUL FERNANDO SANTANDER PADILLA | Tribunal: Jdo. de Letras y Garantía de Alto Hospicio
TRANSPORTE,DISTRIBUIDORA Y COMERCIALIZADORA JUAN C;76033228-3;DDO.;Jdo. de Letras y Garantía de Alto Hospicio;RIT: P-46-2021 | Tribunal: Jdo. de Letras y Garantía de Alto Hospicio | Caratulado: A.F.P. HABITAT S.A. CON TRANSPORTE,DISTRIBUIDORA Y COME | Fecha Ingreso: 19/03/2021 | Estado Procesal: Tramitación | RIT: P-46-2021 | Fecha Ing.: 19/03/2021 | RUC: 21- 3-0059613-1 | Est. Adm.: Sin archivar | Proc.: Ejecutivo Previsional | Forma Inicio.: Demanda | Estado Proc.: Tramitación | Etapa: Ingreso | Titulo Ejec.:  | Juez Asignado: RAUL FERNANDO SANTANDER PADILLA | Tribunal: Jdo. de Letras y Garantía de Alto Hospicio
Francisco Tocornal Fuenzalida;8352676-9;AB.DTE;Jdo. de Letras y Garantía de Alto Hospicio;RIT: P-46-2021 | Tribunal: Jdo. de Letras y Garantía de Alto Hospicio | Caratulado: A.F.P. HABITAT S.A. CON TRANSPORTE,DISTRIBUIDORA Y COME | Fecha Ingreso: 19/03/2021 | Estado Procesal: Tramitación | RIT: P-46-2021 | Fecha Ing.: 19/03/2021 | RUC: 21- 3-0059613-1 | Est. Adm.: Sin archivar | Proc.: Ejecutivo Previsional | Forma Inicio.: Demanda | Estado Proc.: Tramitación | Etapa: Ingreso | Titulo Ejec.:  | Juez Asignado: RAUL FERNANDO SANTANDER PADILLA | Tribunal: Jdo. de Letras y Garantía de Alto Hospicio
