NOMBRE;DOCUMENTO;CARGO;INSTITUCION;OBSERVACIONES
JORGE IGNACIO NÚÑEZ PUGA;18775474-7;Ab.Recurrente;C.A. de Antofagasta;Rol: Protección-6714-2023 | Corte: C.A. de Antofagasta | Caratulado: MILLÁN CID/ISAPRE CONSALUD S.A. | Fecha Ingreso: 13/08/2023 | Estado Causa: Fallada-Terminada | Fecha Ubicación: 13/08/2023 | Ubicación: Corte apelaciones
ISAPRE CONSALUD S.A.;96856780-2;Recurrido;C.A. de Antofagasta;Rol: Protección-6714-2023 | Corte: C.A. de Antofagasta | Caratulado: MILLÁN CID/ISAPRE CONSALUD S.A. | Fecha Ingreso: 13/08/2023 | Estado Causa: Fallada-Terminada | Fecha Ubicación: 13/08/2023 | Ubicación: Corte apelaciones
YOSSELIN PAULINA MILLÁN CID;18076050-4;Recurrente;C.A. de Antofagasta;Rol: Protección-6714-2023 | Corte: C.A. de Antofagasta | Caratulado: MILLÁN CID/ISAPRE CONSALUD S.A. | Fecha Ingreso: 13/08/2023 | Estado Causa: Fallada-Terminada | Fecha Ubicación: 13/08/2023 | Ubicación: Corte apelaciones
RODRIGO ANDRÉS MORENO SILVA;16202973-8;Ab.Recurrente;C.A. de Antofagasta;Rol: Protección-6715-2023 | Corte: C.A. de Antofagasta | Caratulado: ORTEGA/CARABINEROS DE 6TA COMISARIA LAS COMAPAÑIAS | Fecha Ingreso: 13/08/2023 | Estado Causa: Fallada-Terminada | Fecha Ubicación: 12/10/0023 | Ubicación: Corte Suprema
FREDDY DANILO ORTEGA NAVARRO;16483192-2;Recurrente;C.A. de Antofagasta;Rol: Protección-6715-2023 | Corte: C.A. de Antofagasta | Caratulado: ORTEGA/CARABINEROS DE 6TA COMISARIA LAS COMAPAÑIAS | Fecha Ingreso: 13/08/2023 | Estado Causa: Fallada-Terminada | Fecha Ubicación: 12/10/0023 | Ubicación: Corte Suprema
CARABINEROS DE 6TA COMISARIA LAS COMAPAÑIAS;60505000-K;Recurrido;C.A. de Antofagasta;Rol: Protección-6715-2023 | Corte: C.A. de Antofagasta | Caratulado: ORTEGA/CARABINEROS DE 6TA COMISARIA LAS COMAPAÑIAS | Fecha Ingreso: 13/08/2023 | Estado Causa: Fallada-Terminada | Fecha Ubicación: 12/10/0023 | Ubicación: Corte Suprema
PEDRO ANTONIO FUENTES ARAYA;9062051-7;Ab. Recurrido;C.A. de Antofagasta;Rol: Protección-6715-2023 | Corte: C.A. de Antofagasta | Caratulado: ORTEGA/CARABINEROS DE 6TA COMISARIA LAS COMAPAÑIAS | Fecha Ingreso: 13/08/2023 | Estado Causa: Fallada-Terminada | Fecha Ubicación: 12/10/0023 | Ubicación: Corte Suprema
