NOMBRE;DOCUMENTO;CARGO;INSTITUCION;OBSERVACIONES
FELIPE YOSHUA MELO LÓPEZ;17978532-3;AB.DTE;1º Juzgado de Letras de Quillota;RIT: C-17-2024 | Tribunal: 1º Juzgado de Letras de Quillota | Caratulado: INSPECCION DEL TRABAJO DE QUILLOTA CON COMERCIALIZADORA | Fecha Ingreso: 27/05/2024 | Estado Procesal: Sin tramitación | RIT: C-17-2024 | Fecha Ing.: 27/05/2024 | RUC: 23- 4-0484174-2 | Est. Adm.: Archivada | Proc.: Cumplimiento Laboral | Forma Inicio.: Sitla | Estado Proc.: Sin tramitación | Etapa: Embargo | Titulo Ejec.:  | Juez Asignado: ROLANDO ANDRES ALVEAR VALENZUELA | Tribunal: 1º Juzgado de Letras de Quillota
CAMILO VLADIMIR CORTÉS BOSQUES;13086729-4;AB.DDO;1º Juzgado de Letras de Quillota;RIT: C-17-2024 | Tribunal: 1º Juzgado de Letras de Quillota | Caratulado: INSPECCION DEL TRABAJO DE QUILLOTA CON COMERCIALIZADORA | Fecha Ingreso: 27/05/2024 | Estado Procesal: Sin tramitación | RIT: C-17-2024 | Fecha Ing.: 27/05/2024 | RUC: 23- 4-0484174-2 | Est. Adm.: Archivada | Proc.: Cumplimiento Laboral | Forma Inicio.: Sitla | Estado Proc.: Sin tramitación | Etapa: Embargo | Titulo Ejec.:  | Juez Asignado: ROLANDO ANDRES ALVEAR VALENZUELA | Tribunal: 1º Juzgado de Letras de Quillota
COMERCIALIZADORA RANCHO LINDO SPA;77136724-0;DDO.;1º Juzgado de Letras de Quillota;RIT: C-17-2024 | Tribunal: 1º Juzgado de Letras de Quillota | Caratulado: INSPECCION DEL TRABAJO DE QUILLOTA CON COMERCIALIZADORA | Fecha Ingreso: 27/05/2024 | Estado Procesal: Sin tramitación | RIT: C-17-2024 | Fecha Ing.: 27/05/2024 | RUC: 23- 4-0484174-2 | Est. Adm.: Archivada | Proc.: Cumplimiento Laboral | Forma Inicio.: Sitla | Estado Proc.: Sin tramitación | Etapa: Embargo | Titulo Ejec.:  | Juez Asignado: ROLANDO ANDRES ALVEAR VALENZUELA | Tribunal: 1º Juzgado de Letras de Quillota
INSPECCIÓN DEL TRABAJO DE QUILLOTA;61502000-1;DTE.;1º Juzgado de Letras de Quillota;RIT: C-17-2024 | Tribunal: 1º Juzgado de Letras de Quillota | Caratulado: INSPECCION DEL TRABAJO DE QUILLOTA CON COMERCIALIZADORA | Fecha Ingreso: 27/05/2024 | Estado Procesal: Sin tramitación | RIT: C-17-2024 | Fecha Ing.: 27/05/2024 | RUC: 23- 4-0484174-2 | Est. Adm.: Archivada | Proc.: Cumplimiento Laboral | Forma Inicio.: Sitla | Estado Proc.: Sin tramitación | Etapa: Embargo | Titulo Ejec.:  | Juez Asignado: ROLANDO ANDRES ALVEAR VALENZUELA | Tribunal: 1º Juzgado de Letras de Quillota
Administradora de Fondos de Pensiones Capital;98000000-1;DTE.;1º Juzgado de Letras de Quillota;RIT: P-281-2024 | Tribunal: 1º Juzgado de Letras de Quillota | Caratulado: A.F.P. CAPITAL S.A. CON DEPORTES NUTRCION Y SALUD MARIE | Fecha Ingreso: 24/05/2024 | Estado Procesal: Tramitación | RIT: P-281-2024 | Fecha Ing.: 24/05/2024 | RUC: 24- 3-0147684-8 | Est. Adm.: Sin archivar | Proc.: Ejecutivo Previsional | Forma Inicio.: Demanda | Estado Proc.: Tramitación | Etapa: Ingreso | Titulo Ejec.:  | Juez Asignado: ROLANDO ANDRES ALVEAR VALENZUELA | Tribunal: 1º Juzgado de Letras de Quillota
DEPORTES NUTRCION Y SALUD MARIELA SALAZAR MILLON;76050794-6;DDO.;1º Juzgado de Letras de Quillota;RIT: P-281-2024 | Tribunal: 1º Juzgado de Letras de Quillota | Caratulado: A.F.P. CAPITAL S.A. CON DEPORTES NUTRCION Y SALUD MARIE | Fecha Ingreso: 24/05/2024 | Estado Procesal: Tramitación | RIT: P-281-2024 | Fecha Ing.: 24/05/2024 | RUC: 24- 3-0147684-8 | Est. Adm.: Sin archivar | Proc.: Ejecutivo Previsional | Forma Inicio.: Demanda | Estado Proc.: Tramitación | Etapa: Ingreso | Titulo Ejec.:  | Juez Asignado: ROLANDO ANDRES ALVEAR VALENZUELA | Tribunal: 1º Juzgado de Letras de Quillota
Raúl Horacio Troncoso Delpiano;7072258-5;AB.DTE;1º Juzgado de Letras de Quillota;RIT: P-281-2024 | Tribunal: 1º Juzgado de Letras de Quillota | Caratulado: A.F.P. CAPITAL S.A. CON DEPORTES NUTRCION Y SALUD MARIE | Fecha Ingreso: 24/05/2024 | Estado Procesal: Tramitación | RIT: P-281-2024 | Fecha Ing.: 24/05/2024 | RUC: 24- 3-0147684-8 | Est. Adm.: Sin archivar | Proc.: Ejecutivo Previsional | Forma Inicio.: Demanda | Estado Proc.: Tramitación | Etapa: Ingreso | Titulo Ejec.:  | Juez Asignado: ROLANDO ANDRES ALVEAR VALENZUELA | Tribunal: 1º Juzgado de Letras de Quillota
