NOMBRE;DOCUMENTO;CARGO;INSTITUCION;OBSERVACIONES
Administradora de Fondos de Pensiones Cuprum S.A.;76240079-0;DTE.;Juzgado de Letras de Ancud;RIT: P-103-2024 | Tribunal: Juzgado de Letras de Ancud | Caratulado: A.F.P. CUPRUM S.A. CON FERDINANDO ARIEL GIORGIA DÍAZ, O | Fecha Ingreso: 29/05/2024 | Estado Procesal: Tramitación | RIT: P-103-2024 | Fecha Ing.: 29/05/2024 | RUC: 24- 3-0152700-0 | Est. Adm.: Sin archivar | Proc.: Ejecutivo Previsional | Forma Inicio.: Demanda | Estado Proc.: Tramitación | Etapa: Ingreso | Titulo Ejec.:  | Juez Asignado: CAMILA ANDREA DE LA BARRA LUEGMAYER | Tribunal: Juzgado de Letras de Ancud
FERDINANDO ARIEL GIORGIA DÍAZ, OPTICA, EMPRESA INDIVIDUAL DE RESPONSABILIDAD LIM;76372076-4;DDO.;Juzgado de Letras de Ancud;RIT: P-103-2024 | Tribunal: Juzgado de Letras de Ancud | Caratulado: A.F.P. CUPRUM S.A. CON FERDINANDO ARIEL GIORGIA DÍAZ, O | Fecha Ingreso: 29/05/2024 | Estado Procesal: Tramitación | RIT: P-103-2024 | Fecha Ing.: 29/05/2024 | RUC: 24- 3-0152700-0 | Est. Adm.: Sin archivar | Proc.: Ejecutivo Previsional | Forma Inicio.: Demanda | Estado Proc.: Tramitación | Etapa: Ingreso | Titulo Ejec.:  | Juez Asignado: CAMILA ANDREA DE LA BARRA LUEGMAYER | Tribunal: Juzgado de Letras de Ancud
Francisco Tocornal Fuenzalida;8352676-9;AB.DTE;Juzgado de Letras de Ancud;RIT: P-103-2024 | Tribunal: Juzgado de Letras de Ancud | Caratulado: A.F.P. CUPRUM S.A. CON FERDINANDO ARIEL GIORGIA DÍAZ, O | Fecha Ingreso: 29/05/2024 | Estado Procesal: Tramitación | RIT: P-103-2024 | Fecha Ing.: 29/05/2024 | RUC: 24- 3-0152700-0 | Est. Adm.: Sin archivar | Proc.: Ejecutivo Previsional | Forma Inicio.: Demanda | Estado Proc.: Tramitación | Etapa: Ingreso | Titulo Ejec.:  | Juez Asignado: CAMILA ANDREA DE LA BARRA LUEGMAYER | Tribunal: Juzgado de Letras de Ancud
ADMINISTRADORA DE FONDOS DE PENSIONES MODELO;76762250-3;DTE.;Juzgado de Letras de Ancud;RIT: P-101-2024 | Tribunal: Juzgado de Letras de Ancud | Caratulado: A.F.P. MODELO S.A. CON SERV GASTRONOMICOS Y EVENTOS MA | Fecha Ingreso: 24/05/2024 | Estado Procesal: Tramitación | RIT: P-101-2024 | Fecha Ing.: 24/05/2024 | RUC: 24- 3-0148205-8 | Est. Adm.: Sin archivar | Proc.: Ejecutivo Previsional | Forma Inicio.: Demanda | Estado Proc.: Tramitación | Etapa: Ingreso | Titulo Ejec.:  | Juez Asignado: ANDRES CRISTOFER ARTEAGA JARA | Tribunal: Juzgado de Letras de Ancud
SERV GASTRONOMICOS Y EVENTOS MARIA ELIANA MORA GA;77086516-6;DDO.;Juzgado de Letras de Ancud;RIT: P-101-2024 | Tribunal: Juzgado de Letras de Ancud | Caratulado: A.F.P. MODELO S.A. CON SERV GASTRONOMICOS Y EVENTOS MA | Fecha Ingreso: 24/05/2024 | Estado Procesal: Tramitación | RIT: P-101-2024 | Fecha Ing.: 24/05/2024 | RUC: 24- 3-0148205-8 | Est. Adm.: Sin archivar | Proc.: Ejecutivo Previsional | Forma Inicio.: Demanda | Estado Proc.: Tramitación | Etapa: Ingreso | Titulo Ejec.:  | Juez Asignado: ANDRES CRISTOFER ARTEAGA JARA | Tribunal: Juzgado de Letras de Ancud
MANUEL JESUS FIGUEROA SAAVEDRA;2415267-7;AB.DTE;Juzgado de Letras de Ancud;RIT: P-101-2024 | Tribunal: Juzgado de Letras de Ancud | Caratulado: A.F.P. MODELO S.A. CON SERV GASTRONOMICOS Y EVENTOS MA | Fecha Ingreso: 24/05/2024 | Estado Procesal: Tramitación | RIT: P-101-2024 | Fecha Ing.: 24/05/2024 | RUC: 24- 3-0148205-8 | Est. Adm.: Sin archivar | Proc.: Ejecutivo Previsional | Forma Inicio.: Demanda | Estado Proc.: Tramitación | Etapa: Ingreso | Titulo Ejec.:  | Juez Asignado: ANDRES CRISTOFER ARTEAGA JARA | Tribunal: Juzgado de Letras de Ancud
ANTONIO RICARDO ALAMOS AVENDANO;8270154-0;AB.DTE;Juzgado de Letras de Ancud;RIT: P-101-2024 | Tribunal: Juzgado de Letras de Ancud | Caratulado: A.F.P. MODELO S.A. CON SERV GASTRONOMICOS Y EVENTOS MA | Fecha Ingreso: 24/05/2024 | Estado Procesal: Tramitación | RIT: P-101-2024 | Fecha Ing.: 24/05/2024 | RUC: 24- 3-0148205-8 | Est. Adm.: Sin archivar | Proc.: Ejecutivo Previsional | Forma Inicio.: Demanda | Estado Proc.: Tramitación | Etapa: Ingreso | Titulo Ejec.:  | Juez Asignado: ANDRES CRISTOFER ARTEAGA JARA | Tribunal: Juzgado de Letras de Ancud
