NOMBRE;DOCUMENTO;CARGO;INSTITUCION;OBSERVACIONES
JESSICA ANDREA SANZANA FLORES;14067712-4;DTE.;Juzgado de Letras y Garantía de Mulchen;RIT: C-8-2024 | Tribunal: Juzgado de Letras y Garantía de Mulchen | Caratulado: SANZANA/CONEJEROS | Fecha Ingreso: 29/08/2024 | Estado Procesal: Concluido | RIT: C-8-2024 | Fecha Ing.: 29/08/2024 | RUC: 24- 4-0546969-K | Est. Adm.: Sin archivar | Proc.: Cumplimiento Laboral | Forma Inicio.: Sitla | Estado Proc.: Concluido | Etapa: Terminada | Titulo Ejec.:  | Juez Asignado: VICTORIA DANIELA BASTIAS LEIVA | Tribunal: Juzgado de Letras y Garantía de Mulchen
CLAUDIA ANDREA SEGURA INOSTROZA;12131392-8;AB.DTE;Juzgado de Letras y Garantía de Mulchen;RIT: C-8-2024 | Tribunal: Juzgado de Letras y Garantía de Mulchen | Caratulado: SANZANA/CONEJEROS | Fecha Ingreso: 29/08/2024 | Estado Procesal: Concluido | RIT: C-8-2024 | Fecha Ing.: 29/08/2024 | RUC: 24- 4-0546969-K | Est. Adm.: Sin archivar | Proc.: Cumplimiento Laboral | Forma Inicio.: Sitla | Estado Proc.: Concluido | Etapa: Terminada | Titulo Ejec.:  | Juez Asignado: VICTORIA DANIELA BASTIAS LEIVA | Tribunal: Juzgado de Letras y Garantía de Mulchen
SEGUNDO NIVALDO CONEJEROS FERNÁNDEZ;12979636-7;DDO.;Juzgado de Letras y Garantía de Mulchen;RIT: C-8-2024 | Tribunal: Juzgado de Letras y Garantía de Mulchen | Caratulado: SANZANA/CONEJEROS | Fecha Ingreso: 29/08/2024 | Estado Procesal: Concluido | RIT: C-8-2024 | Fecha Ing.: 29/08/2024 | RUC: 24- 4-0546969-K | Est. Adm.: Sin archivar | Proc.: Cumplimiento Laboral | Forma Inicio.: Sitla | Estado Proc.: Concluido | Etapa: Terminada | Titulo Ejec.:  | Juez Asignado: VICTORIA DANIELA BASTIAS LEIVA | Tribunal: Juzgado de Letras y Garantía de Mulchen
JUAN ALEJANDRO MONCADA SALAZAR;13109934-7;AB.DTE;Juzgado de Letras y Garantía de Mulchen;RIT: C-8-2024 | Tribunal: Juzgado de Letras y Garantía de Mulchen | Caratulado: SANZANA/CONEJEROS | Fecha Ingreso: 29/08/2024 | Estado Procesal: Concluido | RIT: C-8-2024 | Fecha Ing.: 29/08/2024 | RUC: 24- 4-0546969-K | Est. Adm.: Sin archivar | Proc.: Cumplimiento Laboral | Forma Inicio.: Sitla | Estado Proc.: Concluido | Etapa: Terminada | Titulo Ejec.:  | Juez Asignado: VICTORIA DANIELA BASTIAS LEIVA | Tribunal: Juzgado de Letras y Garantía de Mulchen
Administradora de Fondos de Pensiones Capital;98000000-1;DTE.;Juzgado de Letras y Garantía de Mulchen;RIT: P-63-2024 | Tribunal: Juzgado de Letras y Garantía de Mulchen | Caratulado: A.F.P. CAPITAL S.A. CON COMERCIALIZADORA BURGOS JARA SP | Fecha Ingreso: 27/08/2024 | Estado Procesal: Concluido | RIT: P-63-2024 | Fecha Ing.: 27/08/2024 | RUC: 24- 3-0236940-9 | Est. Adm.: Sin archivar | Proc.: Ejecutivo Previsional | Forma Inicio.: Demanda | Estado Proc.: Concluido | Etapa: Terminada | Titulo Ejec.:  | Juez Asignado: MARUJA NATALIA CHAVEZ ALVAREZ | Tribunal: Juzgado de Letras y Garantía de Mulchen
COMERCIALIZADORA BURGOS JARA SPA;77027899-6;DDO.;Juzgado de Letras y Garantía de Mulchen;RIT: P-63-2024 | Tribunal: Juzgado de Letras y Garantía de Mulchen | Caratulado: A.F.P. CAPITAL S.A. CON COMERCIALIZADORA BURGOS JARA SP | Fecha Ingreso: 27/08/2024 | Estado Procesal: Concluido | RIT: P-63-2024 | Fecha Ing.: 27/08/2024 | RUC: 24- 3-0236940-9 | Est. Adm.: Sin archivar | Proc.: Ejecutivo Previsional | Forma Inicio.: Demanda | Estado Proc.: Concluido | Etapa: Terminada | Titulo Ejec.:  | Juez Asignado: MARUJA NATALIA CHAVEZ ALVAREZ | Tribunal: Juzgado de Letras y Garantía de Mulchen
Antonio Ricardo Alamos Avendaño;8270154-0;AB.DTE;Juzgado de Letras y Garantía de Mulchen;RIT: P-63-2024 | Tribunal: Juzgado de Letras y Garantía de Mulchen | Caratulado: A.F.P. CAPITAL S.A. CON COMERCIALIZADORA BURGOS JARA SP | Fecha Ingreso: 27/08/2024 | Estado Procesal: Concluido | RIT: P-63-2024 | Fecha Ing.: 27/08/2024 | RUC: 24- 3-0236940-9 | Est. Adm.: Sin archivar | Proc.: Ejecutivo Previsional | Forma Inicio.: Demanda | Estado Proc.: Concluido | Etapa: Terminada | Titulo Ejec.:  | Juez Asignado: MARUJA NATALIA CHAVEZ ALVAREZ | Tribunal: Juzgado de Letras y Garantía de Mulchen
