NOMBRE;DOCUMENTO;CARGO;INSTITUCION;OBSERVACIONES
Administradora de Fondos de Pensiones Habitat;98000100-8;DTE.;Juzgado de Letras de Peñaflor;RIT: P-308-2024 | Tribunal: Juzgado de Letras de Peñaflor | Caratulado: A.F.P. HABITAT S.A. CON GREEN VETS CHILE SERVICIOS VETE | Fecha Ingreso: 09/04/2024 | Estado Procesal: Tramitación | RIT: P-308-2024 | Fecha Ing.: 09/04/2024 | RUC: 24- 3-0103672-4 | Est. Adm.: Sin archivar | Proc.: Ejecutivo Previsional | Forma Inicio.: Demanda | Estado Proc.: Tramitación | Etapa: Ingreso | Titulo Ejec.:  | Juez Asignado: CARLOS EDUARDO JONES FERNANDEZ | Tribunal: Juzgado de Letras de Peñaflor
GREEN VETS CHILE SERVICIOS VETERINARIOS SPA;76323829-6;DDO.;Juzgado de Letras de Peñaflor;RIT: P-308-2024 | Tribunal: Juzgado de Letras de Peñaflor | Caratulado: A.F.P. HABITAT S.A. CON GREEN VETS CHILE SERVICIOS VETE | Fecha Ingreso: 09/04/2024 | Estado Procesal: Tramitación | RIT: P-308-2024 | Fecha Ing.: 09/04/2024 | RUC: 24- 3-0103672-4 | Est. Adm.: Sin archivar | Proc.: Ejecutivo Previsional | Forma Inicio.: Demanda | Estado Proc.: Tramitación | Etapa: Ingreso | Titulo Ejec.:  | Juez Asignado: CARLOS EDUARDO JONES FERNANDEZ | Tribunal: Juzgado de Letras de Peñaflor
Alicia Soto Santaella;3332573-8;AB.DTE;Juzgado de Letras de Peñaflor;RIT: P-308-2024 | Tribunal: Juzgado de Letras de Peñaflor | Caratulado: A.F.P. HABITAT S.A. CON GREEN VETS CHILE SERVICIOS VETE | Fecha Ingreso: 09/04/2024 | Estado Procesal: Tramitación | RIT: P-308-2024 | Fecha Ing.: 09/04/2024 | RUC: 24- 3-0103672-4 | Est. Adm.: Sin archivar | Proc.: Ejecutivo Previsional | Forma Inicio.: Demanda | Estado Proc.: Tramitación | Etapa: Ingreso | Titulo Ejec.:  | Juez Asignado: CARLOS EDUARDO JONES FERNANDEZ | Tribunal: Juzgado de Letras de Peñaflor
Administradora de Fondos de Pensiones Habitat;98000100-8;DTE.;Juzgado de Letras de Peñaflor;RIT: P-306-2024 | Tribunal: Juzgado de Letras de Peñaflor | Caratulado: A.F.P. HABITAT S.A. CON EMBOTELLADORA SAN ISIDRO SA | Fecha Ingreso: 08/04/2024 | Estado Procesal: Concluido | RIT: P-306-2024 | Fecha Ing.: 08/04/2024 | RUC: 24- 3-0102047-K | Est. Adm.: Archivada | Proc.: Ejecutivo Previsional | Forma Inicio.: Demanda | Estado Proc.: Concluido | Etapa: Terminada | Titulo Ejec.:  | Juez Asignado: MARIA LEONOR GEISSE FERNANDEZ | Tribunal: Juzgado de Letras de Peñaflor
EMBOTELLADORA SAN ISIDRO SA;76395669-5;DDO.;Juzgado de Letras de Peñaflor;RIT: P-306-2024 | Tribunal: Juzgado de Letras de Peñaflor | Caratulado: A.F.P. HABITAT S.A. CON EMBOTELLADORA SAN ISIDRO SA | Fecha Ingreso: 08/04/2024 | Estado Procesal: Concluido | RIT: P-306-2024 | Fecha Ing.: 08/04/2024 | RUC: 24- 3-0102047-K | Est. Adm.: Archivada | Proc.: Ejecutivo Previsional | Forma Inicio.: Demanda | Estado Proc.: Concluido | Etapa: Terminada | Titulo Ejec.:  | Juez Asignado: MARIA LEONOR GEISSE FERNANDEZ | Tribunal: Juzgado de Letras de Peñaflor
Alicia Soto Santaella;3332573-8;AB.DTE;Juzgado de Letras de Peñaflor;RIT: P-306-2024 | Tribunal: Juzgado de Letras de Peñaflor | Caratulado: A.F.P. HABITAT S.A. CON EMBOTELLADORA SAN ISIDRO SA | Fecha Ingreso: 08/04/2024 | Estado Procesal: Concluido | RIT: P-306-2024 | Fecha Ing.: 08/04/2024 | RUC: 24- 3-0102047-K | Est. Adm.: Archivada | Proc.: Ejecutivo Previsional | Forma Inicio.: Demanda | Estado Proc.: Concluido | Etapa: Terminada | Titulo Ejec.:  | Juez Asignado: MARIA LEONOR GEISSE FERNANDEZ | Tribunal: Juzgado de Letras de Peñaflor
