NOMBRE;DOCUMENTO;CARGO;INSTITUCION;OBSERVACIONES
JUAN PABLO ABURTO BARAHONA;16371512-0;AB.DTE;Juzgado de Letras y Garantía de Paillaco;RIT: P-52-2023 | Tribunal: Juzgado de Letras y Garantía de Paillaco | Caratulado: INSTITUTO DE PREVISION SOCIALL/LARRAÑAGA | Fecha Ingreso: 18/05/2023 | Estado Procesal: Tramitación | RIT: P-52-2023 | Fecha Ing.: 18/05/2023 | RUC: 23- 3-0126020-2 | Est. Adm.: Sin archivar | Proc.: Ejecutivo Previsional | Forma Inicio.: Demanda | Estado Proc.: Tramitación | Etapa: Ingreso | Titulo Ejec.:  | Juez Asignado: MARCELO ALFONSO SEGURA ESPERGUEL | Tribunal: Juzgado de Letras y Garantía de Paillaco
GENARO ANDRÉS LARRAÑAGA CARRASCO;11970351-4;DDO.;Juzgado de Letras y Garantía de Paillaco;RIT: P-52-2023 | Tribunal: Juzgado de Letras y Garantía de Paillaco | Caratulado: INSTITUTO DE PREVISION SOCIALL/LARRAÑAGA | Fecha Ingreso: 18/05/2023 | Estado Procesal: Tramitación | RIT: P-52-2023 | Fecha Ing.: 18/05/2023 | RUC: 23- 3-0126020-2 | Est. Adm.: Sin archivar | Proc.: Ejecutivo Previsional | Forma Inicio.: Demanda | Estado Proc.: Tramitación | Etapa: Ingreso | Titulo Ejec.:  | Juez Asignado: MARCELO ALFONSO SEGURA ESPERGUEL | Tribunal: Juzgado de Letras y Garantía de Paillaco
INSTITUTO DE PREVISION SOCIALL;61979440-0;DTE.;Juzgado de Letras y Garantía de Paillaco;RIT: P-52-2023 | Tribunal: Juzgado de Letras y Garantía de Paillaco | Caratulado: INSTITUTO DE PREVISION SOCIALL/LARRAÑAGA | Fecha Ingreso: 18/05/2023 | Estado Procesal: Tramitación | RIT: P-52-2023 | Fecha Ing.: 18/05/2023 | RUC: 23- 3-0126020-2 | Est. Adm.: Sin archivar | Proc.: Ejecutivo Previsional | Forma Inicio.: Demanda | Estado Proc.: Tramitación | Etapa: Ingreso | Titulo Ejec.:  | Juez Asignado: MARCELO ALFONSO SEGURA ESPERGUEL | Tribunal: Juzgado de Letras y Garantía de Paillaco
SOCIEDAD ADMINISTRADORA DE FONDOS DE CESANTIA DE CHILE II S.A.;76237243-6;DTE.;Juzgado de Letras y Garantía de Paillaco;RIT: P-51-2023 | Tribunal: Juzgado de Letras y Garantía de Paillaco | Caratulado: ADM. DE FONDOS DE CESANTIA CHILE II S.A. CON MARIA JOSE | Fecha Ingreso: 16/05/2023 | Estado Procesal: Concluido | RIT: P-51-2023 | Fecha Ing.: 16/05/2023 | RUC: 23- 3-0122419-2 | Est. Adm.: Sin archivar | Proc.: Ejecutivo Previsional | Forma Inicio.: Demanda | Estado Proc.: Concluido | Etapa: Terminada | Titulo Ejec.:  | Juez Asignado: LUCIA ALEJANDRA MASSRI ERGAS | Tribunal: Juzgado de Letras y Garantía de Paillaco
MARIA JOSE DE LA HOZ ARRIAGADA;20983555-K;DDO.;Juzgado de Letras y Garantía de Paillaco;RIT: P-51-2023 | Tribunal: Juzgado de Letras y Garantía de Paillaco | Caratulado: ADM. DE FONDOS DE CESANTIA CHILE II S.A. CON MARIA JOSE | Fecha Ingreso: 16/05/2023 | Estado Procesal: Concluido | RIT: P-51-2023 | Fecha Ing.: 16/05/2023 | RUC: 23- 3-0122419-2 | Est. Adm.: Sin archivar | Proc.: Ejecutivo Previsional | Forma Inicio.: Demanda | Estado Proc.: Concluido | Etapa: Terminada | Titulo Ejec.:  | Juez Asignado: LUCIA ALEJANDRA MASSRI ERGAS | Tribunal: Juzgado de Letras y Garantía de Paillaco
Raúl Horacio Troncoso Delpiano;7072258-5;AB.DTE;Juzgado de Letras y Garantía de Paillaco;RIT: P-51-2023 | Tribunal: Juzgado de Letras y Garantía de Paillaco | Caratulado: ADM. DE FONDOS DE CESANTIA CHILE II S.A. CON MARIA JOSE | Fecha Ingreso: 16/05/2023 | Estado Procesal: Concluido | RIT: P-51-2023 | Fecha Ing.: 16/05/2023 | RUC: 23- 3-0122419-2 | Est. Adm.: Sin archivar | Proc.: Ejecutivo Previsional | Forma Inicio.: Demanda | Estado Proc.: Concluido | Etapa: Terminada | Titulo Ejec.:  | Juez Asignado: LUCIA ALEJANDRA MASSRI ERGAS | Tribunal: Juzgado de Letras y Garantía de Paillaco
