NOMBRE;DOCUMENTO;CARGO;INSTITUCION;OBSERVACIONES
CRUZ BLANCA S.A;96501450-0;DTE.;Jdo. de Letras de Mariquina;RIT: P-170-2022 | Tribunal: Jdo. de Letras de Mariquina | Caratulado: CRUZ BLANCA S.A/ILUSTRE MUNICIPALIDAD DE MAFIL- CESFAM | Fecha Ingreso: 13/10/2022 | Estado Procesal: Tramitación | RIT: P-170-2022 | Fecha Ing.: 13/10/2022 | RUC: 22- 3-0207521-6 | Est. Adm.: Sin archivar | Proc.: Ejecutivo Previsional | Forma Inicio.: Demanda | Estado Proc.: Tramitación | Etapa: Ingreso | Titulo Ejec.:  | Juez Asignado: PAULA FERNANDEZ BERNAL | Tribunal: Jdo. de Letras de Mariquina
ILUSTRE MUNICIPALIDAD DE MAFIL- CESFAM MÁFIL;69200500-7;DDO.;Jdo. de Letras de Mariquina;RIT: P-170-2022 | Tribunal: Jdo. de Letras de Mariquina | Caratulado: CRUZ BLANCA S.A/ILUSTRE MUNICIPALIDAD DE MAFIL- CESFAM | Fecha Ingreso: 13/10/2022 | Estado Procesal: Tramitación | RIT: P-170-2022 | Fecha Ing.: 13/10/2022 | RUC: 22- 3-0207521-6 | Est. Adm.: Sin archivar | Proc.: Ejecutivo Previsional | Forma Inicio.: Demanda | Estado Proc.: Tramitación | Etapa: Ingreso | Titulo Ejec.:  | Juez Asignado: PAULA FERNANDEZ BERNAL | Tribunal: Jdo. de Letras de Mariquina
DENISSE DANAE VALESKA ELÍAS MORENO;15381641-7;AB.DTE;Jdo. de Letras de Mariquina;RIT: P-170-2022 | Tribunal: Jdo. de Letras de Mariquina | Caratulado: CRUZ BLANCA S.A/ILUSTRE MUNICIPALIDAD DE MAFIL- CESFAM | Fecha Ingreso: 13/10/2022 | Estado Procesal: Tramitación | RIT: P-170-2022 | Fecha Ing.: 13/10/2022 | RUC: 22- 3-0207521-6 | Est. Adm.: Sin archivar | Proc.: Ejecutivo Previsional | Forma Inicio.: Demanda | Estado Proc.: Tramitación | Etapa: Ingreso | Titulo Ejec.:  | Juez Asignado: PAULA FERNANDEZ BERNAL | Tribunal: Jdo. de Letras de Mariquina
A.F.P UNO S.A;76960424-3;DTE.;Jdo. de Letras de Mariquina;RIT: P-168-2022 | Tribunal: Jdo. de Letras de Mariquina | Caratulado: A.F.P UNO S.A/LANKORGANIC SPA | Fecha Ingreso: 12/10/2022 | Estado Procesal: Tramitación | RIT: P-168-2022 | Fecha Ing.: 12/10/2022 | RUC: 22- 3-0206636-5 | Est. Adm.: Sin archivar | Proc.: Ejecutivo Previsional | Forma Inicio.: Demanda | Estado Proc.: Tramitación | Etapa: Ingreso | Titulo Ejec.:  | Juez Asignado: RONNIE MATAMALA TRONCOSO | Tribunal: Jdo. de Letras de Mariquina
MANUEL JESÚS FIGUEROA SAAVEDRA;2415267-7;AP.DTE;Jdo. de Letras de Mariquina;RIT: P-168-2022 | Tribunal: Jdo. de Letras de Mariquina | Caratulado: A.F.P UNO S.A/LANKORGANIC SPA | Fecha Ingreso: 12/10/2022 | Estado Procesal: Tramitación | RIT: P-168-2022 | Fecha Ing.: 12/10/2022 | RUC: 22- 3-0206636-5 | Est. Adm.: Sin archivar | Proc.: Ejecutivo Previsional | Forma Inicio.: Demanda | Estado Proc.: Tramitación | Etapa: Ingreso | Titulo Ejec.:  | Juez Asignado: RONNIE MATAMALA TRONCOSO | Tribunal: Jdo. de Letras de Mariquina
LANKORGANIC SPA;76447794-4;DDO.;Jdo. de Letras de Mariquina;RIT: P-168-2022 | Tribunal: Jdo. de Letras de Mariquina | Caratulado: A.F.P UNO S.A/LANKORGANIC SPA | Fecha Ingreso: 12/10/2022 | Estado Procesal: Tramitación | RIT: P-168-2022 | Fecha Ing.: 12/10/2022 | RUC: 22- 3-0206636-5 | Est. Adm.: Sin archivar | Proc.: Ejecutivo Previsional | Forma Inicio.: Demanda | Estado Proc.: Tramitación | Etapa: Ingreso | Titulo Ejec.:  | Juez Asignado: RONNIE MATAMALA TRONCOSO | Tribunal: Jdo. de Letras de Mariquina
