NOMBRE;DOCUMENTO;CARGO;INSTITUCION;OBSERVACIONES
Administradora de Fondos de Pensiones Capital;98000000-1;DTE.;1º Juzgado de Letras de Ovalle;RIT: P-347-2022 | Tribunal: 1º Juzgado de Letras de Ovalle | Caratulado: A.F.P. CAPITAL S.A. CON ELVIS FRANKLIN CORTES CORTES | Fecha Ingreso: 15/12/2022 | Estado Procesal: Concluido | RIT: P-347-2022 | Fecha Ing.: 15/12/2022 | RUC: 22- 3-0254210-8 | Est. Adm.: Sin archivar | Proc.: Ejecutivo Previsional | Forma Inicio.: Demanda | Estado Proc.: Concluido | Etapa: Terminada | Titulo Ejec.:  | Juez Asignado: MARIA ALEJANDRA RIOS TEILLIER | Tribunal: 1º Juzgado de Letras de Ovalle
ELVIS FRANKLIN CORTES CORTES;13179927-6;DDO.;1º Juzgado de Letras de Ovalle;RIT: P-347-2022 | Tribunal: 1º Juzgado de Letras de Ovalle | Caratulado: A.F.P. CAPITAL S.A. CON ELVIS FRANKLIN CORTES CORTES | Fecha Ingreso: 15/12/2022 | Estado Procesal: Concluido | RIT: P-347-2022 | Fecha Ing.: 15/12/2022 | RUC: 22- 3-0254210-8 | Est. Adm.: Sin archivar | Proc.: Ejecutivo Previsional | Forma Inicio.: Demanda | Estado Proc.: Concluido | Etapa: Terminada | Titulo Ejec.:  | Juez Asignado: MARIA ALEJANDRA RIOS TEILLIER | Tribunal: 1º Juzgado de Letras de Ovalle
Raúl Horacio Troncoso Delpiano;7072258-5;AB.DTE;1º Juzgado de Letras de Ovalle;RIT: P-347-2022 | Tribunal: 1º Juzgado de Letras de Ovalle | Caratulado: A.F.P. CAPITAL S.A. CON ELVIS FRANKLIN CORTES CORTES | Fecha Ingreso: 15/12/2022 | Estado Procesal: Concluido | RIT: P-347-2022 | Fecha Ing.: 15/12/2022 | RUC: 22- 3-0254210-8 | Est. Adm.: Sin archivar | Proc.: Ejecutivo Previsional | Forma Inicio.: Demanda | Estado Proc.: Concluido | Etapa: Terminada | Titulo Ejec.:  | Juez Asignado: MARIA ALEJANDRA RIOS TEILLIER | Tribunal: 1º Juzgado de Letras de Ovalle
EMMA PILAR VALLEJOS CORTÉS;13329458-9;DTE.;1º Juzgado de Letras de Ovalle;RIT: C-18-2022 | Tribunal: 1º Juzgado de Letras de Ovalle | Caratulado: VALLEJOS/CASTILLO | Fecha Ingreso: 15/12/2022 | Estado Procesal: Tramitación | RIT: C-18-2022 | Fecha Ing.: 15/12/2022 | RUC: 22- 4-0415257-6 | Est. Adm.: Archivada | Proc.: Cumplimiento Laboral | Forma Inicio.: Sitla | Estado Proc.: Tramitación | Etapa: Excepciones / Objeta Liquidación | Titulo Ejec.:  | Juez Asignado: MARIA ALEJANDRA RIOS TEILLIER | Tribunal: 1º Juzgado de Letras de Ovalle
CRISTIAN JAVIER CASTILLO CARVAJAL;16849571-4;DDO.;1º Juzgado de Letras de Ovalle;RIT: C-18-2022 | Tribunal: 1º Juzgado de Letras de Ovalle | Caratulado: VALLEJOS/CASTILLO | Fecha Ingreso: 15/12/2022 | Estado Procesal: Tramitación | RIT: C-18-2022 | Fecha Ing.: 15/12/2022 | RUC: 22- 4-0415257-6 | Est. Adm.: Archivada | Proc.: Cumplimiento Laboral | Forma Inicio.: Sitla | Estado Proc.: Tramitación | Etapa: Excepciones / Objeta Liquidación | Titulo Ejec.:  | Juez Asignado: MARIA ALEJANDRA RIOS TEILLIER | Tribunal: 1º Juzgado de Letras de Ovalle
JAIME ANDRÉS PIZARRO BURGOA;11347319-3;AB.DTE;1º Juzgado de Letras de Ovalle;RIT: C-18-2022 | Tribunal: 1º Juzgado de Letras de Ovalle | Caratulado: VALLEJOS/CASTILLO | Fecha Ingreso: 15/12/2022 | Estado Procesal: Tramitación | RIT: C-18-2022 | Fecha Ing.: 15/12/2022 | RUC: 22- 4-0415257-6 | Est. Adm.: Archivada | Proc.: Cumplimiento Laboral | Forma Inicio.: Sitla | Estado Proc.: Tramitación | Etapa: Excepciones / Objeta Liquidación | Titulo Ejec.:  | Juez Asignado: MARIA ALEJANDRA RIOS TEILLIER | Tribunal: 1º Juzgado de Letras de Ovalle
