NOMBRE;DOCUMENTO;CARGO;INSTITUCION;OBSERVACIONES
MANUEL JESÚS FIGUEROA SAAVEDRA;2415267-7;AB.DTE;Jdo. de Letras de Mariquina;RIT: P-292-2023 | Tribunal: Jdo. de Letras de Mariquina | Caratulado: AFP UNO S.A/COMERCIAL Y TRANSPORTES ULMENKOFKE LIMITADA | Fecha Ingreso: 15/11/2023 | Estado Procesal: Concluido | RIT: P-292-2023 | Fecha Ing.: 15/11/2023 | RUC: 23- 3-0307185-7 | Est. Adm.: Sin archivar | Proc.: Ejecutivo Previsional | Forma Inicio.: Demanda | Estado Proc.: Concluido | Etapa: Terminada | Titulo Ejec.:  | Juez Asignado: RONNIE MATAMALA TRONCOSO | Tribunal: Jdo. de Letras de Mariquina
ANTONIO RICARDO ÁLAMOS AVENDAÑO;8270154-0;AB.DTE;Jdo. de Letras de Mariquina;RIT: P-292-2023 | Tribunal: Jdo. de Letras de Mariquina | Caratulado: AFP UNO S.A/COMERCIAL Y TRANSPORTES ULMENKOFKE LIMITADA | Fecha Ingreso: 15/11/2023 | Estado Procesal: Concluido | RIT: P-292-2023 | Fecha Ing.: 15/11/2023 | RUC: 23- 3-0307185-7 | Est. Adm.: Sin archivar | Proc.: Ejecutivo Previsional | Forma Inicio.: Demanda | Estado Proc.: Concluido | Etapa: Terminada | Titulo Ejec.:  | Juez Asignado: RONNIE MATAMALA TRONCOSO | Tribunal: Jdo. de Letras de Mariquina
COMERCIAL Y TRANSPORTES ULMENKOFKE LIMITADA;76495727-K;DDO.;Jdo. de Letras de Mariquina;RIT: P-292-2023 | Tribunal: Jdo. de Letras de Mariquina | Caratulado: AFP UNO S.A/COMERCIAL Y TRANSPORTES ULMENKOFKE LIMITADA | Fecha Ingreso: 15/11/2023 | Estado Procesal: Concluido | RIT: P-292-2023 | Fecha Ing.: 15/11/2023 | RUC: 23- 3-0307185-7 | Est. Adm.: Sin archivar | Proc.: Ejecutivo Previsional | Forma Inicio.: Demanda | Estado Proc.: Concluido | Etapa: Terminada | Titulo Ejec.:  | Juez Asignado: RONNIE MATAMALA TRONCOSO | Tribunal: Jdo. de Letras de Mariquina
AFP UNO S.A;76960424-3;DTE.;Jdo. de Letras de Mariquina;RIT: P-292-2023 | Tribunal: Jdo. de Letras de Mariquina | Caratulado: AFP UNO S.A/COMERCIAL Y TRANSPORTES ULMENKOFKE LIMITADA | Fecha Ingreso: 15/11/2023 | Estado Procesal: Concluido | RIT: P-292-2023 | Fecha Ing.: 15/11/2023 | RUC: 23- 3-0307185-7 | Est. Adm.: Sin archivar | Proc.: Ejecutivo Previsional | Forma Inicio.: Demanda | Estado Proc.: Concluido | Etapa: Terminada | Titulo Ejec.:  | Juez Asignado: RONNIE MATAMALA TRONCOSO | Tribunal: Jdo. de Letras de Mariquina
FONDO NACIONAL DE SALUD (FONASA);61603000-0;DTE.;Jdo. de Letras de Mariquina;RIT: P-288-2023 | Tribunal: Jdo. de Letras de Mariquina | Caratulado: FONDO NACIONAL DE SALUD (FONASA)/MADERAS Y TRANSPORTES | Fecha Ingreso: 11/11/2023 | Estado Procesal: Tramitación | RIT: P-288-2023 | Fecha Ing.: 11/11/2023 | RUC: 23- 3-0304546-5 | Est. Adm.: Sin archivar | Proc.: Ejecutivo Previsional | Forma Inicio.: Demanda | Estado Proc.: Tramitación | Etapa: Ingreso | Titulo Ejec.:  | Juez Asignado: CARLOS AGUILAR HERNANDEZ | Tribunal: Jdo. de Letras de Mariquina
ARMANDO ALEJANDRO FERNANDO DE LAIRE FORTTES;6495959-K;AB.DTE;Jdo. de Letras de Mariquina;RIT: P-288-2023 | Tribunal: Jdo. de Letras de Mariquina | Caratulado: FONDO NACIONAL DE SALUD (FONASA)/MADERAS Y TRANSPORTES | Fecha Ingreso: 11/11/2023 | Estado Procesal: Tramitación | RIT: P-288-2023 | Fecha Ing.: 11/11/2023 | RUC: 23- 3-0304546-5 | Est. Adm.: Sin archivar | Proc.: Ejecutivo Previsional | Forma Inicio.: Demanda | Estado Proc.: Tramitación | Etapa: Ingreso | Titulo Ejec.:  | Juez Asignado: CARLOS AGUILAR HERNANDEZ | Tribunal: Jdo. de Letras de Mariquina
MADERAS Y TRANSPORTES EL MAITEN LIMITADA;76393819-0;DDO.;Jdo. de Letras de Mariquina;RIT: P-288-2023 | Tribunal: Jdo. de Letras de Mariquina | Caratulado: FONDO NACIONAL DE SALUD (FONASA)/MADERAS Y TRANSPORTES | Fecha Ingreso: 11/11/2023 | Estado Procesal: Tramitación | RIT: P-288-2023 | Fecha Ing.: 11/11/2023 | RUC: 23- 3-0304546-5 | Est. Adm.: Sin archivar | Proc.: Ejecutivo Previsional | Forma Inicio.: Demanda | Estado Proc.: Tramitación | Etapa: Ingreso | Titulo Ejec.:  | Juez Asignado: CARLOS AGUILAR HERNANDEZ | Tribunal: Jdo. de Letras de Mariquina
