NOMBRE;DOCUMENTO;CARGO;INSTITUCION;OBSERVACIONES
SOCIEDAD ADMINISTRADORA DE FONDOS DE CESANTIA DE CHILE III S.A.;77601648-9;DTE.;Jdo. de Letras de Constitución;RIT: P-289-2024 | Tribunal: Jdo. de Letras de Constitución | Caratulado: ADM. DE FONDOS DE CESANTIA CHILE III S.A. CON SOCIEDAD | Fecha Ingreso: 25/09/2024 | Estado Procesal: Concluido | RIT: P-289-2024 | Fecha Ing.: 25/09/2024 | RUC: 24- 3-0261200-1 | Est. Adm.: Sin archivar | Proc.: Ejecutivo Previsional | Forma Inicio.: Demanda | Estado Proc.: Concluido | Etapa: Terminada | Titulo Ejec.:  | Juez Asignado: GUSTAVO BENAVENTE MORA | Tribunal: Jdo. de Letras de Constitución
SOCIEDAD MAULEXLORA LTDA;76085377-1;DDO.;Jdo. de Letras de Constitución;RIT: P-289-2024 | Tribunal: Jdo. de Letras de Constitución | Caratulado: ADM. DE FONDOS DE CESANTIA CHILE III S.A. CON SOCIEDAD | Fecha Ingreso: 25/09/2024 | Estado Procesal: Concluido | RIT: P-289-2024 | Fecha Ing.: 25/09/2024 | RUC: 24- 3-0261200-1 | Est. Adm.: Sin archivar | Proc.: Ejecutivo Previsional | Forma Inicio.: Demanda | Estado Proc.: Concluido | Etapa: Terminada | Titulo Ejec.:  | Juez Asignado: GUSTAVO BENAVENTE MORA | Tribunal: Jdo. de Letras de Constitución
Antonio Ricardo Alamos Avendaño;8270154-0;AB.DTE;Jdo. de Letras de Constitución;RIT: P-289-2024 | Tribunal: Jdo. de Letras de Constitución | Caratulado: ADM. DE FONDOS DE CESANTIA CHILE III S.A. CON SOCIEDAD | Fecha Ingreso: 25/09/2024 | Estado Procesal: Concluido | RIT: P-289-2024 | Fecha Ing.: 25/09/2024 | RUC: 24- 3-0261200-1 | Est. Adm.: Sin archivar | Proc.: Ejecutivo Previsional | Forma Inicio.: Demanda | Estado Proc.: Concluido | Etapa: Terminada | Titulo Ejec.:  | Juez Asignado: GUSTAVO BENAVENTE MORA | Tribunal: Jdo. de Letras de Constitución
Administradora de Fondos de Pensiones Habitat;98000100-8;DTE.;Jdo. de Letras de Constitución;RIT: P-283-2024 | Tribunal: Jdo. de Letras de Constitución | Caratulado: A.F.P. HABITAT S.A. CON COMERCIAL HDM SPA | Fecha Ingreso: 23/09/2024 | Estado Procesal: Concluido | RIT: P-283-2024 | Fecha Ing.: 23/09/2024 | RUC: 24- 3-0256929-7 | Est. Adm.: Sin archivar | Proc.: Ejecutivo Previsional | Forma Inicio.: Demanda | Estado Proc.: Concluido | Etapa: Terminada | Titulo Ejec.:  | Juez Asignado: GUSTAVO BENAVENTE MORA | Tribunal: Jdo. de Letras de Constitución
COMERCIAL HDM SPA;77497187-4;DDO.;Jdo. de Letras de Constitución;RIT: P-283-2024 | Tribunal: Jdo. de Letras de Constitución | Caratulado: A.F.P. HABITAT S.A. CON COMERCIAL HDM SPA | Fecha Ingreso: 23/09/2024 | Estado Procesal: Concluido | RIT: P-283-2024 | Fecha Ing.: 23/09/2024 | RUC: 24- 3-0256929-7 | Est. Adm.: Sin archivar | Proc.: Ejecutivo Previsional | Forma Inicio.: Demanda | Estado Proc.: Concluido | Etapa: Terminada | Titulo Ejec.:  | Juez Asignado: GUSTAVO BENAVENTE MORA | Tribunal: Jdo. de Letras de Constitución
Patricio Elgueta Adrovez;5402197-6;AB.DTE;Jdo. de Letras de Constitución;RIT: P-283-2024 | Tribunal: Jdo. de Letras de Constitución | Caratulado: A.F.P. HABITAT S.A. CON COMERCIAL HDM SPA | Fecha Ingreso: 23/09/2024 | Estado Procesal: Concluido | RIT: P-283-2024 | Fecha Ing.: 23/09/2024 | RUC: 24- 3-0256929-7 | Est. Adm.: Sin archivar | Proc.: Ejecutivo Previsional | Forma Inicio.: Demanda | Estado Proc.: Concluido | Etapa: Terminada | Titulo Ejec.:  | Juez Asignado: GUSTAVO BENAVENTE MORA | Tribunal: Jdo. de Letras de Constitución
