NOMBRE;DOCUMENTO;CARGO;INSTITUCION;OBSERVACIONES
Administradora de Fondos de Pensiones Cuprum S.A.;76240079-0;DTE.;3º Juzgado de Letras de Ovalle;RIT: P-154-2022 | Tribunal: 3º Juzgado de Letras de Ovalle | Caratulado: A.F.P. CUPRUM S.A. CON MINERA CRUZ LIMITADA | Fecha Ingreso: 22/09/2022 | Estado Procesal: Concluido | RIT: P-154-2022 | Fecha Ing.: 22/09/2022 | RUC: 22- 3-0192932-7 | Est. Adm.: Archivada | Proc.: Ejecutivo Previsional | Forma Inicio.: Demanda | Estado Proc.: Concluido | Etapa: Terminada | Titulo Ejec.:  | Juez Asignado: PEDRO HECTOR HICHE IRELAND | Tribunal: 3º Juzgado de Letras de Ovalle
MINERA CRUZ LIMITADA;76118700-7;DDO.;3º Juzgado de Letras de Ovalle;RIT: P-154-2022 | Tribunal: 3º Juzgado de Letras de Ovalle | Caratulado: A.F.P. CUPRUM S.A. CON MINERA CRUZ LIMITADA | Fecha Ingreso: 22/09/2022 | Estado Procesal: Concluido | RIT: P-154-2022 | Fecha Ing.: 22/09/2022 | RUC: 22- 3-0192932-7 | Est. Adm.: Archivada | Proc.: Ejecutivo Previsional | Forma Inicio.: Demanda | Estado Proc.: Concluido | Etapa: Terminada | Titulo Ejec.:  | Juez Asignado: PEDRO HECTOR HICHE IRELAND | Tribunal: 3º Juzgado de Letras de Ovalle
Francisco Tocornal Fuenzalida;8352676-9;AB.DTE;3º Juzgado de Letras de Ovalle;RIT: P-154-2022 | Tribunal: 3º Juzgado de Letras de Ovalle | Caratulado: A.F.P. CUPRUM S.A. CON MINERA CRUZ LIMITADA | Fecha Ingreso: 22/09/2022 | Estado Procesal: Concluido | RIT: P-154-2022 | Fecha Ing.: 22/09/2022 | RUC: 22- 3-0192932-7 | Est. Adm.: Archivada | Proc.: Ejecutivo Previsional | Forma Inicio.: Demanda | Estado Proc.: Concluido | Etapa: Terminada | Titulo Ejec.:  | Juez Asignado: PEDRO HECTOR HICHE IRELAND | Tribunal: 3º Juzgado de Letras de Ovalle
ADM. DE FONDOS DE CESANTIA CHILE S.A.;96981130-8;DTE.;3º Juzgado de Letras de Ovalle;RIT: E-20-2022 | Tribunal: 3º Juzgado de Letras de Ovalle | Caratulado: ADM. DE FONDOS DE CESANTIA CHILE S.A. CON BOU | Fecha Ingreso: 17/09/2022 | Estado Procesal: Concluido | RIT: E-20-2022 | Fecha Ing.: 17/09/2022 | RUC: 13- 3-0088196-8 | Est. Adm.: Sin archivar | Proc.: Exhorto | Forma Inicio.: Exhorto | Estado Proc.: Concluido | Etapa: Terminada | Titulo Ejec.:  | Juez Asignado: PEDRO HECTOR HICHE IRELAND | Tribunal: 3º Juzgado de Letras de Ovalle
FRANCISCO JAVIER BOU ECHEGARAY;12041248-5;DDO.;3º Juzgado de Letras de Ovalle;RIT: E-20-2022 | Tribunal: 3º Juzgado de Letras de Ovalle | Caratulado: ADM. DE FONDOS DE CESANTIA CHILE S.A. CON BOU | Fecha Ingreso: 17/09/2022 | Estado Procesal: Concluido | RIT: E-20-2022 | Fecha Ing.: 17/09/2022 | RUC: 13- 3-0088196-8 | Est. Adm.: Sin archivar | Proc.: Exhorto | Forma Inicio.: Exhorto | Estado Proc.: Concluido | Etapa: Terminada | Titulo Ejec.:  | Juez Asignado: PEDRO HECTOR HICHE IRELAND | Tribunal: 3º Juzgado de Letras de Ovalle
MANUEL FIGUEROA SAAVEDRA;2415267-7;AB.DTE;3º Juzgado de Letras de Ovalle;RIT: E-20-2022 | Tribunal: 3º Juzgado de Letras de Ovalle | Caratulado: ADM. DE FONDOS DE CESANTIA CHILE S.A. CON BOU | Fecha Ingreso: 17/09/2022 | Estado Procesal: Concluido | RIT: E-20-2022 | Fecha Ing.: 17/09/2022 | RUC: 13- 3-0088196-8 | Est. Adm.: Sin archivar | Proc.: Exhorto | Forma Inicio.: Exhorto | Estado Proc.: Concluido | Etapa: Terminada | Titulo Ejec.:  | Juez Asignado: PEDRO HECTOR HICHE IRELAND | Tribunal: 3º Juzgado de Letras de Ovalle
ANTONIO RICARDO ALAMOS AVENDAÑO;8270154-0;AP.DTE;3º Juzgado de Letras de Ovalle;RIT: E-20-2022 | Tribunal: 3º Juzgado de Letras de Ovalle | Caratulado: ADM. DE FONDOS DE CESANTIA CHILE S.A. CON BOU | Fecha Ingreso: 17/09/2022 | Estado Procesal: Concluido | RIT: E-20-2022 | Fecha Ing.: 17/09/2022 | RUC: 13- 3-0088196-8 | Est. Adm.: Sin archivar | Proc.: Exhorto | Forma Inicio.: Exhorto | Estado Proc.: Concluido | Etapa: Terminada | Titulo Ejec.:  | Juez Asignado: PEDRO HECTOR HICHE IRELAND | Tribunal: 3º Juzgado de Letras de Ovalle
