NOMBRE;DOCUMENTO;CARGO;INSTITUCION;OBSERVACIONES
SOCIEDAD ADMINISTRADORA DE FONDOS DE CESANTIA DE CHILE III S.A.;77601648-9;DTE.;1° Juzgado de Letras de Coronel;RIT: P-84-2024 | Tribunal: 1° Juzgado de Letras de Coronel | Caratulado: ADM. DE FONDOS DE CESANTIA CHILE III S.A. CON TRANSPORT | Fecha Ingreso: 14/03/2024 | Estado Procesal: Tramitación | RIT: P-84-2024 | Fecha Ing.: 14/03/2024 | RUC: 24- 3-0075743-6 | Est. Adm.: Sin archivar | Proc.: Ejecutivo Previsional | Forma Inicio.: Demanda | Estado Proc.: Tramitación | Etapa: Ingreso | Titulo Ejec.:  | Juez Asignado: PAULINA BERMUDEZ SAENZ | Tribunal: 1° Juzgado de Letras de Coronel
TRANSPORTES ELENA Y CIA LTDA;76202212-5;DDO.;1° Juzgado de Letras de Coronel;RIT: P-84-2024 | Tribunal: 1° Juzgado de Letras de Coronel | Caratulado: ADM. DE FONDOS DE CESANTIA CHILE III S.A. CON TRANSPORT | Fecha Ingreso: 14/03/2024 | Estado Procesal: Tramitación | RIT: P-84-2024 | Fecha Ing.: 14/03/2024 | RUC: 24- 3-0075743-6 | Est. Adm.: Sin archivar | Proc.: Ejecutivo Previsional | Forma Inicio.: Demanda | Estado Proc.: Tramitación | Etapa: Ingreso | Titulo Ejec.:  | Juez Asignado: PAULINA BERMUDEZ SAENZ | Tribunal: 1° Juzgado de Letras de Coronel
Antonio Ricardo Alamos Avendaño;8270154-0;AB.DTE;1° Juzgado de Letras de Coronel;RIT: P-84-2024 | Tribunal: 1° Juzgado de Letras de Coronel | Caratulado: ADM. DE FONDOS DE CESANTIA CHILE III S.A. CON TRANSPORT | Fecha Ingreso: 14/03/2024 | Estado Procesal: Tramitación | RIT: P-84-2024 | Fecha Ing.: 14/03/2024 | RUC: 24- 3-0075743-6 | Est. Adm.: Sin archivar | Proc.: Ejecutivo Previsional | Forma Inicio.: Demanda | Estado Proc.: Tramitación | Etapa: Ingreso | Titulo Ejec.:  | Juez Asignado: PAULINA BERMUDEZ SAENZ | Tribunal: 1° Juzgado de Letras de Coronel
Manuel Jesús Figueroa Saavedra;2415267-7;AB.DTE;1° Juzgado de Letras de Coronel;RIT: P-84-2024 | Tribunal: 1° Juzgado de Letras de Coronel | Caratulado: ADM. DE FONDOS DE CESANTIA CHILE III S.A. CON TRANSPORT | Fecha Ingreso: 14/03/2024 | Estado Procesal: Tramitación | RIT: P-84-2024 | Fecha Ing.: 14/03/2024 | RUC: 24- 3-0075743-6 | Est. Adm.: Sin archivar | Proc.: Ejecutivo Previsional | Forma Inicio.: Demanda | Estado Proc.: Tramitación | Etapa: Ingreso | Titulo Ejec.:  | Juez Asignado: PAULINA BERMUDEZ SAENZ | Tribunal: 1° Juzgado de Letras de Coronel
A.F.P. PLANVITAL S.A.;98001200-K;DTE.;1° Juzgado de Letras de Coronel;RIT: P-85-2024 | Tribunal: 1° Juzgado de Letras de Coronel | Caratulado: A.F.P. PLANVITAL S.A./COMERCIALIZADORA MARFINO LTDA | Fecha Ingreso: 14/03/2024 | Estado Procesal: Tramitación | RIT: P-85-2024 | Fecha Ing.: 14/03/2024 | RUC: 24- 3-0076703-2 | Est. Adm.: Sin archivar | Proc.: Ejecutivo Previsional | Forma Inicio.: Demanda | Estado Proc.: Tramitación | Etapa: Ingreso | Titulo Ejec.:  | Juez Asignado: PAULINA BERMUDEZ SAENZ | Tribunal: 1° Juzgado de Letras de Coronel
MANUEL JESÚS FIGUEROA SAAVEDRA;2415267-7;AB.DTE;1° Juzgado de Letras de Coronel;RIT: P-85-2024 | Tribunal: 1° Juzgado de Letras de Coronel | Caratulado: A.F.P. PLANVITAL S.A./COMERCIALIZADORA MARFINO LTDA | Fecha Ingreso: 14/03/2024 | Estado Procesal: Tramitación | RIT: P-85-2024 | Fecha Ing.: 14/03/2024 | RUC: 24- 3-0076703-2 | Est. Adm.: Sin archivar | Proc.: Ejecutivo Previsional | Forma Inicio.: Demanda | Estado Proc.: Tramitación | Etapa: Ingreso | Titulo Ejec.:  | Juez Asignado: PAULINA BERMUDEZ SAENZ | Tribunal: 1° Juzgado de Letras de Coronel
ANTONIO RICARDO ÁLAMOS AVENDAÑO;8270154-0;AB.DTE;1° Juzgado de Letras de Coronel;RIT: P-85-2024 | Tribunal: 1° Juzgado de Letras de Coronel | Caratulado: A.F.P. PLANVITAL S.A./COMERCIALIZADORA MARFINO LTDA | Fecha Ingreso: 14/03/2024 | Estado Procesal: Tramitación | RIT: P-85-2024 | Fecha Ing.: 14/03/2024 | RUC: 24- 3-0076703-2 | Est. Adm.: Sin archivar | Proc.: Ejecutivo Previsional | Forma Inicio.: Demanda | Estado Proc.: Tramitación | Etapa: Ingreso | Titulo Ejec.:  | Juez Asignado: PAULINA BERMUDEZ SAENZ | Tribunal: 1° Juzgado de Letras de Coronel
COMERCIALIZADORA MARFINO LTDA;76536848-0;DDO.;1° Juzgado de Letras de Coronel;RIT: P-85-2024 | Tribunal: 1° Juzgado de Letras de Coronel | Caratulado: A.F.P. PLANVITAL S.A./COMERCIALIZADORA MARFINO LTDA | Fecha Ingreso: 14/03/2024 | Estado Procesal: Tramitación | RIT: P-85-2024 | Fecha Ing.: 14/03/2024 | RUC: 24- 3-0076703-2 | Est. Adm.: Sin archivar | Proc.: Ejecutivo Previsional | Forma Inicio.: Demanda | Estado Proc.: Tramitación | Etapa: Ingreso | Titulo Ejec.:  | Juez Asignado: PAULINA BERMUDEZ SAENZ | Tribunal: 1° Juzgado de Letras de Coronel
