NOMBRE;DOCUMENTO;CARGO;INSTITUCION;OBSERVACIONES
Administradora de Fondos de Pensiones Cuprum S.A.;76240079-0;DTE.;2°Jdo. de Letras de San Fernando;RIT: P-564-2024 | Tribunal: 2°Jdo. de Letras de San Fernando | Caratulado: A.F.P. CUPRUM S.A. CON GRUAS NATALIE LIZAMA E.I.R.L. | Fecha Ingreso: 03/10/2024 | Estado Procesal: Concluido | RIT: P-564-2024 | Fecha Ing.: 03/10/2024 | RUC: 24- 3-0274420-K | Est. Adm.: Sin archivar | Proc.: Ejecutivo Previsional | Forma Inicio.: Demanda | Estado Proc.: Concluido | Etapa: Terminada | Titulo Ejec.:  | Juez Asignado: GUILLERMO ENRIQUE RODRIGUEZ ORDENES | Tribunal: 2°Jdo. de Letras de San Fernando
GRUAS NATALIE LIZAMA E.I.R.L.;76914741-1;DDO.;2°Jdo. de Letras de San Fernando;RIT: P-564-2024 | Tribunal: 2°Jdo. de Letras de San Fernando | Caratulado: A.F.P. CUPRUM S.A. CON GRUAS NATALIE LIZAMA E.I.R.L. | Fecha Ingreso: 03/10/2024 | Estado Procesal: Concluido | RIT: P-564-2024 | Fecha Ing.: 03/10/2024 | RUC: 24- 3-0274420-K | Est. Adm.: Sin archivar | Proc.: Ejecutivo Previsional | Forma Inicio.: Demanda | Estado Proc.: Concluido | Etapa: Terminada | Titulo Ejec.:  | Juez Asignado: GUILLERMO ENRIQUE RODRIGUEZ ORDENES | Tribunal: 2°Jdo. de Letras de San Fernando
Luis Bilbao Aravena;9481314-K;AB.DTE;2°Jdo. de Letras de San Fernando;RIT: P-564-2024 | Tribunal: 2°Jdo. de Letras de San Fernando | Caratulado: A.F.P. CUPRUM S.A. CON GRUAS NATALIE LIZAMA E.I.R.L. | Fecha Ingreso: 03/10/2024 | Estado Procesal: Concluido | RIT: P-564-2024 | Fecha Ing.: 03/10/2024 | RUC: 24- 3-0274420-K | Est. Adm.: Sin archivar | Proc.: Ejecutivo Previsional | Forma Inicio.: Demanda | Estado Proc.: Concluido | Etapa: Terminada | Titulo Ejec.:  | Juez Asignado: GUILLERMO ENRIQUE RODRIGUEZ ORDENES | Tribunal: 2°Jdo. de Letras de San Fernando
ISAPRE CONSALUD S.A;96856780-2;DTE.;2°Jdo. de Letras de San Fernando;RIT: P-562-2024 | Tribunal: 2°Jdo. de Letras de San Fernando | Caratulado: ISAPRE CONSALUD S.A/CORP MUNIC SAN FERNANDO PARA ATENC | Fecha Ingreso: 02/10/2024 | Estado Procesal: Concluido | RIT: P-562-2024 | Fecha Ing.: 02/10/2024 | RUC: 24- 3-0274203-7 | Est. Adm.: Sin archivar | Proc.: Ejecutivo Previsional | Forma Inicio.: Demanda | Estado Proc.: Concluido | Etapa: Terminada | Titulo Ejec.:  | Juez Asignado: JOSE MIGUEL VALENZUELA MORALES | Tribunal: 2°Jdo. de Letras de San Fernando
ÁLVARO ANDRÉS MOLINA LEIVA;13671419-8;AB.DTE;2°Jdo. de Letras de San Fernando;RIT: P-562-2024 | Tribunal: 2°Jdo. de Letras de San Fernando | Caratulado: ISAPRE CONSALUD S.A/CORP MUNIC SAN FERNANDO PARA ATENC | Fecha Ingreso: 02/10/2024 | Estado Procesal: Concluido | RIT: P-562-2024 | Fecha Ing.: 02/10/2024 | RUC: 24- 3-0274203-7 | Est. Adm.: Sin archivar | Proc.: Ejecutivo Previsional | Forma Inicio.: Demanda | Estado Proc.: Concluido | Etapa: Terminada | Titulo Ejec.:  | Juez Asignado: JOSE MIGUEL VALENZUELA MORALES | Tribunal: 2°Jdo. de Letras de San Fernando
CORP MUNIC SAN FERNANDO PARA ATENC MENORES Y LAS A DE E Y S;71328600-1;DDO.;2°Jdo. de Letras de San Fernando;RIT: P-562-2024 | Tribunal: 2°Jdo. de Letras de San Fernando | Caratulado: ISAPRE CONSALUD S.A/CORP MUNIC SAN FERNANDO PARA ATENC | Fecha Ingreso: 02/10/2024 | Estado Procesal: Concluido | RIT: P-562-2024 | Fecha Ing.: 02/10/2024 | RUC: 24- 3-0274203-7 | Est. Adm.: Sin archivar | Proc.: Ejecutivo Previsional | Forma Inicio.: Demanda | Estado Proc.: Concluido | Etapa: Terminada | Titulo Ejec.:  | Juez Asignado: JOSE MIGUEL VALENZUELA MORALES | Tribunal: 2°Jdo. de Letras de San Fernando
