NOMBRE;DOCUMENTO;CARGO;INSTITUCION;OBSERVACIONES
JOAQUÍN ANDRÉS CAMPOS TAGLE;15597284-K;Ab.Recurrente;C.A. de Coyhaique;Rol: Protección-341-2022 | Corte: C.A. de Coyhaique | Caratulado: CORTEZ/ISAPRE CRUZ BLANCA S.A. | Fecha Ingreso: 15/04/2022 | Estado Causa: Fallada-Terminada | Fecha Ubicación: 13/10/2023 | Ubicación: Archivo
FRANCISCA PAZ CORTEZ MUÑOZ;16658248-2;Recurrente;C.A. de Coyhaique;Rol: Protección-341-2022 | Corte: C.A. de Coyhaique | Caratulado: CORTEZ/ISAPRE CRUZ BLANCA S.A. | Fecha Ingreso: 15/04/2022 | Estado Causa: Fallada-Terminada | Fecha Ubicación: 13/10/2023 | Ubicación: Archivo
ISAPRE CRUZ BLANCA S.A.;96501450-0;Recurrido;C.A. de Coyhaique;Rol: Protección-341-2022 | Corte: C.A. de Coyhaique | Caratulado: CORTEZ/ISAPRE CRUZ BLANCA S.A. | Fecha Ingreso: 15/04/2022 | Estado Causa: Fallada-Terminada | Fecha Ubicación: 13/10/2023 | Ubicación: Archivo
COLOMBA BELÉN BARRIOS BARRÍA;16975596-5;Ab.Recurrente;C.A. de Coyhaique;Rol: Protección-342-2022 | Corte: C.A. de Coyhaique | Caratulado: ROSAS/ISAPRE CRUZBLANCA S.A. | Fecha Ingreso: 15/04/2022 | Estado Causa: Fallada-Terminada | Fecha Ubicación: 21/03/2023 | Ubicación: Archivo
MARCELO ARIEL ROSAS VERDUGO;13520195-2;Recurrente;C.A. de Coyhaique;Rol: Protección-342-2022 | Corte: C.A. de Coyhaique | Caratulado: ROSAS/ISAPRE CRUZBLANCA S.A. | Fecha Ingreso: 15/04/2022 | Estado Causa: Fallada-Terminada | Fecha Ubicación: 21/03/2023 | Ubicación: Archivo
ISAPRE CRUZBLANCA S.A.;96501450-0;Recurrido;C.A. de Coyhaique;Rol: Protección-342-2022 | Corte: C.A. de Coyhaique | Caratulado: ROSAS/ISAPRE CRUZBLANCA S.A. | Fecha Ingreso: 15/04/2022 | Estado Causa: Fallada-Terminada | Fecha Ubicación: 21/03/2023 | Ubicación: Archivo
