NOMBRE;DOCUMENTO;CARGO;INSTITUCION;OBSERVACIONES
MAGDIEL MAICAN ACOSTA;0-0;Ampdo.;C.A. de Temuco;Rol: Amparo-461-2021 | Corte: C.A. de Temuco | Caratulado: /INTENDENCIA DE LA ARAUCANIA | Fecha Ingreso: 17/09/2021 | Estado Causa: Fallada-Terminada | Fecha Ubicación: 03/08/2022 | Ubicación: Archivo
RODRIGO ARTURO CORTÉS CARRASCO;10296096-3;Ab.Recurrente;C.A. de Temuco;Rol: Amparo-461-2021 | Corte: C.A. de Temuco | Caratulado: /INTENDENCIA DE LA ARAUCANIA | Fecha Ingreso: 17/09/2021 | Estado Causa: Fallada-Terminada | Fecha Ubicación: 03/08/2022 | Ubicación: Archivo
INTENDENCIA DE LA ARAUCANIA;60511090-8;Recurrido;C.A. de Temuco;Rol: Amparo-461-2021 | Corte: C.A. de Temuco | Caratulado: /INTENDENCIA DE LA ARAUCANIA | Fecha Ingreso: 17/09/2021 | Estado Causa: Fallada-Terminada | Fecha Ubicación: 03/08/2022 | Ubicación: Archivo
HUGO ORLANDO CASTILLO TORRES;12191715-7;Ab.Recurrente;C.A. de Temuco;Rol: Protección-8727-2021 | Corte: C.A. de Temuco | Caratulado: SEGURA/ISAPRE CONSALUD S.A. | Fecha Ingreso: 17/09/2021 | Estado Causa: Fallada-Terminada | Fecha Ubicación: 20/10/0021 | Ubicación: Archivo
CECILIA ALEJANDRA SEGURA IBÁÑEZ;17913412-8;Recurrente;C.A. de Temuco;Rol: Protección-8727-2021 | Corte: C.A. de Temuco | Caratulado: SEGURA/ISAPRE CONSALUD S.A. | Fecha Ingreso: 17/09/2021 | Estado Causa: Fallada-Terminada | Fecha Ubicación: 20/10/0021 | Ubicación: Archivo
ISAPRE CONSALUD S.A.;96856780-2;Recurrido;C.A. de Temuco;Rol: Protección-8727-2021 | Corte: C.A. de Temuco | Caratulado: SEGURA/ISAPRE CONSALUD S.A. | Fecha Ingreso: 17/09/2021 | Estado Causa: Fallada-Terminada | Fecha Ubicación: 20/10/0021 | Ubicación: Archivo
HUGO ORLANDO CASTILLO TORRES;12191715-7;Ab.Recurrente;C.A. de Temuco;Rol: Protección-8728-2021 | Corte: C.A. de Temuco | Caratulado: RIVERA/ISAPRE COLMENA GOLDEN CROSS S.A. | Fecha Ingreso: 17/09/2021 | Estado Causa: Fallada-Terminada | Fecha Ubicación: 17/09/2021 | Ubicación: Archivo
NATALIA ANDREA RIVERA VELÁSQUEZ;15652102-7;Recurrente;C.A. de Temuco;Rol: Protección-8728-2021 | Corte: C.A. de Temuco | Caratulado: RIVERA/ISAPRE COLMENA GOLDEN CROSS S.A. | Fecha Ingreso: 17/09/2021 | Estado Causa: Fallada-Terminada | Fecha Ubicación: 17/09/2021 | Ubicación: Archivo
ISAPRE COLMENA GOLDEN CROSS S.A.;76296619-0;Recurrido;C.A. de Temuco;Rol: Protección-8728-2021 | Corte: C.A. de Temuco | Caratulado: RIVERA/ISAPRE COLMENA GOLDEN CROSS S.A. | Fecha Ingreso: 17/09/2021 | Estado Causa: Fallada-Terminada | Fecha Ubicación: 17/09/2021 | Ubicación: Archivo
