NOMBRE;DOCUMENTO;CARGO;INSTITUCION;OBSERVACIONES
EMILIO OSCAR BOCCAZZI CAMPOS;9639320-2;Recurrente;C.A. de Punta Arenas;Rol: Policia Local-25-2021 | Corte: C.A. de Punta Arenas | Caratulado: EMILIO BOCAZZI CAMPOS CON MARCO CARCAMO VILLARROEL Y BIPACOR COMERCIAL Y SERVICIOS SPA | Fecha Ingreso: 30/08/2021 | Estado Causa: Fallada-Terminada | Fecha Ubicación: 10/11/2021 | Ubicación: Primera Instancia
MARCOS ANTONIO CÁRCAMO VILLARROEL;16965873-0;Recurrido;C.A. de Punta Arenas;Rol: Policia Local-25-2021 | Corte: C.A. de Punta Arenas | Caratulado: EMILIO BOCAZZI CAMPOS CON MARCO CARCAMO VILLARROEL Y BIPACOR COMERCIAL Y SERVICIOS SPA | Fecha Ingreso: 30/08/2021 | Estado Causa: Fallada-Terminada | Fecha Ubicación: 10/11/2021 | Ubicación: Primera Instancia
VAITIARE ANDREA NICOLE HERNÁNDEZ NAVARRO;17893172-5;Ab. Recurrido;C.A. de Punta Arenas;Rol: Policia Local-25-2021 | Corte: C.A. de Punta Arenas | Caratulado: EMILIO BOCAZZI CAMPOS CON MARCO CARCAMO VILLARROEL Y BIPACOR COMERCIAL Y SERVICIOS SPA | Fecha Ingreso: 30/08/2021 | Estado Causa: Fallada-Terminada | Fecha Ubicación: 10/11/2021 | Ubicación: Primera Instancia
CRISTIAN ROBERTO GÓMEZ GALLARDO;9344455-8;Ab.Recurrente;C.A. de Punta Arenas;Rol: Policia Local-25-2021 | Corte: C.A. de Punta Arenas | Caratulado: EMILIO BOCAZZI CAMPOS CON MARCO CARCAMO VILLARROEL Y BIPACOR COMERCIAL Y SERVICIOS SPA | Fecha Ingreso: 30/08/2021 | Estado Causa: Fallada-Terminada | Fecha Ubicación: 10/11/2021 | Ubicación: Primera Instancia
VICENTE NICOLÁS FAÚNDEZ SAIZ;18297551-6;Recurrente;C.A. de Punta Arenas;Rol: Protección-1019-2021 | Corte: C.A. de Punta Arenas | Caratulado: FAÚNDEZ/ARAYA | Fecha Ingreso: 30/08/2021 | Estado Causa: Suspendido | Fecha Ubicación: 30/08/2021 | Ubicación: Archivo
VIRGINIA ARAYA ELIZALDE;6446953-3;Recurrido;C.A. de Punta Arenas;Rol: Protección-1019-2021 | Corte: C.A. de Punta Arenas | Caratulado: FAÚNDEZ/ARAYA | Fecha Ingreso: 30/08/2021 | Estado Causa: Suspendido | Fecha Ubicación: 30/08/2021 | Ubicación: Archivo
