NOMBRE;DOCUMENTO;CARGO;INSTITUCION;OBSERVACIONES
BÁRBARA BELÉN VERGARA SOTO;16930141-7;Ab.Recurrente;C.A. de Rancagua;Rol: Protección-11457-2021 | Corte: C.A. de Rancagua | Caratulado: SOTO URRIOLA/ISAPRE BANMEDICA S.A. | Fecha Ingreso: 19/06/2021 | Estado Causa: Fallada-Terminada | Fecha Ubicación: 19/06/2021 | Ubicación: Corte apelaciones
ISAPRE BANMEDICA S.A.;96572800-7;Recurrido;C.A. de Rancagua;Rol: Protección-11457-2021 | Corte: C.A. de Rancagua | Caratulado: SOTO URRIOLA/ISAPRE BANMEDICA S.A. | Fecha Ingreso: 19/06/2021 | Estado Causa: Fallada-Terminada | Fecha Ubicación: 19/06/2021 | Ubicación: Corte apelaciones
ARACELY FERNANDA SOTO URRIOLA;17108087-8;Recurrente;C.A. de Rancagua;Rol: Protección-11457-2021 | Corte: C.A. de Rancagua | Caratulado: SOTO URRIOLA/ISAPRE BANMEDICA S.A. | Fecha Ingreso: 19/06/2021 | Estado Causa: Fallada-Terminada | Fecha Ubicación: 19/06/2021 | Ubicación: Corte apelaciones
PABLO DANIEL PEÑALOZA PARRA;26322938-K;Ab.Recurrente;C.A. de Rancagua;Rol: Protección-11458-2021 | Corte: C.A. de Rancagua | Caratulado: BELTRAN/DEPARTAMENTO DE EXTRANJERÍA Y MIGRACION DEL MINISTERIO DEL INTERIOR Y SEGURIDAD PÚBLICA | Fecha Ingreso: 19/06/2021 | Estado Causa: Fallada-Terminada | Fecha Ubicación: 19/06/2021 | Ubicación: Archivo
DEPARTAMENTO DE EXTRANJERÍA Y MIGRACION DEL MINISTERIO DEL INTERIOR Y SEGURIDAD PÚBLICA;60501000-8;Recurrido;C.A. de Rancagua;Rol: Protección-11458-2021 | Corte: C.A. de Rancagua | Caratulado: BELTRAN/DEPARTAMENTO DE EXTRANJERÍA Y MIGRACION DEL MINISTERIO DEL INTERIOR Y SEGURIDAD PÚBLICA | Fecha Ingreso: 19/06/2021 | Estado Causa: Fallada-Terminada | Fecha Ubicación: 19/06/2021 | Ubicación: Archivo
JUNIOR NEBUR BELTRAN MEJIAS;26625021-5;Recurrente;C.A. de Rancagua;Rol: Protección-11458-2021 | Corte: C.A. de Rancagua | Caratulado: BELTRAN/DEPARTAMENTO DE EXTRANJERÍA Y MIGRACION DEL MINISTERIO DEL INTERIOR Y SEGURIDAD PÚBLICA | Fecha Ingreso: 19/06/2021 | Estado Causa: Fallada-Terminada | Fecha Ubicación: 19/06/2021 | Ubicación: Archivo
CLAUDIA ANDREA LEMARIE ACOSTA;14527332-3;Ab.Recurrente;C.A. de Rancagua;Rol: Protección-11459-2021 | Corte: C.A. de Rancagua | Caratulado: BRIZUELA/ISAPRE CRUZ BLANCA S.A. | Fecha Ingreso: 19/06/2021 | Estado Causa: Fallada-Terminada | Fecha Ubicación: 19/06/2021 | Ubicación: Corte apelaciones
HÉCTOR TOBÍAS BRIZUELA PONCE;15092344-1;Recurrente;C.A. de Rancagua;Rol: Protección-11459-2021 | Corte: C.A. de Rancagua | Caratulado: BRIZUELA/ISAPRE CRUZ BLANCA S.A. | Fecha Ingreso: 19/06/2021 | Estado Causa: Fallada-Terminada | Fecha Ubicación: 19/06/2021 | Ubicación: Corte apelaciones
ISAPRE CRUZ BLANCA S.A.;96501450-0;Recurrido;C.A. de Rancagua;Rol: Protección-11459-2021 | Corte: C.A. de Rancagua | Caratulado: BRIZUELA/ISAPRE CRUZ BLANCA S.A. | Fecha Ingreso: 19/06/2021 | Estado Causa: Fallada-Terminada | Fecha Ubicación: 19/06/2021 | Ubicación: Corte apelaciones
