NOMBRE;DOCUMENTO;CARGO;INSTITUCION;OBSERVACIONES
MARTÍN IGNACIO CABRERA GONZÁLEZ;21611387-K;Ampdo.;C.A. de Chillan;Rol: Amparo-55-2022 | Corte: C.A. de Chillan | Caratulado: EN FAVOR DE MARTIN IGNACIO CABRERA GONZALEZ/JUEZ DE GARANTIA DE CHILLAN | Fecha Ingreso: 19/03/2022 | Estado Causa: Fallada-Terminada | Fecha Ubicación: 07/04/2022 | Ubicación: Archivo
CAMILA JAVIERA DÍAZ LOGAN;17739937-K;Ab.Recurrente;C.A. de Chillan;Rol: Amparo-55-2022 | Corte: C.A. de Chillan | Caratulado: EN FAVOR DE MARTIN IGNACIO CABRERA GONZALEZ/JUEZ DE GARANTIA DE CHILLAN | Fecha Ingreso: 19/03/2022 | Estado Causa: Fallada-Terminada | Fecha Ubicación: 07/04/2022 | Ubicación: Archivo
JUZGADO GARANTIA CHILLAN;0-0;Recurrido;C.A. de Chillan;Rol: Amparo-55-2022 | Corte: C.A. de Chillan | Caratulado: EN FAVOR DE MARTIN IGNACIO CABRERA GONZALEZ/JUEZ DE GARANTIA DE CHILLAN | Fecha Ingreso: 19/03/2022 | Estado Causa: Fallada-Terminada | Fecha Ubicación: 07/04/2022 | Ubicación: Archivo
MARIANELA IVONNE ÁLVAREZ NAVARRO;13107359-3;Recurrente;C.A. de Chillan;Rol: Protección-238-2022 | Corte: C.A. de Chillan | Caratulado: ÁLVAREZ/SUSESO | Fecha Ingreso: 19/03/2022 | Estado Causa: Fallada-Terminada | Fecha Ubicación: 14/08/0023 | Ubicación: Archivo
SUSESO;61509000-K;Recurrido;C.A. de Chillan;Rol: Protección-238-2022 | Corte: C.A. de Chillan | Caratulado: ÁLVAREZ/SUSESO | Fecha Ingreso: 19/03/2022 | Estado Causa: Fallada-Terminada | Fecha Ubicación: 14/08/0023 | Ubicación: Archivo
HÉCTOR OCTAVIO CARRASCO VACCARO;18154320-5;Ab.Recurrente;C.A. de Chillan;Rol: Protección-238-2022 | Corte: C.A. de Chillan | Caratulado: ÁLVAREZ/SUSESO | Fecha Ingreso: 19/03/2022 | Estado Causa: Fallada-Terminada | Fecha Ubicación: 14/08/0023 | Ubicación: Archivo
TOMÁS MARCELO GARRO GÓMEZ;8482316-3;Ab. Recurrido;C.A. de Chillan;Rol: Protección-238-2022 | Corte: C.A. de Chillan | Caratulado: ÁLVAREZ/SUSESO | Fecha Ingreso: 19/03/2022 | Estado Causa: Fallada-Terminada | Fecha Ubicación: 14/08/0023 | Ubicación: Archivo
