NOMBRE;DOCUMENTO;CARGO;INSTITUCION;OBSERVACIONES
YASNA MARGARET MUÑOZ GIORGIA;17547470-6;DDO.;Juzgado de Letras y Gar.de Cochrane;Rol: C-4-2021 | Fecha: 09/03/2021 | Caratulado: PROMOTORA CMR FALABELLA S.A./MUÑOZ | Tribunal: Juzgado de Letras y Gar.de Cochrane
EDUARDO ENRIQUE VERA WANDERSLEBEN (Poder Amplio);7002763-1;AB.DTE;Juzgado de Letras y Gar.de Cochrane;Rol: C-4-2021 | Fecha: 09/03/2021 | Caratulado: PROMOTORA CMR FALABELLA S.A./MUÑOZ | Tribunal: Juzgado de Letras y Gar.de Cochrane
FERNANDO ABELINO ACUÑA GUTIÉRREZ (Sin Acreditacion);8977199-4;AP.DTE;Juzgado de Letras y Gar.de Cochrane;Rol: C-4-2021 | Fecha: 09/03/2021 | Caratulado: PROMOTORA CMR FALABELLA S.A./MUÑOZ | Tribunal: Juzgado de Letras y Gar.de Cochrane
PROMOTORA CMR FALABELLA S.A.;90743000-6;DTE.;Juzgado de Letras y Gar.de Cochrane;Rol: C-4-2021 | Fecha: 09/03/2021 | Caratulado: PROMOTORA CMR FALABELLA S.A./MUÑOZ | Tribunal: Juzgado de Letras y Gar.de Cochrane
SOCIEDAD DE INVERSIONES EL TINEO DEL SUR LIMITADA;0-0;DDO.;Juzgado de Letras y Gar.de Cochrane;Rol: E-34-2021 | Fecha: 05/03/2021 | Caratulado: SCOTIABANK CHILE S. A./Sociedad de inversiones el | Tribunal: Juzgado de Letras y Gar.de Cochrane
ANDRÉS EDUARDO SILVA CHARPENTIER;12659038-5;AB.DTE;Juzgado de Letras y Gar.de Cochrane;Rol: E-34-2021 | Fecha: 05/03/2021 | Caratulado: SCOTIABANK CHILE S. A./Sociedad de inversiones el | Tribunal: Juzgado de Letras y Gar.de Cochrane
SCOTIABANK CHILE S. A.;97018000-1;DTE.;Juzgado de Letras y Gar.de Cochrane;Rol: E-34-2021 | Fecha: 05/03/2021 | Caratulado: SCOTIABANK CHILE S. A./Sociedad de inversiones el | Tribunal: Juzgado de Letras y Gar.de Cochrane
