NOMBRE;DOCUMENTO;CARGO;INSTITUCION;OBSERVACIONES
VALE EXPLORACIONES CHILE LTDA;76031013-1;SOLIC.;Juzgado de Letras y Gar.de María Elena;Rol: V-1274-2021 | Fecha: 14/09/2021 | Caratulado: VALE EXPLORACIONES CHILE LTDA/ | Tribunal: Juzgado de Letras y Gar.de María Elena
IVAN JAVIER TORRES HOYOS;24452926-7;DDO.;Juzgado de Letras y Gar.de María Elena;Rol: C-95-2021 | Fecha: 13/09/2021 | Caratulado: SOCIEDAD QUÍMICA Y MINERA DE CHILE S.A./TORRES | Tribunal: Juzgado de Letras y Gar.de María Elena
VANESSA PAOLA REYES ARANCIBIA (Poder Amplio);16704726-2;AB.DTE;Juzgado de Letras y Gar.de María Elena;Rol: C-95-2021 | Fecha: 13/09/2021 | Caratulado: SOCIEDAD QUÍMICA Y MINERA DE CHILE S.A./TORRES | Tribunal: Juzgado de Letras y Gar.de María Elena
CARLA LORENA PEÑA Y LILLO AGUILERA (Poder Amplio);17979856-5;AB.DTE;Juzgado de Letras y Gar.de María Elena;Rol: C-95-2021 | Fecha: 13/09/2021 | Caratulado: SOCIEDAD QUÍMICA Y MINERA DE CHILE S.A./TORRES | Tribunal: Juzgado de Letras y Gar.de María Elena
SOCIEDAD QUÍMICA Y MINERA DE CHILE S.A.;93007000-9;DTE.;Juzgado de Letras y Gar.de María Elena;Rol: C-95-2021 | Fecha: 13/09/2021 | Caratulado: SOCIEDAD QUÍMICA Y MINERA DE CHILE S.A./TORRES | Tribunal: Juzgado de Letras y Gar.de María Elena
