NOMBRE;DOCUMENTO;CARGO;INSTITUCION;OBSERVACIONES
RODRIGO ARIEL SANHUEZA JOFRÉ;15565814-2;Recurrente;C.A. de San Miguel;Rol: Protección-1-2022 | Corte: C.A. de San Miguel | Caratulado: SANHUEZA/ISAPRE CRUZBLANCA S.A. | Fecha Ingreso: 02/01/2022 | Estado Causa: Fallada-Terminada | Fecha Ubicación: 29/12/0023 | Ubicación: Archivo
ERWIN MOLLER RUBIO;18463923-8;Ab.Recurrente;C.A. de San Miguel;Rol: Protección-1-2022 | Corte: C.A. de San Miguel | Caratulado: SANHUEZA/ISAPRE CRUZBLANCA S.A. | Fecha Ingreso: 02/01/2022 | Estado Causa: Fallada-Terminada | Fecha Ubicación: 29/12/0023 | Ubicación: Archivo
ISAPRE CRUZBLANCA S.A.;96501450-0;Recurrido;C.A. de San Miguel;Rol: Protección-1-2022 | Corte: C.A. de San Miguel | Caratulado: SANHUEZA/ISAPRE CRUZBLANCA S.A. | Fecha Ingreso: 02/01/2022 | Estado Causa: Fallada-Terminada | Fecha Ubicación: 29/12/0023 | Ubicación: Archivo
DIEGO HERNÁN VEGA NÚÑEZ;15467440-3;Ab.Recurrente;C.A. de San Miguel;Rol: Protección-2-2022 | Corte: C.A. de San Miguel | Caratulado: VICENTE MARTIN ROJAS ARAVENA/HOSPITAL BARROS LUCO TRUDEAU | Fecha Ingreso: 02/01/2022 | Estado Causa: Fallada-Terminada | Fecha Ubicación: 13/12/0023 | Ubicación: Archivo
VICENTE MARTÍN ROJAS ARAVENA;17418485-2;Recurrente;C.A. de San Miguel;Rol: Protección-2-2022 | Corte: C.A. de San Miguel | Caratulado: VICENTE MARTIN ROJAS ARAVENA/HOSPITAL BARROS LUCO TRUDEAU | Fecha Ingreso: 02/01/2022 | Estado Causa: Fallada-Terminada | Fecha Ubicación: 13/12/0023 | Ubicación: Archivo
HOSP. BARROS LUCO TRUDEAU;61608101-2;Recurrido;C.A. de San Miguel;Rol: Protección-2-2022 | Corte: C.A. de San Miguel | Caratulado: VICENTE MARTIN ROJAS ARAVENA/HOSPITAL BARROS LUCO TRUDEAU | Fecha Ingreso: 02/01/2022 | Estado Causa: Fallada-Terminada | Fecha Ubicación: 13/12/0023 | Ubicación: Archivo
FRANCISCO MARTÍN RUIZ-CLAVIJO SQUELLA;10634653-4;Recurrente;C.A. de San Miguel;Rol: Protección-3-2022 | Corte: C.A. de San Miguel | Caratulado: FRANCISCO RUIZ-CLAVIJO SQUELLA / ENEL DISTRIBUCION CHILE S.A. | Fecha Ingreso: 02/01/2022 | Estado Causa: Fallada-Terminada | Fecha Ubicación: 05/06/0023 | Ubicación: Archivo
CARLA ALEJANDRA SALAZAR MEZA;8683449-9;Ab.Recurrente;C.A. de San Miguel;Rol: Protección-3-2022 | Corte: C.A. de San Miguel | Caratulado: FRANCISCO RUIZ-CLAVIJO SQUELLA / ENEL DISTRIBUCION CHILE S.A. | Fecha Ingreso: 02/01/2022 | Estado Causa: Fallada-Terminada | Fecha Ubicación: 05/06/0023 | Ubicación: Archivo
ENEL DISTRIBUCION CHILE S.A.;96800570-7;Recurrido;C.A. de San Miguel;Rol: Protección-3-2022 | Corte: C.A. de San Miguel | Caratulado: FRANCISCO RUIZ-CLAVIJO SQUELLA / ENEL DISTRIBUCION CHILE S.A. | Fecha Ingreso: 02/01/2022 | Estado Causa: Fallada-Terminada | Fecha Ubicación: 05/06/0023 | Ubicación: Archivo
