NOMBRE;DOCUMENTO;CARGO;INSTITUCION;OBSERVACIONES
CARLOS EDUARDO ECHEÑIQUE BAHAMONDE;10078239-1;Recurrente;C.A. de Talca;Rol: Protección-2238-2021 | Corte: C.A. de Talca | Caratulado: ECHEÑIQUE/PARIS | Fecha Ingreso: 25/07/2021 | Estado Causa: Fallada-Terminada | Fecha Ubicación: 25/07/2021 | Ubicación: Corte apelaciones
OSCAR ENRIQUE PARIS MANCILLA;5964828-4;Recurrido;C.A. de Talca;Rol: Protección-2238-2021 | Corte: C.A. de Talca | Caratulado: ECHEÑIQUE/PARIS | Fecha Ingreso: 25/07/2021 | Estado Causa: Fallada-Terminada | Fecha Ubicación: 25/07/2021 | Ubicación: Corte apelaciones
OSCAR ORLANDO SEPÚLVEDA PEREIRA;8149026-0;Recurrente;C.A. de Talca;Rol: Protección-2239-2021 | Corte: C.A. de Talca | Caratulado: SEPÚLVEDA/SEREMI DE SALUD DE LA REGION DE LOS RÍOS | Fecha Ingreso: 25/07/2021 | Estado Causa: Fallada-Terminada | Fecha Ubicación: 25/07/2021 | Ubicación: Corte apelaciones
SEREMI DE SALUD DE LA REGION DE LOS RÍOS;61601000-K;Recurrido;C.A. de Talca;Rol: Protección-2239-2021 | Corte: C.A. de Talca | Caratulado: SEPÚLVEDA/SEREMI DE SALUD DE LA REGION DE LOS RÍOS | Fecha Ingreso: 25/07/2021 | Estado Causa: Fallada-Terminada | Fecha Ubicación: 25/07/2021 | Ubicación: Corte apelaciones
MÓNICA XIMENA CONTARDO MORAGA;7047967-2;Recurrente;C.A. de Talca;Rol: Protección-2240-2021 | Corte: C.A. de Talca | Caratulado: CONTARDO/SEREMI DE SALUD DE LA REGION DE LOS RÍOS | Fecha Ingreso: 25/07/2021 | Estado Causa: Fallada-Terminada | Fecha Ubicación: 25/07/2021 | Ubicación: Corte apelaciones
SEREMI DE SALUD DE LA REGION DE LOS RÍOS;61601000-K;Recurrido;C.A. de Talca;Rol: Protección-2240-2021 | Corte: C.A. de Talca | Caratulado: CONTARDO/SEREMI DE SALUD DE LA REGION DE LOS RÍOS | Fecha Ingreso: 25/07/2021 | Estado Causa: Fallada-Terminada | Fecha Ubicación: 25/07/2021 | Ubicación: Corte apelaciones
NATALY CANDELARIA CHAMORRO FAÚNDEZ;16679890-6;Recurrente;C.A. de Talca;Rol: Protección-2241-2021 | Corte: C.A. de Talca | Caratulado: CHAMORRO/PARIS | Fecha Ingreso: 25/07/2021 | Estado Causa: Fallada-Terminada | Fecha Ubicación: 25/07/2021 | Ubicación: Corte apelaciones
OSCAR ENRIQUE PARIS MANCILLA;5964828-4;Recurrido;C.A. de Talca;Rol: Protección-2241-2021 | Corte: C.A. de Talca | Caratulado: CHAMORRO/PARIS | Fecha Ingreso: 25/07/2021 | Estado Causa: Fallada-Terminada | Fecha Ubicación: 25/07/2021 | Ubicación: Corte apelaciones
