NOMBRE;DOCUMENTO;CARGO;INSTITUCION;OBSERVACIONES
ISAPRE NUEVA MAS VIDA S.A.;96504160-5;Recurrido;C.A. de Punta Arenas;Rol: Protección-3080-2022 | Corte: C.A. de Punta Arenas | Caratulado: MORANO/ISAPRE NUEVA MAS VIDA S.A. | Fecha Ingreso: 11/06/2022 | Estado Causa: Fallada-Terminada | Fecha Ubicación: 17/07/2023 | Ubicación: Archivo
CARLOS ALBERTO CONTRERAS QUINTANA;12180922-2;Ab.Recurrente;C.A. de Punta Arenas;Rol: Protección-3080-2022 | Corte: C.A. de Punta Arenas | Caratulado: MORANO/ISAPRE NUEVA MAS VIDA S.A. | Fecha Ingreso: 11/06/2022 | Estado Causa: Fallada-Terminada | Fecha Ubicación: 17/07/2023 | Ubicación: Archivo
JUAN ENRIQUE MORANO CORNEJO;6465446-2;Recurrente;C.A. de Punta Arenas;Rol: Protección-3080-2022 | Corte: C.A. de Punta Arenas | Caratulado: MORANO/ISAPRE NUEVA MAS VIDA S.A. | Fecha Ingreso: 11/06/2022 | Estado Causa: Fallada-Terminada | Fecha Ubicación: 17/07/2023 | Ubicación: Archivo
ISAPRE COLMENA GOLDEN CROSS S.A.;76296619-0;Recurrido;C.A. de Punta Arenas;Rol: Protección-3081-2022 | Corte: C.A. de Punta Arenas | Caratulado: BARRIENTOS/ISAPRE COLMENA GOLDEN CROSS S.A. | Fecha Ingreso: 11/06/2022 | Estado Causa: Fallada-Terminada | Fecha Ubicación: 12/10/2022 | Ubicación: Archivo
CARLA ELIZABETH BARRIENTOS HERNÁNDEZ;10360256-4;Recurrente;C.A. de Punta Arenas;Rol: Protección-3081-2022 | Corte: C.A. de Punta Arenas | Caratulado: BARRIENTOS/ISAPRE COLMENA GOLDEN CROSS S.A. | Fecha Ingreso: 11/06/2022 | Estado Causa: Fallada-Terminada | Fecha Ubicación: 12/10/2022 | Ubicación: Archivo
ALEJANDRO ANDRE CARTES RODRÍGUEZ;15648235-8;Ab.Recurrente;C.A. de Punta Arenas;Rol: Protección-3081-2022 | Corte: C.A. de Punta Arenas | Caratulado: BARRIENTOS/ISAPRE COLMENA GOLDEN CROSS S.A. | Fecha Ingreso: 11/06/2022 | Estado Causa: Fallada-Terminada | Fecha Ubicación: 12/10/2022 | Ubicación: Archivo
