NOMBRE;DOCUMENTO;CARGO;INSTITUCION;OBSERVACIONES
ISAPRE COLMENA GOLDEN CROSS S.A.;76296619-0;Recurrido;C.A. de Antofagasta;Rol: Protección-3035-2023 | Corte: C.A. de Antofagasta | Caratulado: DA SILVA/COMPIN Y COLMENA | Fecha Ingreso: 03/06/2023 | Estado Causa: Fallada-Terminada | Fecha Ubicación: 25/07/0023 | Ubicación: Corte Suprema
GLEISE DA SILVA ALVES;24187288-2;Recurrente;C.A. de Antofagasta;Rol: Protección-3035-2023 | Corte: C.A. de Antofagasta | Caratulado: DA SILVA/COMPIN Y COLMENA | Fecha Ingreso: 03/06/2023 | Estado Causa: Fallada-Terminada | Fecha Ubicación: 25/07/0023 | Ubicación: Corte Suprema
COMPIN;61509000-K;Recurrido;C.A. de Antofagasta;Rol: Protección-3035-2023 | Corte: C.A. de Antofagasta | Caratulado: DA SILVA/COMPIN Y COLMENA | Fecha Ingreso: 03/06/2023 | Estado Causa: Fallada-Terminada | Fecha Ubicación: 25/07/0023 | Ubicación: Corte Suprema
SERVICIO SALUD ANTOFAGASTA;61606200-K;Recurrido;C.A. de Antofagasta;Rol: Protección-3035-2023 | Corte: C.A. de Antofagasta | Caratulado: DA SILVA/COMPIN Y COLMENA | Fecha Ingreso: 03/06/2023 | Estado Causa: Fallada-Terminada | Fecha Ubicación: 25/07/0023 | Ubicación: Corte Suprema
JUAN EDUARDO GUZMÁN ZÚÑIGA;14108150-0;Ab.Recurrente;C.A. de Antofagasta;Rol: Protección-3036-2023 | Corte: C.A. de Antofagasta | Caratulado: arango/SERVICIO NACIONAL DE MIGRACIONES | Fecha Ingreso: 03/06/2023 | Estado Causa: Fallada-Terminada | Fecha Ubicación: 05/07/0023 | Ubicación: Corte Suprema
LEONARDO ARANGO ORTIZ;0-0;Recurrente;C.A. de Antofagasta;Rol: Protección-3036-2023 | Corte: C.A. de Antofagasta | Caratulado: arango/SERVICIO NACIONAL DE MIGRACIONES | Fecha Ingreso: 03/06/2023 | Estado Causa: Fallada-Terminada | Fecha Ubicación: 05/07/0023 | Ubicación: Corte Suprema
SERVICIO NACIONAL DE MIGRACIONES;62000920-2;Recurrido;C.A. de Antofagasta;Rol: Protección-3036-2023 | Corte: C.A. de Antofagasta | Caratulado: arango/SERVICIO NACIONAL DE MIGRACIONES | Fecha Ingreso: 03/06/2023 | Estado Causa: Fallada-Terminada | Fecha Ubicación: 05/07/0023 | Ubicación: Corte Suprema
