NOMBRE;DOCUMENTO;CARGO;INSTITUCION;OBSERVACIONES
MARÍA XIMENA SOTO VEJAR;8144742-K;Ampdo.;C.A. de Coyhaique;Rol: Amparo-12-2021 | Corte: C.A. de Coyhaique | Caratulado: /BARRÍA | Fecha Ingreso: 14/04/2021 | Estado Causa: Fallada-Terminada | Fecha Ubicación: 15/06/2021 | Ubicación: Archivo
OSCAR ALBERTO BARRÍA ALVARADO;6461977-2;Recurrido;C.A. de Coyhaique;Rol: Amparo-12-2021 | Corte: C.A. de Coyhaique | Caratulado: /BARRÍA | Fecha Ingreso: 14/04/2021 | Estado Causa: Fallada-Terminada | Fecha Ubicación: 15/06/2021 | Ubicación: Archivo
OSCAR DANIEL CATALÁN SUAZO;15910815-5;Recurrente;C.A. de Coyhaique;Rol: Protección-45-2021 | Corte: C.A. de Coyhaique | Caratulado: CATALÁN/CONTRALORIA REGIONAL DE AYSEN | Fecha Ingreso: 14/04/2021 | Estado Causa: Fallada-Terminada | Fecha Ubicación: 21/07/0021 | Ubicación: Corte Suprema
CONTRALORIA REGIONAL DE AYSEN;0-0;Recurrido;C.A. de Coyhaique;Rol: Protección-45-2021 | Corte: C.A. de Coyhaique | Caratulado: CATALÁN/CONTRALORIA REGIONAL DE AYSEN | Fecha Ingreso: 14/04/2021 | Estado Causa: Fallada-Terminada | Fecha Ubicación: 21/07/0021 | Ubicación: Corte Suprema
ALICIA NATALY GALLARDO ARENAS;16024312-0;Ab.Recurrente;C.A. de Coyhaique;Rol: Protección-45-2021 | Corte: C.A. de Coyhaique | Caratulado: CATALÁN/CONTRALORIA REGIONAL DE AYSEN | Fecha Ingreso: 14/04/2021 | Estado Causa: Fallada-Terminada | Fecha Ubicación: 21/07/0021 | Ubicación: Corte Suprema
