NOMBRE;DOCUMENTO;CARGO;INSTITUCION;OBSERVACIONES
MARÍA ELENA ABREU ACEVEDO;0-0;Ampdo.;C.A. de Chillan;Rol: Amparo-185-2021 | Corte: C.A. de Chillan | Caratulado: /DELEGACION PRESIDENCIAL REGIONAL DE VALPARAÍSO | Fecha Ingreso: 27/11/2021 | Estado Causa: Fallada-Terminada | Fecha Ubicación: 14/08/0023 | Ubicación: Archivo
CARLOS ESTEBAN RUIZ OBREGÓN;15492676-3;Ab.Recurrente;C.A. de Chillan;Rol: Amparo-185-2021 | Corte: C.A. de Chillan | Caratulado: /DELEGACION PRESIDENCIAL REGIONAL DE VALPARAÍSO | Fecha Ingreso: 27/11/2021 | Estado Causa: Fallada-Terminada | Fecha Ubicación: 14/08/0023 | Ubicación: Archivo
DELEGACION PRESIDENCIAL REGIONAL DE VALPARAÍSO;60511050-9;Recurrido;C.A. de Chillan;Rol: Amparo-185-2021 | Corte: C.A. de Chillan | Caratulado: /DELEGACION PRESIDENCIAL REGIONAL DE VALPARAÍSO | Fecha Ingreso: 27/11/2021 | Estado Causa: Fallada-Terminada | Fecha Ubicación: 14/08/0023 | Ubicación: Archivo
CARMEN GLORIA LUNA LEAL;10867223-4;Ab.Recurrente;C.A. de Chillan;Rol: Protección-2286-2021 | Corte: C.A. de Chillan | Caratulado: LÓPEZ/ISAPRE COLMENA GOLDEN CROSS S.A. | Fecha Ingreso: 27/11/2021 | Estado Causa: Fallada-Terminada | Fecha Ubicación: 14/08/0023 | Ubicación: Archivo
MARISOL MARGARITA LÓPEZ CABELLO;16211098-5;Recurrente;C.A. de Chillan;Rol: Protección-2286-2021 | Corte: C.A. de Chillan | Caratulado: LÓPEZ/ISAPRE COLMENA GOLDEN CROSS S.A. | Fecha Ingreso: 27/11/2021 | Estado Causa: Fallada-Terminada | Fecha Ubicación: 14/08/0023 | Ubicación: Archivo
ISAPRE COLMENA GOLDEN CROSS S.A.;76296619-0;Recurrido;C.A. de Chillan;Rol: Protección-2286-2021 | Corte: C.A. de Chillan | Caratulado: LÓPEZ/ISAPRE COLMENA GOLDEN CROSS S.A. | Fecha Ingreso: 27/11/2021 | Estado Causa: Fallada-Terminada | Fecha Ubicación: 14/08/0023 | Ubicación: Archivo
