NOMBRE;DOCUMENTO;CARGO;INSTITUCION;OBSERVACIONES
ALEJANDRO IVÁN MUÑOZ GÓMEZ;8695340-4;Ab.Recurrente;C.A. de Puerto Montt;Rol: Civil-826-2023 | Corte: C.A. de Puerto Montt | Caratulado: MASÍAS/TESORERÍA GENERAL DE LA REPÚBLICA CHILE | Fecha Ingreso: 30/07/2023 | Estado Causa: Fallada-Terminada | Fecha Ubicación: 30/07/2023 | Ubicación: Corte apelaciones
EDUARDO JAVIER MASÍAS NEUMANN;12538820-5;Recurrente;C.A. de Puerto Montt;Rol: Civil-826-2023 | Corte: C.A. de Puerto Montt | Caratulado: MASÍAS/TESORERÍA GENERAL DE LA REPÚBLICA CHILE | Fecha Ingreso: 30/07/2023 | Estado Causa: Fallada-Terminada | Fecha Ubicación: 30/07/2023 | Ubicación: Corte apelaciones
TESORERÍA GENERAL DE LA REPÚBLICA CHILE;60805000-0;Recurrido;C.A. de Puerto Montt;Rol: Civil-826-2023 | Corte: C.A. de Puerto Montt | Caratulado: MASÍAS/TESORERÍA GENERAL DE LA REPÚBLICA CHILE | Fecha Ingreso: 30/07/2023 | Estado Causa: Fallada-Terminada | Fecha Ubicación: 30/07/2023 | Ubicación: Corte apelaciones
BERNARDO ANDRÉS MONTECINOS GRAU;15638684-7;Ab.Recurrente;C.A. de Puerto Montt;Rol: Protección-1022-2023 | Corte: C.A. de Puerto Montt | Caratulado: NARVÁEZ/ISAPRE BANMEDICA S.A. | Fecha Ingreso: 30/07/2023 | Estado Causa: Fallada-Terminada | Fecha Ubicación: 30/07/2023 | Ubicación: Corte apelaciones
PAULO IGNAZIO NARVÁEZ LEÓN;15715334-K;Recurrente;C.A. de Puerto Montt;Rol: Protección-1022-2023 | Corte: C.A. de Puerto Montt | Caratulado: NARVÁEZ/ISAPRE BANMEDICA S.A. | Fecha Ingreso: 30/07/2023 | Estado Causa: Fallada-Terminada | Fecha Ubicación: 30/07/2023 | Ubicación: Corte apelaciones
ISAPRE BANMEDICA S.A.;96572800-7;Recurrido;C.A. de Puerto Montt;Rol: Protección-1022-2023 | Corte: C.A. de Puerto Montt | Caratulado: NARVÁEZ/ISAPRE BANMEDICA S.A. | Fecha Ingreso: 30/07/2023 | Estado Causa: Fallada-Terminada | Fecha Ubicación: 30/07/2023 | Ubicación: Corte apelaciones
TOKE SCHOU LARSEN;27437429-2;Recurrente;C.A. de Puerto Montt;Rol: Protección-1023-2023 | Corte: C.A. de Puerto Montt | Caratulado: LARSEN/SERVICIO NACIONAL DE MIGRACIONES | Fecha Ingreso: 30/07/2023 | Estado Causa: Fallada-Terminada | Fecha Ubicación: 30/07/2023 | Ubicación: Corte apelaciones
SERVICIO NACIONAL DE MIGRACIONES;62000920-2;Recurrido;C.A. de Puerto Montt;Rol: Protección-1023-2023 | Corte: C.A. de Puerto Montt | Caratulado: LARSEN/SERVICIO NACIONAL DE MIGRACIONES | Fecha Ingreso: 30/07/2023 | Estado Causa: Fallada-Terminada | Fecha Ubicación: 30/07/2023 | Ubicación: Corte apelaciones
