NOMBRE;DOCUMENTO;CARGO;INSTITUCION;OBSERVACIONES
JOSWAR JOSÉ BOSCAN BERBESI;0-0;Ampdo.;C.A. de Iquique;Rol: Amparo-528-2021 | Corte: C.A. de Iquique | Caratulado: BOSCAN BERBESI JOSWAR JOSÉ CONTRA INTENDENCIA REGIONAL DE TARAPACÁ | Fecha Ingreso: 27/06/2021 | Estado Causa: Fallada-Terminada | Fecha Ubicación: 27/06/2021 | Ubicación: Corte apelaciones
HENRY GERARD LAREZ RIVAS;25865739-K;Ab.Recurrente;C.A. de Iquique;Rol: Amparo-528-2021 | Corte: C.A. de Iquique | Caratulado: BOSCAN BERBESI JOSWAR JOSÉ CONTRA INTENDENCIA REGIONAL DE TARAPACÁ | Fecha Ingreso: 27/06/2021 | Estado Causa: Fallada-Terminada | Fecha Ubicación: 27/06/2021 | Ubicación: Corte apelaciones
INTENDENCIA REGIONAL DE TARAPACÁ;0-0;Recurrido;C.A. de Iquique;Rol: Amparo-528-2021 | Corte: C.A. de Iquique | Caratulado: BOSCAN BERBESI JOSWAR JOSÉ CONTRA INTENDENCIA REGIONAL DE TARAPACÁ | Fecha Ingreso: 27/06/2021 | Estado Causa: Fallada-Terminada | Fecha Ubicación: 27/06/2021 | Ubicación: Corte apelaciones
ANTONIO FERNANDO ROJAS ARAYA;11223252-4;Ab.Recurrente;C.A. de Iquique;Rol: Civil-268-2021 | Corte: C.A. de Iquique | Caratulado: RAUL PEY Y COMPAÑIA LIMITADA CON TERCER JUZGADO DE LETRAS DE IQUIQUE | Fecha Ingreso: 27/06/2021 | Estado Causa: Fallada-Terminada | Fecha Ubicación: 02/08/2021 | Ubicación: Archivo
RAUL PEY Y COMPAÑIA LIMITADA;77648340-0;Recurrente;C.A. de Iquique;Rol: Civil-268-2021 | Corte: C.A. de Iquique | Caratulado: RAUL PEY Y COMPAÑIA LIMITADA CON TERCER JUZGADO DE LETRAS DE IQUIQUE | Fecha Ingreso: 27/06/2021 | Estado Causa: Fallada-Terminada | Fecha Ubicación: 02/08/2021 | Ubicación: Archivo
CONSORCIO CONSTRUCTOR DE CANTABRIA SPA;76852727-K;Recurrido;C.A. de Iquique;Rol: Civil-268-2021 | Corte: C.A. de Iquique | Caratulado: RAUL PEY Y COMPAÑIA LIMITADA CON TERCER JUZGADO DE LETRAS DE IQUIQUE | Fecha Ingreso: 27/06/2021 | Estado Causa: Fallada-Terminada | Fecha Ubicación: 02/08/2021 | Ubicación: Archivo
DULVIS ESTÉVEZ MARTÍNEZ;26154160-2;Recurrente;C.A. de Iquique;Rol: Protección-531-2021 | Corte: C.A. de Iquique | Caratulado: DULVIS ESTÉVEZ MARTÍNEZ CONTRA SUBSECRETARÍA DEL MINISTERIO DEL INTERIOR Y SEGURIDAD PÚBLICA | Fecha Ingreso: 27/06/2021 | Estado Causa: Fallada-Terminada | Fecha Ubicación: 27/06/2021 | Ubicación: Corte apelaciones
SUBSECRETARÍA DEL MINISTERIO DEL INTERIOR Y SEGURIDAD PÚBLICA;60501000-8;Recurrido;C.A. de Iquique;Rol: Protección-531-2021 | Corte: C.A. de Iquique | Caratulado: DULVIS ESTÉVEZ MARTÍNEZ CONTRA SUBSECRETARÍA DEL MINISTERIO DEL INTERIOR Y SEGURIDAD PÚBLICA | Fecha Ingreso: 27/06/2021 | Estado Causa: Fallada-Terminada | Fecha Ubicación: 27/06/2021 | Ubicación: Corte apelaciones
