NOMBRE;DOCUMENTO;CARGO;INSTITUCION;OBSERVACIONES
ELBA FRANCISCA PEIRETTI PEÑA;5325003-3;Recurrente;C.A. de Arica;Rol: Protección-610-2021 | Corte: C.A. de Arica | Caratulado: PEIRETTI/SEREMI DE SALUD DE LA REGIÓN DEL MAULE | Fecha Ingreso: 16/07/2021 | Estado Causa: Fallada-Terminada | Fecha Ubicación: 29/07/2021 | Ubicación: Archivo
SEREMI DE SALUD DE LA REGIÓN DEL MAULE;61601000-K;Recurrido;C.A. de Arica;Rol: Protección-610-2021 | Corte: C.A. de Arica | Caratulado: PEIRETTI/SEREMI DE SALUD DE LA REGIÓN DEL MAULE | Fecha Ingreso: 16/07/2021 | Estado Causa: Fallada-Terminada | Fecha Ubicación: 29/07/2021 | Ubicación: Archivo
ANGÉLICA GERALDINA ARCE LUZA;5558635-7;Recurrente;C.A. de Arica;Rol: Protección-611-2021 | Corte: C.A. de Arica | Caratulado: ARCE/SEREMI DE SALUD DE LA REGIÓN DEL MAULE | Fecha Ingreso: 16/07/2021 | Estado Causa: Fallada-Terminada | Fecha Ubicación: 29/07/2021 | Ubicación: Archivo
SEREMI DE SALUD DE LA REGIÓN DEL MAULE;61601000-K;Recurrido;C.A. de Arica;Rol: Protección-611-2021 | Corte: C.A. de Arica | Caratulado: ARCE/SEREMI DE SALUD DE LA REGIÓN DEL MAULE | Fecha Ingreso: 16/07/2021 | Estado Causa: Fallada-Terminada | Fecha Ubicación: 29/07/2021 | Ubicación: Archivo
MARCOS RODOLFO GÓMEZ MATUS;11817260-4;Ab.Recurrente;C.A. de Arica;Rol: Amparo-303-2021 | Corte: C.A. de Arica | Caratulado: GÓMEZ/INTENDENCIA ARICA Y PARINACOTA | Fecha Ingreso: 16/07/2021 | Estado Causa: Fallada-Terminada | Fecha Ubicación: 30/07/0021 | Ubicación: Archivo
YULIANNYS ESPERANZA VILLADIEGO LOPEZ;0-0;Ampdo.;C.A. de Arica;Rol: Amparo-303-2021 | Corte: C.A. de Arica | Caratulado: GÓMEZ/INTENDENCIA ARICA Y PARINACOTA | Fecha Ingreso: 16/07/2021 | Estado Causa: Fallada-Terminada | Fecha Ubicación: 30/07/0021 | Ubicación: Archivo
MARCOS RODOLFO GÓMEZ MATUS;11817260-4;Recurrente;C.A. de Arica;Rol: Amparo-303-2021 | Corte: C.A. de Arica | Caratulado: GÓMEZ/INTENDENCIA ARICA Y PARINACOTA | Fecha Ingreso: 16/07/2021 | Estado Causa: Fallada-Terminada | Fecha Ubicación: 30/07/0021 | Ubicación: Archivo
INTENDENCIA ARICA Y PARINACOTA;61978970-9;Recurrido;C.A. de Arica;Rol: Amparo-303-2021 | Corte: C.A. de Arica | Caratulado: GÓMEZ/INTENDENCIA ARICA Y PARINACOTA | Fecha Ingreso: 16/07/2021 | Estado Causa: Fallada-Terminada | Fecha Ubicación: 30/07/0021 | Ubicación: Archivo
