NOMBRE;DOCUMENTO;CARGO;INSTITUCION;OBSERVACIONES
DELEGACIÓN PRESIDENCIAL REGIONAL DE ARICA Y PARINACOTA;61978970-9;Recurrido;C.A. de Punta Arenas;Rol: Amparo-123-2023 | Corte: C.A. de Punta Arenas | Caratulado: MORTILLO/DELEGACIÓN PRESIDENCIAL REGIONAL DE ARICA Y PARINACOTA | Fecha Ingreso: 20/10/2023 | Estado Causa: Fallada-Terminada | Fecha Ubicación: 16/11/2023 | Ubicación: Archivo
CLAUDIA BEATRIZ LOMAN;21190082-2;Ab.Recurrente;C.A. de Punta Arenas;Rol: Amparo-123-2023 | Corte: C.A. de Punta Arenas | Caratulado: MORTILLO/DELEGACIÓN PRESIDENCIAL REGIONAL DE ARICA Y PARINACOTA | Fecha Ingreso: 20/10/2023 | Estado Causa: Fallada-Terminada | Fecha Ubicación: 16/11/2023 | Ubicación: Archivo
OSCAR MORTILLO FELIZ;0-0;Ampdo.;C.A. de Punta Arenas;Rol: Amparo-123-2023 | Corte: C.A. de Punta Arenas | Caratulado: MORTILLO/DELEGACIÓN PRESIDENCIAL REGIONAL DE ARICA Y PARINACOTA | Fecha Ingreso: 20/10/2023 | Estado Causa: Fallada-Terminada | Fecha Ubicación: 16/11/2023 | Ubicación: Archivo
CORPORACIÓN MUNICIPAL DE PUNTA ARENAS, PARA LA EDUCACIÓN, SALUD Y ATENCIÓN AL MENOR;70931900-0;Recurrente;C.A. de Punta Arenas;Rol: Protección-579-2023 | Corte: C.A. de Punta Arenas | Caratulado: CORPORACIÓN MUNICIPAL DE PUNTA ARENAS, PARA LA EDUCACIÓN, SALUD Y ATENCIÓN AL MENOR/MANCILLA | Fecha Ingreso: 20/10/2023 | Estado Causa: Fallada-Terminada | Fecha Ubicación: 19/04/2024 | Ubicación: Archivo
CONSUELO PILAR MIRANDA CORONA;17910234-K;Ab.Recurrente;C.A. de Punta Arenas;Rol: Protección-579-2023 | Corte: C.A. de Punta Arenas | Caratulado: CORPORACIÓN MUNICIPAL DE PUNTA ARENAS, PARA LA EDUCACIÓN, SALUD Y ATENCIÓN AL MENOR/MANCILLA | Fecha Ingreso: 20/10/2023 | Estado Causa: Fallada-Terminada | Fecha Ubicación: 19/04/2024 | Ubicación: Archivo
JULIÁN EDGARDO PATRICIO MANCILLA PÉREZ;7564018-8;Recurrido;C.A. de Punta Arenas;Rol: Protección-579-2023 | Corte: C.A. de Punta Arenas | Caratulado: CORPORACIÓN MUNICIPAL DE PUNTA ARENAS, PARA LA EDUCACIÓN, SALUD Y ATENCIÓN AL MENOR/MANCILLA | Fecha Ingreso: 20/10/2023 | Estado Causa: Fallada-Terminada | Fecha Ubicación: 19/04/2024 | Ubicación: Archivo
KARINA PAOLA MANCILLA BARRÍA;10371455-9;Ab. Recurrido;C.A. de Punta Arenas;Rol: Protección-579-2023 | Corte: C.A. de Punta Arenas | Caratulado: CORPORACIÓN MUNICIPAL DE PUNTA ARENAS, PARA LA EDUCACIÓN, SALUD Y ATENCIÓN AL MENOR/MANCILLA | Fecha Ingreso: 20/10/2023 | Estado Causa: Fallada-Terminada | Fecha Ubicación: 19/04/2024 | Ubicación: Archivo
