NOMBRE;DOCUMENTO;CARGO;INSTITUCION;OBSERVACIONES
PABLO DANIEL PEÑALOZA PARRA;26322938-K;Ab.Recurrente;C.A. de Iquique;Rol: Protección-820-2021 | Corte: C.A. de Iquique | Caratulado: MOLINA DURAN JESUS CONTRA DEPARTAMENTO DE EXTRANJERIA Y MIGRACION DEL MINISTERIO DEL INTERIOR Y SEGURIDAD PUBLICA | Fecha Ingreso: 14/11/2021 | Estado Causa: Fallada-Terminada | Fecha Ubicación: 14/11/2021 | Ubicación: Corte apelaciones
DEPARTAMENTO DE EXTRANJERIA Y MIGRACION DEL MINISTERIO DEL INTERIOR Y SEGURIDAD PUBLICA;60501000-8;Recurrido;C.A. de Iquique;Rol: Protección-820-2021 | Corte: C.A. de Iquique | Caratulado: MOLINA DURAN JESUS CONTRA DEPARTAMENTO DE EXTRANJERIA Y MIGRACION DEL MINISTERIO DEL INTERIOR Y SEGURIDAD PUBLICA | Fecha Ingreso: 14/11/2021 | Estado Causa: Fallada-Terminada | Fecha Ubicación: 14/11/2021 | Ubicación: Corte apelaciones
JESUS JAVIER MOLINA DURAN;26543903-9;Recurrente;C.A. de Iquique;Rol: Protección-820-2021 | Corte: C.A. de Iquique | Caratulado: MOLINA DURAN JESUS CONTRA DEPARTAMENTO DE EXTRANJERIA Y MIGRACION DEL MINISTERIO DEL INTERIOR Y SEGURIDAD PUBLICA | Fecha Ingreso: 14/11/2021 | Estado Causa: Fallada-Terminada | Fecha Ubicación: 14/11/2021 | Ubicación: Corte apelaciones
ANGEL CORVALAN JOFRE;18898921-7;Ampdo.;C.A. de Iquique;Rol: Amparo-856-2021 | Corte: C.A. de Iquique | Caratulado: CORVALAN JOFRE ANGEL AMADO CONTRA JUZGADO DE LETRAS, FAMILIA Y DEL TRABAJO DE ALTO HOSPICIO. | Fecha Ingreso: 14/11/2021 | Estado Causa: Fallada-Terminada | Fecha Ubicación: 24/11/0021 | Ubicación: Corte Suprema
RICARDO ANDRÉS RIVERA TRUJILLO;16594305-8;Ab.Recurrente;C.A. de Iquique;Rol: Amparo-856-2021 | Corte: C.A. de Iquique | Caratulado: CORVALAN JOFRE ANGEL AMADO CONTRA JUZGADO DE LETRAS, FAMILIA Y DEL TRABAJO DE ALTO HOSPICIO. | Fecha Ingreso: 14/11/2021 | Estado Causa: Fallada-Terminada | Fecha Ubicación: 24/11/0021 | Ubicación: Corte Suprema
JUZGADO DE LETRAS, FAMILIA Y DEL TRABAJO DE ALTO HOSPICIO.;61980760-K;Recurrido;C.A. de Iquique;Rol: Amparo-856-2021 | Corte: C.A. de Iquique | Caratulado: CORVALAN JOFRE ANGEL AMADO CONTRA JUZGADO DE LETRAS, FAMILIA Y DEL TRABAJO DE ALTO HOSPICIO. | Fecha Ingreso: 14/11/2021 | Estado Causa: Fallada-Terminada | Fecha Ubicación: 24/11/0021 | Ubicación: Corte Suprema
