NOMBRE;DOCUMENTO;CARGO;INSTITUCION;OBSERVACIONES
SINDICATO N 3º DE TRABAJADORES INDEPENDIENTES COMERCIANTES FERIAS LIBRES DE TALCAHUANO;0-0;Recurrido;C.A. de Concepción;Rol: Protección-3139-2023 | Corte: C.A. de Concepción | Caratulado: JULIO HERIBERTO MATUS DE LA PARRA CRAVERO Y OTRO/SINDICATO N 3º DE TRABAJADORES INDEPENDIENTES COMERCIANTES FERIAS LIBRES DE TALCAH | Fecha Ingreso: 26/02/2023 | Estado Causa: Fallada-Terminada | Fecha Ubicación: 26/02/2023 | Ubicación: Corte apelaciones
CLAUDIA ELENA PRADENAS SANHUEZA;15175256-K;Ab.Recurrente;C.A. de Concepción;Rol: Protección-3139-2023 | Corte: C.A. de Concepción | Caratulado: JULIO HERIBERTO MATUS DE LA PARRA CRAVERO Y OTRO/SINDICATO N 3º DE TRABAJADORES INDEPENDIENTES COMERCIANTES FERIAS LIBRES DE TALCAH | Fecha Ingreso: 26/02/2023 | Estado Causa: Fallada-Terminada | Fecha Ubicación: 26/02/2023 | Ubicación: Corte apelaciones
JULIO HERIBERTO MATUS DE LA PARRA CRAVERO;5848075-4;Recurrente;C.A. de Concepción;Rol: Protección-3139-2023 | Corte: C.A. de Concepción | Caratulado: JULIO HERIBERTO MATUS DE LA PARRA CRAVERO Y OTRO/SINDICATO N 3º DE TRABAJADORES INDEPENDIENTES COMERCIANTES FERIAS LIBRES DE TALCAH | Fecha Ingreso: 26/02/2023 | Estado Causa: Fallada-Terminada | Fecha Ubicación: 26/02/2023 | Ubicación: Corte apelaciones
DAVID ALEJANDRO MATUS DE LA PARRA CONTRERAS;12071261-6;Recurrente;C.A. de Concepción;Rol: Protección-3139-2023 | Corte: C.A. de Concepción | Caratulado: JULIO HERIBERTO MATUS DE LA PARRA CRAVERO Y OTRO/SINDICATO N 3º DE TRABAJADORES INDEPENDIENTES COMERCIANTES FERIAS LIBRES DE TALCAH | Fecha Ingreso: 26/02/2023 | Estado Causa: Fallada-Terminada | Fecha Ubicación: 26/02/2023 | Ubicación: Corte apelaciones
CRISTIAN ADECIO ECHAYZ CARRASCO;12050212-3;Recurrente;C.A. de Concepción;Rol: Protección-3140-2023 | Corte: C.A. de Concepción | Caratulado: ECHAYZ/SERVICIO DE REGISTRO CIVIL E IDENTIFICACION DIRECCION REGION DEL BIO BIO | Fecha Ingreso: 26/02/2023 | Estado Causa: Fallada-Terminada | Fecha Ubicación: 26/02/2023 | Ubicación: Corte apelaciones
CRISTIAN ADECIO ECHAYZ CARRASCO;12050212-3;Ab.Recurrente;C.A. de Concepción;Rol: Protección-3140-2023 | Corte: C.A. de Concepción | Caratulado: ECHAYZ/SERVICIO DE REGISTRO CIVIL E IDENTIFICACION DIRECCION REGION DEL BIO BIO | Fecha Ingreso: 26/02/2023 | Estado Causa: Fallada-Terminada | Fecha Ubicación: 26/02/2023 | Ubicación: Corte apelaciones
SERVICIO DE REGISTRO CIVIL E IDENTIFICACION DIRECCION REGION DEL BIO BIO;61002019-4;Recurrido;C.A. de Concepción;Rol: Protección-3140-2023 | Corte: C.A. de Concepción | Caratulado: ECHAYZ/SERVICIO DE REGISTRO CIVIL E IDENTIFICACION DIRECCION REGION DEL BIO BIO | Fecha Ingreso: 26/02/2023 | Estado Causa: Fallada-Terminada | Fecha Ubicación: 26/02/2023 | Ubicación: Corte apelaciones
