NOMBRE;DOCUMENTO;CARGO;INSTITUCION;OBSERVACIONES
ZUNILDA ESTER MILLACURA CRETTON;15644862-1;Recurrente;C.A. de Puerto Montt;Rol: Protección-118-2024 | Corte: C.A. de Puerto Montt | Caratulado: MILLACURA/DIPRECA FONDO HOSPITAL | Fecha Ingreso: 04/02/2024 | Estado Causa: Fallada-Terminada | Fecha Ubicación: 06/02/2024 | Ubicación: Archivo
JUZGADO DE FAMILIA DE PUERTO VARAS;61977810-3;Recurrido;C.A. de Puerto Montt;Rol: Protección-118-2024 | Corte: C.A. de Puerto Montt | Caratulado: MILLACURA/DIPRECA FONDO HOSPITAL | Fecha Ingreso: 04/02/2024 | Estado Causa: Fallada-Terminada | Fecha Ubicación: 06/02/2024 | Ubicación: Archivo
DIPRECA FONDO HOSPITAL;61513003-6;Recurrido;C.A. de Puerto Montt;Rol: Protección-118-2024 | Corte: C.A. de Puerto Montt | Caratulado: MILLACURA/DIPRECA FONDO HOSPITAL | Fecha Ingreso: 04/02/2024 | Estado Causa: Fallada-Terminada | Fecha Ubicación: 06/02/2024 | Ubicación: Archivo
MATÍAS IGNACIO BENAVENTE YOBANOLO;20641446-4;Recurrente;C.A. de Puerto Montt;Rol: Protección-119-2024 | Corte: C.A. de Puerto Montt | Caratulado: BENAVENTE/PESQUERA LA PORTADA S.A | Fecha Ingreso: 04/02/2024 | Estado Causa: Fallada-Terminada | Fecha Ubicación: 04/02/2024 | Ubicación: Corte apelaciones
VICTORIA FLOR PAULINA MERA CORTÉS;15847476-K;Ab.Recurrente;C.A. de Puerto Montt;Rol: Protección-119-2024 | Corte: C.A. de Puerto Montt | Caratulado: BENAVENTE/PESQUERA LA PORTADA S.A | Fecha Ingreso: 04/02/2024 | Estado Causa: Fallada-Terminada | Fecha Ubicación: 04/02/2024 | Ubicación: Corte apelaciones
PESQUERA LA PORTADA S.A;95632000-3;Recurrido;C.A. de Puerto Montt;Rol: Protección-119-2024 | Corte: C.A. de Puerto Montt | Caratulado: BENAVENTE/PESQUERA LA PORTADA S.A | Fecha Ingreso: 04/02/2024 | Estado Causa: Fallada-Terminada | Fecha Ubicación: 04/02/2024 | Ubicación: Corte apelaciones
PRIMER JUZGADO CIVIL DE TALCAHUANO;60310028-K;Recurrido;C.A. de Puerto Montt;Rol: Amparo-45-2024 | Corte: C.A. de Puerto Montt | Caratulado: /PRIMER JUZGADO CIVIL DE TALCAHUANO | Fecha Ingreso: 04/02/2024 | Estado Causa: Fallada-Terminada | Fecha Ubicación: 04/02/2024 | Ubicación: Corte apelaciones
OSCAR GONZALO ARISMENDI HERNÁNDEZ;8099467-2;Ampdo.;C.A. de Puerto Montt;Rol: Amparo-45-2024 | Corte: C.A. de Puerto Montt | Caratulado: /PRIMER JUZGADO CIVIL DE TALCAHUANO | Fecha Ingreso: 04/02/2024 | Estado Causa: Fallada-Terminada | Fecha Ubicación: 04/02/2024 | Ubicación: Corte apelaciones
