NOMBRE;DOCUMENTO;CARGO;INSTITUCION;OBSERVACIONES
PABLO DANIEL PEÑALOZA PARRA;26322938-K;Ab.Recurrente;C.A. de San Miguel;Rol: Protección-5214-2021 | Corte: C.A. de San Miguel | Caratulado: ELIESER MEDINA SANCHEZ / DEPARTAMENTO DE EXTRANJERÍA Y MIGRACIÓN DEL MINISTERIO DEL INTERIOR Y SEGURIDAD PÚBLICA DE CHILE | Fecha Ingreso: 05/09/2021 | Estado Causa: Fallada-Terminada | Fecha Ubicación: 17/03/0022 | Ubicación: Archivo
DEPARTAMENTO DE EXTRANJERÍA Y MIGRACIÓN DEL MINISTERIO DEL INTERIOR Y SEGURIDAD PÚBLICA;60501000-8;Recurrido;C.A. de San Miguel;Rol: Protección-5214-2021 | Corte: C.A. de San Miguel | Caratulado: ELIESER MEDINA SANCHEZ / DEPARTAMENTO DE EXTRANJERÍA Y MIGRACIÓN DEL MINISTERIO DEL INTERIOR Y SEGURIDAD PÚBLICA DE CHILE | Fecha Ingreso: 05/09/2021 | Estado Causa: Fallada-Terminada | Fecha Ubicación: 17/03/0022 | Ubicación: Archivo
ELIESER NATALI MEDINA SANCHEZ;27085329-3;Recurrente;C.A. de San Miguel;Rol: Protección-5214-2021 | Corte: C.A. de San Miguel | Caratulado: ELIESER MEDINA SANCHEZ / DEPARTAMENTO DE EXTRANJERÍA Y MIGRACIÓN DEL MINISTERIO DEL INTERIOR Y SEGURIDAD PÚBLICA DE CHILE | Fecha Ingreso: 05/09/2021 | Estado Causa: Fallada-Terminada | Fecha Ubicación: 17/03/0022 | Ubicación: Archivo
CLAUDIA ELISA MEDINA VALERIA;15381524-0;Recurrente;C.A. de San Miguel;Rol: Protección-5215-2021 | Corte: C.A. de San Miguel | Caratulado: MEDINA/ISAPRE NUEVA MAS VIDA S.A. | Fecha Ingreso: 05/09/2021 | Estado Causa: Fallada-Terminada | Fecha Ubicación: 29/12/0023 | Ubicación: Archivo
ALEXANDRA LORETO PARDO VALENZUELA;15368784-6;Ab.Recurrente;C.A. de San Miguel;Rol: Protección-5215-2021 | Corte: C.A. de San Miguel | Caratulado: MEDINA/ISAPRE NUEVA MAS VIDA S.A. | Fecha Ingreso: 05/09/2021 | Estado Causa: Fallada-Terminada | Fecha Ubicación: 29/12/0023 | Ubicación: Archivo
ISAPRE NUEVA MAS VIDA S.A.;96504160-5;Recurrido;C.A. de San Miguel;Rol: Protección-5215-2021 | Corte: C.A. de San Miguel | Caratulado: MEDINA/ISAPRE NUEVA MAS VIDA S.A. | Fecha Ingreso: 05/09/2021 | Estado Causa: Fallada-Terminada | Fecha Ubicación: 29/12/0023 | Ubicación: Archivo
