NOMBRE;DOCUMENTO;CARGO;INSTITUCION;OBSERVACIONES
LORENA MERCEDES MAGGIO GULDNER;12155234-5;Ab.Recurrente;C.A. de Valdivia;Rol: Amparo-27-2023 | Corte: C.A. de Valdivia | Caratulado: /GENDARMERÍA DE CHILE DIRECCIÓN NACIONAL | Fecha Ingreso: 26/03/2023 | Estado Causa: Fallada-Terminada | Fecha Ubicación: 16/04/2023 | Ubicación: Archivo
GENDARMERÍA DE CHILE DIRECCIÓN NACIONAL;61004000-4;Recurrido;C.A. de Valdivia;Rol: Amparo-27-2023 | Corte: C.A. de Valdivia | Caratulado: /GENDARMERÍA DE CHILE DIRECCIÓN NACIONAL | Fecha Ingreso: 26/03/2023 | Estado Causa: Fallada-Terminada | Fecha Ubicación: 16/04/2023 | Ubicación: Archivo
ORLANDO DEL TRÁNSITO GUZMÁN ÁVILA;7687294-5;Ampdo.;C.A. de Valdivia;Rol: Amparo-27-2023 | Corte: C.A. de Valdivia | Caratulado: /GENDARMERÍA DE CHILE DIRECCIÓN NACIONAL | Fecha Ingreso: 26/03/2023 | Estado Causa: Fallada-Terminada | Fecha Ubicación: 16/04/2023 | Ubicación: Archivo
EMIR JAVIER DE LA GUARDA CAMINOS;10691475-3;Recurrente;C.A. de Valdivia;Rol: Protección-201-2023 | Corte: C.A. de Valdivia | Caratulado: DE LA GUARDA/DIRECCIÓN DE EDUCACIÓN, DOCTRINA E HISTORIA DE CARABINEROS DE CHILE | Fecha Ingreso: 26/03/2023 | Estado Causa: Fallada-Terminada | Fecha Ubicación: 16/09/0024 | Ubicación: Archivo
DIRECCIÓN DE EDUCACIÓN, DOCTRINA E HISTORIA DE CARABINEROS DE CHILE;60505000-K;Recurrido;C.A. de Valdivia;Rol: Protección-201-2023 | Corte: C.A. de Valdivia | Caratulado: DE LA GUARDA/DIRECCIÓN DE EDUCACIÓN, DOCTRINA E HISTORIA DE CARABINEROS DE CHILE | Fecha Ingreso: 26/03/2023 | Estado Causa: Fallada-Terminada | Fecha Ubicación: 16/09/0024 | Ubicación: Archivo
FELIPE ESTEBAN ÁLVAREZ HERNÁNDEZ;18427544-9;Ab.Recurrente;C.A. de Valdivia;Rol: Amparo-28-2023 | Corte: C.A. de Valdivia | Caratulado: /CENTRO DE ESTUDIOS Y TRABAJOS DE VALDIVIA CET GENDARMERÍA | Fecha Ingreso: 26/03/2023 | Estado Causa: Fallada-Terminada | Fecha Ubicación: 17/04/2023 | Ubicación: Archivo
EDUARDO JAVIER RAMÍREZ ARANEDA;13399714-8;Ampdo.;C.A. de Valdivia;Rol: Amparo-28-2023 | Corte: C.A. de Valdivia | Caratulado: /CENTRO DE ESTUDIOS Y TRABAJOS DE VALDIVIA CET GENDARMERÍA | Fecha Ingreso: 26/03/2023 | Estado Causa: Fallada-Terminada | Fecha Ubicación: 17/04/2023 | Ubicación: Archivo
CENTRO DE ESTUDIOS Y TRABAJOS DE VALDIVIA CET GENDARMERÍA;0-0;Recurrido;C.A. de Valdivia;Rol: Amparo-28-2023 | Corte: C.A. de Valdivia | Caratulado: /CENTRO DE ESTUDIOS Y TRABAJOS DE VALDIVIA CET GENDARMERÍA | Fecha Ingreso: 26/03/2023 | Estado Causa: Fallada-Terminada | Fecha Ubicación: 17/04/2023 | Ubicación: Archivo
