NOMBRE;DOCUMENTO;CARGO;INSTITUCION;OBSERVACIONES
ADM. DE FONDOS DE CESANTIA CHILE II S.A.;76237243-6;DTE.;1º Juzgado de Letras de San Antonio;RIT: E-9-2022 | Tribunal: 1º Juzgado de Letras de San Antonio | Caratulado: ADM. DE FONDOS DE CESANTIA CHILE II S.A. CON WALTER ARE | Fecha Ingreso: 31/01/2022 | Estado Procesal: Concluido | RIT: E-9-2022 | Fecha Ing.: 31/01/2022 | RUC: 14- 3-0357962-2 | Est. Adm.: Archivada | Proc.: Exhorto | Forma Inicio.: Exhorto | Estado Proc.: Concluido | Etapa: Terminada | Titulo Ejec.:  | Juez Asignado: PALOMA FERNANDEZ FERNANDEZ | Tribunal: 1º Juzgado de Letras de San Antonio
MANUEL FIGUEROA SAAVEDRA;2415267-7;AB.DTE;1º Juzgado de Letras de San Antonio;RIT: E-9-2022 | Tribunal: 1º Juzgado de Letras de San Antonio | Caratulado: ADM. DE FONDOS DE CESANTIA CHILE II S.A. CON WALTER ARE | Fecha Ingreso: 31/01/2022 | Estado Procesal: Concluido | RIT: E-9-2022 | Fecha Ing.: 31/01/2022 | RUC: 14- 3-0357962-2 | Est. Adm.: Archivada | Proc.: Exhorto | Forma Inicio.: Exhorto | Estado Proc.: Concluido | Etapa: Terminada | Titulo Ejec.:  | Juez Asignado: PALOMA FERNANDEZ FERNANDEZ | Tribunal: 1º Juzgado de Letras de San Antonio
WALTER AREVALO MORALES EIRL;76125036-1;DDO.;1º Juzgado de Letras de San Antonio;RIT: E-9-2022 | Tribunal: 1º Juzgado de Letras de San Antonio | Caratulado: ADM. DE FONDOS DE CESANTIA CHILE II S.A. CON WALTER ARE | Fecha Ingreso: 31/01/2022 | Estado Procesal: Concluido | RIT: E-9-2022 | Fecha Ing.: 31/01/2022 | RUC: 14- 3-0357962-2 | Est. Adm.: Archivada | Proc.: Exhorto | Forma Inicio.: Exhorto | Estado Proc.: Concluido | Etapa: Terminada | Titulo Ejec.:  | Juez Asignado: PALOMA FERNANDEZ FERNANDEZ | Tribunal: 1º Juzgado de Letras de San Antonio
NUEVA MASVIDA S.A. (EX ISAPRE ÓPTIMA);96504160-5;DTE.;1º Juzgado de Letras de San Antonio;RIT: P-33-2022 | Tribunal: 1º Juzgado de Letras de San Antonio | Caratulado: NUEVA MASVIDA S.A. (Ex Isapre Óptima)/CLEAN SAFE SPA | Fecha Ingreso: 28/01/2022 | Estado Procesal: Tramitación | RIT: P-33-2022 | Fecha Ing.: 28/01/2022 | RUC: 22- 3-0022414-1 | Est. Adm.: Archivada | Proc.: Ejecutivo Previsional | Forma Inicio.: Demanda | Estado Proc.: Tramitación | Etapa: Ingreso | Titulo Ejec.:  | Juez Asignado: PALOMA FERNANDEZ FERNANDEZ | Tribunal: 1º Juzgado de Letras de San Antonio
ÁLVARO ANDRÉS MOLINA LEIVA;13671419-8;AB.DTE;1º Juzgado de Letras de San Antonio;RIT: P-33-2022 | Tribunal: 1º Juzgado de Letras de San Antonio | Caratulado: NUEVA MASVIDA S.A. (Ex Isapre Óptima)/CLEAN SAFE SPA | Fecha Ingreso: 28/01/2022 | Estado Procesal: Tramitación | RIT: P-33-2022 | Fecha Ing.: 28/01/2022 | RUC: 22- 3-0022414-1 | Est. Adm.: Archivada | Proc.: Ejecutivo Previsional | Forma Inicio.: Demanda | Estado Proc.: Tramitación | Etapa: Ingreso | Titulo Ejec.:  | Juez Asignado: PALOMA FERNANDEZ FERNANDEZ | Tribunal: 1º Juzgado de Letras de San Antonio
CLEAN SAFE SPA;76634863-7;DDO.;1º Juzgado de Letras de San Antonio;RIT: P-33-2022 | Tribunal: 1º Juzgado de Letras de San Antonio | Caratulado: NUEVA MASVIDA S.A. (Ex Isapre Óptima)/CLEAN SAFE SPA | Fecha Ingreso: 28/01/2022 | Estado Procesal: Tramitación | RIT: P-33-2022 | Fecha Ing.: 28/01/2022 | RUC: 22- 3-0022414-1 | Est. Adm.: Archivada | Proc.: Ejecutivo Previsional | Forma Inicio.: Demanda | Estado Proc.: Tramitación | Etapa: Ingreso | Titulo Ejec.:  | Juez Asignado: PALOMA FERNANDEZ FERNANDEZ | Tribunal: 1º Juzgado de Letras de San Antonio
