NOMBRE;DOCUMENTO;CARGO;INSTITUCION;OBSERVACIONES
SOCIEDAD ADMINISTRADORA DE FONDOS DE CESANTIA DE CHILE II S.A.;76237243-6;DTE.;1° Juzgado de Letras de Talagante;RIT: P-94-2023 | Tribunal: 1° Juzgado de Letras de Talagante | Caratulado: ADM. DE FONDOS DE CESANTIA CHILE II S.A. CON FRABRICA D | Fecha Ingreso: 27/02/2023 | Estado Procesal: Concluido | RIT: P-94-2023 | Fecha Ing.: 27/02/2023 | RUC: 23- 3-0051022-1 | Est. Adm.: Sin archivar | Proc.: Ejecutivo Previsional | Forma Inicio.: Demanda | Estado Proc.: Concluido | Etapa: Terminada | Titulo Ejec.:  | Juez Asignado: GERARDO MENA EDWARDS | Tribunal: 1° Juzgado de Letras de Talagante
FRABRICA DE PALLETS MUNOZ VILO LTDA;77002943-0;DDO.;1° Juzgado de Letras de Talagante;RIT: P-94-2023 | Tribunal: 1° Juzgado de Letras de Talagante | Caratulado: ADM. DE FONDOS DE CESANTIA CHILE II S.A. CON FRABRICA D | Fecha Ingreso: 27/02/2023 | Estado Procesal: Concluido | RIT: P-94-2023 | Fecha Ing.: 27/02/2023 | RUC: 23- 3-0051022-1 | Est. Adm.: Sin archivar | Proc.: Ejecutivo Previsional | Forma Inicio.: Demanda | Estado Proc.: Concluido | Etapa: Terminada | Titulo Ejec.:  | Juez Asignado: GERARDO MENA EDWARDS | Tribunal: 1° Juzgado de Letras de Talagante
Raúl Horacio Troncoso Delpiano;7072258-5;AB.DTE;1° Juzgado de Letras de Talagante;RIT: P-94-2023 | Tribunal: 1° Juzgado de Letras de Talagante | Caratulado: ADM. DE FONDOS DE CESANTIA CHILE II S.A. CON FRABRICA D | Fecha Ingreso: 27/02/2023 | Estado Procesal: Concluido | RIT: P-94-2023 | Fecha Ing.: 27/02/2023 | RUC: 23- 3-0051022-1 | Est. Adm.: Sin archivar | Proc.: Ejecutivo Previsional | Forma Inicio.: Demanda | Estado Proc.: Concluido | Etapa: Terminada | Titulo Ejec.:  | Juez Asignado: GERARDO MENA EDWARDS | Tribunal: 1° Juzgado de Letras de Talagante
Administradora de Fondos de Pensiones Capital;98000000-1;DTE.;1° Juzgado de Letras de Talagante;RIT: P-93-2023 | Tribunal: 1° Juzgado de Letras de Talagante | Caratulado: A.F.P. CAPITAL S.A. CON BOTILLERIA DON BRUNO SPA | Fecha Ingreso: 27/02/2023 | Estado Procesal: Concluido | RIT: P-93-2023 | Fecha Ing.: 27/02/2023 | RUC: 23- 3-0050218-0 | Est. Adm.: Sin archivar | Proc.: Ejecutivo Previsional | Forma Inicio.: Demanda | Estado Proc.: Concluido | Etapa: Terminada | Titulo Ejec.:  | Juez Asignado: GERARDO MENA EDWARDS | Tribunal: 1° Juzgado de Letras de Talagante
BOTILLERIA DON BRUNO SPA;77091667-4;DDO.;1° Juzgado de Letras de Talagante;RIT: P-93-2023 | Tribunal: 1° Juzgado de Letras de Talagante | Caratulado: A.F.P. CAPITAL S.A. CON BOTILLERIA DON BRUNO SPA | Fecha Ingreso: 27/02/2023 | Estado Procesal: Concluido | RIT: P-93-2023 | Fecha Ing.: 27/02/2023 | RUC: 23- 3-0050218-0 | Est. Adm.: Sin archivar | Proc.: Ejecutivo Previsional | Forma Inicio.: Demanda | Estado Proc.: Concluido | Etapa: Terminada | Titulo Ejec.:  | Juez Asignado: GERARDO MENA EDWARDS | Tribunal: 1° Juzgado de Letras de Talagante
Antonio Ricardo Alamos Avendaño;8270154-0;AB.DTE;1° Juzgado de Letras de Talagante;RIT: P-93-2023 | Tribunal: 1° Juzgado de Letras de Talagante | Caratulado: A.F.P. CAPITAL S.A. CON BOTILLERIA DON BRUNO SPA | Fecha Ingreso: 27/02/2023 | Estado Procesal: Concluido | RIT: P-93-2023 | Fecha Ing.: 27/02/2023 | RUC: 23- 3-0050218-0 | Est. Adm.: Sin archivar | Proc.: Ejecutivo Previsional | Forma Inicio.: Demanda | Estado Proc.: Concluido | Etapa: Terminada | Titulo Ejec.:  | Juez Asignado: GERARDO MENA EDWARDS | Tribunal: 1° Juzgado de Letras de Talagante
Manuel Jesús Figueroa Saavedra;2415267-7;AB.DTE;1° Juzgado de Letras de Talagante;RIT: P-93-2023 | Tribunal: 1° Juzgado de Letras de Talagante | Caratulado: A.F.P. CAPITAL S.A. CON BOTILLERIA DON BRUNO SPA | Fecha Ingreso: 27/02/2023 | Estado Procesal: Concluido | RIT: P-93-2023 | Fecha Ing.: 27/02/2023 | RUC: 23- 3-0050218-0 | Est. Adm.: Sin archivar | Proc.: Ejecutivo Previsional | Forma Inicio.: Demanda | Estado Proc.: Concluido | Etapa: Terminada | Titulo Ejec.:  | Juez Asignado: GERARDO MENA EDWARDS | Tribunal: 1° Juzgado de Letras de Talagante
