NOMBRE;DOCUMENTO;CARGO;INSTITUCION;OBSERVACIONES
SOCIEDAD ADMINISTRADORA DE FONDOS DE CESANTIA DE CHILE II S.A.;76237243-6;DTE.;Juzgado de Letras y Garantía de Paillaco;RIT: P-60-2023 | Tribunal: Juzgado de Letras y Garantía de Paillaco | Caratulado: ADM. DE FONDOS DE CESANTIA CHILE II S.A. CON COMERCIAL | Fecha Ingreso: 16/06/2023 | Estado Procesal: Tramitación | RIT: P-60-2023 | Fecha Ing.: 16/06/2023 | RUC: 23- 3-0156891-6 | Est. Adm.: Archivada | Proc.: Ejecutivo Previsional | Forma Inicio.: Demanda | Estado Proc.: Tramitación | Etapa: Ingreso | Titulo Ejec.:  | Juez Asignado: MARCELO ALFONSO SEGURA ESPERGUEL | Tribunal: Juzgado de Letras y Garantía de Paillaco
COMERCIAL MABELEN LIMITADA;77573919-3;DDO.;Juzgado de Letras y Garantía de Paillaco;RIT: P-60-2023 | Tribunal: Juzgado de Letras y Garantía de Paillaco | Caratulado: ADM. DE FONDOS DE CESANTIA CHILE II S.A. CON COMERCIAL | Fecha Ingreso: 16/06/2023 | Estado Procesal: Tramitación | RIT: P-60-2023 | Fecha Ing.: 16/06/2023 | RUC: 23- 3-0156891-6 | Est. Adm.: Archivada | Proc.: Ejecutivo Previsional | Forma Inicio.: Demanda | Estado Proc.: Tramitación | Etapa: Ingreso | Titulo Ejec.:  | Juez Asignado: MARCELO ALFONSO SEGURA ESPERGUEL | Tribunal: Juzgado de Letras y Garantía de Paillaco
Raúl Horacio Troncoso Delpiano;7072258-5;AB.DTE;Juzgado de Letras y Garantía de Paillaco;RIT: P-60-2023 | Tribunal: Juzgado de Letras y Garantía de Paillaco | Caratulado: ADM. DE FONDOS DE CESANTIA CHILE II S.A. CON COMERCIAL | Fecha Ingreso: 16/06/2023 | Estado Procesal: Tramitación | RIT: P-60-2023 | Fecha Ing.: 16/06/2023 | RUC: 23- 3-0156891-6 | Est. Adm.: Archivada | Proc.: Ejecutivo Previsional | Forma Inicio.: Demanda | Estado Proc.: Tramitación | Etapa: Ingreso | Titulo Ejec.:  | Juez Asignado: MARCELO ALFONSO SEGURA ESPERGUEL | Tribunal: Juzgado de Letras y Garantía de Paillaco
COMERCIAL RODAGRO LIMITADA;77717800-8;DDO.;Juzgado de Letras y Garantía de Paillaco;RIT: E-5-2023 | Tribunal: Juzgado de Letras y Garantía de Paillaco | Caratulado: COLMENA GOLDEN CROSS S.A./COMERCIAL RODAGRO LIMITADA | Fecha Ingreso: 16/06/2023 | Estado Procesal: Concluido | RIT: E-5-2023 | Fecha Ing.: 16/06/2023 | RUC: 18- 3-0353953-7 | Est. Adm.: Archivada | Proc.: Exhorto | Forma Inicio.: Exhorto | Estado Proc.: Concluido | Etapa: Terminada | Titulo Ejec.:  | Juez Asignado: LUCIA ALEJANDRA MASSRI ERGAS | Tribunal: Juzgado de Letras y Garantía de Paillaco
COLMENA GOLDEN CROSS S.A.;76296619-0;DTE.;Juzgado de Letras y Garantía de Paillaco;RIT: E-5-2023 | Tribunal: Juzgado de Letras y Garantía de Paillaco | Caratulado: COLMENA GOLDEN CROSS S.A./COMERCIAL RODAGRO LIMITADA | Fecha Ingreso: 16/06/2023 | Estado Procesal: Concluido | RIT: E-5-2023 | Fecha Ing.: 16/06/2023 | RUC: 18- 3-0353953-7 | Est. Adm.: Archivada | Proc.: Exhorto | Forma Inicio.: Exhorto | Estado Proc.: Concluido | Etapa: Terminada | Titulo Ejec.:  | Juez Asignado: LUCIA ALEJANDRA MASSRI ERGAS | Tribunal: Juzgado de Letras y Garantía de Paillaco
ÁLVARO ANDRÉS MOLINA LEIVA;13671419-8;AB.DTE;Juzgado de Letras y Garantía de Paillaco;RIT: E-5-2023 | Tribunal: Juzgado de Letras y Garantía de Paillaco | Caratulado: COLMENA GOLDEN CROSS S.A./COMERCIAL RODAGRO LIMITADA | Fecha Ingreso: 16/06/2023 | Estado Procesal: Concluido | RIT: E-5-2023 | Fecha Ing.: 16/06/2023 | RUC: 18- 3-0353953-7 | Est. Adm.: Archivada | Proc.: Exhorto | Forma Inicio.: Exhorto | Estado Proc.: Concluido | Etapa: Terminada | Titulo Ejec.:  | Juez Asignado: LUCIA ALEJANDRA MASSRI ERGAS | Tribunal: Juzgado de Letras y Garantía de Paillaco
