NOMBRE;DOCUMENTO;CARGO;INSTITUCION;OBSERVACIONES
Administradora de Fondos de Pensiones Provida;76265736-8;DTE.;2°Jdo. de Letras de San Fernando;RIT: P-115-2024 | Tribunal: 2°Jdo. de Letras de San Fernando | Caratulado: A.F.P. PROVIDA S.A. CON TRANSPORTES CACERES QUINTANILLA | Fecha Ingreso: 28/02/2024 | Estado Procesal: Tramitación | RIT: P-115-2024 | Fecha Ing.: 28/02/2024 | RUC: 24- 3-0059640-8 | Est. Adm.: Sin archivar | Proc.: Ejecutivo Previsional | Forma Inicio.: Demanda | Estado Proc.: Tramitación | Etapa: Ingreso | Titulo Ejec.:  | Juez Asignado: JOSE MIGUEL VALENZUELA MORALES | Tribunal: 2°Jdo. de Letras de San Fernando
TRANSPORTES CACERES QUINTANILLA LTDA;76148756-6;DDO.;2°Jdo. de Letras de San Fernando;RIT: P-115-2024 | Tribunal: 2°Jdo. de Letras de San Fernando | Caratulado: A.F.P. PROVIDA S.A. CON TRANSPORTES CACERES QUINTANILLA | Fecha Ingreso: 28/02/2024 | Estado Procesal: Tramitación | RIT: P-115-2024 | Fecha Ing.: 28/02/2024 | RUC: 24- 3-0059640-8 | Est. Adm.: Sin archivar | Proc.: Ejecutivo Previsional | Forma Inicio.: Demanda | Estado Proc.: Tramitación | Etapa: Ingreso | Titulo Ejec.:  | Juez Asignado: JOSE MIGUEL VALENZUELA MORALES | Tribunal: 2°Jdo. de Letras de San Fernando
Raúl Horacio Troncoso Delpiano;7072258-5;AB.DTE;2°Jdo. de Letras de San Fernando;RIT: P-115-2024 | Tribunal: 2°Jdo. de Letras de San Fernando | Caratulado: A.F.P. PROVIDA S.A. CON TRANSPORTES CACERES QUINTANILLA | Fecha Ingreso: 28/02/2024 | Estado Procesal: Tramitación | RIT: P-115-2024 | Fecha Ing.: 28/02/2024 | RUC: 24- 3-0059640-8 | Est. Adm.: Sin archivar | Proc.: Ejecutivo Previsional | Forma Inicio.: Demanda | Estado Proc.: Tramitación | Etapa: Ingreso | Titulo Ejec.:  | Juez Asignado: JOSE MIGUEL VALENZUELA MORALES | Tribunal: 2°Jdo. de Letras de San Fernando
Administradora de Fondos de Pensiones Capital;98000000-1;DTE.;2°Jdo. de Letras de San Fernando;RIT: P-108-2024 | Tribunal: 2°Jdo. de Letras de San Fernando | Caratulado: A.F.P. CAPITAL S.A. CON COMERCIAL ERWIN MAURICIO BRAVO | Fecha Ingreso: 23/02/2024 | Estado Procesal: Tramitación | RIT: P-108-2024 | Fecha Ing.: 23/02/2024 | RUC: 24- 3-0054991-4 | Est. Adm.: Sin archivar | Proc.: Ejecutivo Previsional | Forma Inicio.: Demanda | Estado Proc.: Tramitación | Etapa: Ingreso | Titulo Ejec.:  | Juez Asignado: GUILLERMO ENRIQUE RODRIGUEZ ORDENES | Tribunal: 2°Jdo. de Letras de San Fernando
COMERCIAL ERWIN MAURICIO BRAVO PAVEZ EIRL;76817346-K;DDO.;2°Jdo. de Letras de San Fernando;RIT: P-108-2024 | Tribunal: 2°Jdo. de Letras de San Fernando | Caratulado: A.F.P. CAPITAL S.A. CON COMERCIAL ERWIN MAURICIO BRAVO | Fecha Ingreso: 23/02/2024 | Estado Procesal: Tramitación | RIT: P-108-2024 | Fecha Ing.: 23/02/2024 | RUC: 24- 3-0054991-4 | Est. Adm.: Sin archivar | Proc.: Ejecutivo Previsional | Forma Inicio.: Demanda | Estado Proc.: Tramitación | Etapa: Ingreso | Titulo Ejec.:  | Juez Asignado: GUILLERMO ENRIQUE RODRIGUEZ ORDENES | Tribunal: 2°Jdo. de Letras de San Fernando
Antonio Ricardo Alamos Avendaño;8270154-0;AB.DTE;2°Jdo. de Letras de San Fernando;RIT: P-108-2024 | Tribunal: 2°Jdo. de Letras de San Fernando | Caratulado: A.F.P. CAPITAL S.A. CON COMERCIAL ERWIN MAURICIO BRAVO | Fecha Ingreso: 23/02/2024 | Estado Procesal: Tramitación | RIT: P-108-2024 | Fecha Ing.: 23/02/2024 | RUC: 24- 3-0054991-4 | Est. Adm.: Sin archivar | Proc.: Ejecutivo Previsional | Forma Inicio.: Demanda | Estado Proc.: Tramitación | Etapa: Ingreso | Titulo Ejec.:  | Juez Asignado: GUILLERMO ENRIQUE RODRIGUEZ ORDENES | Tribunal: 2°Jdo. de Letras de San Fernando
Manuel Jesús Figueroa Saavedra;2415267-7;AB.DTE;2°Jdo. de Letras de San Fernando;RIT: P-108-2024 | Tribunal: 2°Jdo. de Letras de San Fernando | Caratulado: A.F.P. CAPITAL S.A. CON COMERCIAL ERWIN MAURICIO BRAVO | Fecha Ingreso: 23/02/2024 | Estado Procesal: Tramitación | RIT: P-108-2024 | Fecha Ing.: 23/02/2024 | RUC: 24- 3-0054991-4 | Est. Adm.: Sin archivar | Proc.: Ejecutivo Previsional | Forma Inicio.: Demanda | Estado Proc.: Tramitación | Etapa: Ingreso | Titulo Ejec.:  | Juez Asignado: GUILLERMO ENRIQUE RODRIGUEZ ORDENES | Tribunal: 2°Jdo. de Letras de San Fernando
