NOMBRE;DOCUMENTO;CARGO;INSTITUCION;OBSERVACIONES
SOCIEDAD ADMINISTRADORA DE FONDOS DE CESANTIA DE CHILE III S.A.;77601648-9;DTE.;Juzgado de Letras de Nueva Imperial;RIT: P-175-2023 | Tribunal: Juzgado de Letras de Nueva Imperial | Caratulado: ADM. DE FONDOS DE CESANTIA CHILE III S.A. CON SOCIEDAD | Fecha Ingreso: 30/11/2023 | Estado Procesal: Tramitación | RIT: P-175-2023 | Fecha Ing.: 30/11/2023 | RUC: 23- 3-0322023-2 | Est. Adm.: Archivada | Proc.: Ejecutivo Previsional | Forma Inicio.: Demanda | Estado Proc.: Tramitación | Etapa: Ingreso | Titulo Ejec.:  | Juez Asignado: LUIS EMILIO SOTO MENDEZ | Tribunal: Juzgado de Letras de Nueva Imperial
SOCIEDAD COMERCIAL FERNANDEZ VINEZ LTDA;76262958-5;DDO.;Juzgado de Letras de Nueva Imperial;RIT: P-175-2023 | Tribunal: Juzgado de Letras de Nueva Imperial | Caratulado: ADM. DE FONDOS DE CESANTIA CHILE III S.A. CON SOCIEDAD | Fecha Ingreso: 30/11/2023 | Estado Procesal: Tramitación | RIT: P-175-2023 | Fecha Ing.: 30/11/2023 | RUC: 23- 3-0322023-2 | Est. Adm.: Archivada | Proc.: Ejecutivo Previsional | Forma Inicio.: Demanda | Estado Proc.: Tramitación | Etapa: Ingreso | Titulo Ejec.:  | Juez Asignado: LUIS EMILIO SOTO MENDEZ | Tribunal: Juzgado de Letras de Nueva Imperial
Manuel Jesús Figueroa Saavedra;2415267-7;AB.DTE;Juzgado de Letras de Nueva Imperial;RIT: P-175-2023 | Tribunal: Juzgado de Letras de Nueva Imperial | Caratulado: ADM. DE FONDOS DE CESANTIA CHILE III S.A. CON SOCIEDAD | Fecha Ingreso: 30/11/2023 | Estado Procesal: Tramitación | RIT: P-175-2023 | Fecha Ing.: 30/11/2023 | RUC: 23- 3-0322023-2 | Est. Adm.: Archivada | Proc.: Ejecutivo Previsional | Forma Inicio.: Demanda | Estado Proc.: Tramitación | Etapa: Ingreso | Titulo Ejec.:  | Juez Asignado: LUIS EMILIO SOTO MENDEZ | Tribunal: Juzgado de Letras de Nueva Imperial
Antonio Ricardo Alamos Avendaño;8270154-0;AB.DTE;Juzgado de Letras de Nueva Imperial;RIT: P-175-2023 | Tribunal: Juzgado de Letras de Nueva Imperial | Caratulado: ADM. DE FONDOS DE CESANTIA CHILE III S.A. CON SOCIEDAD | Fecha Ingreso: 30/11/2023 | Estado Procesal: Tramitación | RIT: P-175-2023 | Fecha Ing.: 30/11/2023 | RUC: 23- 3-0322023-2 | Est. Adm.: Archivada | Proc.: Ejecutivo Previsional | Forma Inicio.: Demanda | Estado Proc.: Tramitación | Etapa: Ingreso | Titulo Ejec.:  | Juez Asignado: LUIS EMILIO SOTO MENDEZ | Tribunal: Juzgado de Letras de Nueva Imperial
Administradora de Fondos de Pensiones Habitat;98000100-8;DTE.;Juzgado de Letras de Nueva Imperial;RIT: P-171-2023 | Tribunal: Juzgado de Letras de Nueva Imperial | Caratulado: A.F.P. HABITAT S.A. CON SOCEIDAD COMERCIAL FERNANDEZ VI | Fecha Ingreso: 28/11/2023 | Estado Procesal: Concluido | RIT: P-171-2023 | Fecha Ing.: 28/11/2023 | RUC: 23- 3-0318344-2 | Est. Adm.: Sin archivar | Proc.: Ejecutivo Previsional | Forma Inicio.: Demanda | Estado Proc.: Concluido | Etapa: Terminada | Titulo Ejec.:  | Juez Asignado: LUIS EMILIO SOTO MENDEZ | Tribunal: Juzgado de Letras de Nueva Imperial
SOCEIDAD COMERCIAL FERNANDEZ VINEZ LIMITADA;76262958-5;DDO.;Juzgado de Letras de Nueva Imperial;RIT: P-171-2023 | Tribunal: Juzgado de Letras de Nueva Imperial | Caratulado: A.F.P. HABITAT S.A. CON SOCEIDAD COMERCIAL FERNANDEZ VI | Fecha Ingreso: 28/11/2023 | Estado Procesal: Concluido | RIT: P-171-2023 | Fecha Ing.: 28/11/2023 | RUC: 23- 3-0318344-2 | Est. Adm.: Sin archivar | Proc.: Ejecutivo Previsional | Forma Inicio.: Demanda | Estado Proc.: Concluido | Etapa: Terminada | Titulo Ejec.:  | Juez Asignado: LUIS EMILIO SOTO MENDEZ | Tribunal: Juzgado de Letras de Nueva Imperial
Francisco Tocornal Fuenzalida;8352676-9;AB.DTE;Juzgado de Letras de Nueva Imperial;RIT: P-171-2023 | Tribunal: Juzgado de Letras de Nueva Imperial | Caratulado: A.F.P. HABITAT S.A. CON SOCEIDAD COMERCIAL FERNANDEZ VI | Fecha Ingreso: 28/11/2023 | Estado Procesal: Concluido | RIT: P-171-2023 | Fecha Ing.: 28/11/2023 | RUC: 23- 3-0318344-2 | Est. Adm.: Sin archivar | Proc.: Ejecutivo Previsional | Forma Inicio.: Demanda | Estado Proc.: Concluido | Etapa: Terminada | Titulo Ejec.:  | Juez Asignado: LUIS EMILIO SOTO MENDEZ | Tribunal: Juzgado de Letras de Nueva Imperial
