NOMBRE;DOCUMENTO;CARGO;INSTITUCION;OBSERVACIONES
ISAPRE CONSALUD S.A.;96856780-2;DTE.;1°Jdo. de Letras de Angol;RIT: P-50-2024 | Tribunal: 1°Jdo. de Letras de Angol | Caratulado: ISAPRE CONSALUD S.A./FUNDACION EDUCACIONAL NUESTRA SEÑO | Fecha Ingreso: 05/02/2024 | Estado Procesal: Tramitación | RIT: P-50-2024 | Fecha Ing.: 05/02/2024 | RUC: 24- 3-0037042-6 | Est. Adm.: Sin archivar | Proc.: Ejecutivo Previsional | Forma Inicio.: Demanda | Estado Proc.: Tramitación | Etapa: Ingreso | Titulo Ejec.:  | Juez Asignado: CESAR ANDRES JARAMILLO GARRIDO | Tribunal: 1°Jdo. de Letras de Angol
ÁLVARO ANDRÉS MOLINA LEIVA;13671419-8;AB.DTE;1°Jdo. de Letras de Angol;RIT: P-50-2024 | Tribunal: 1°Jdo. de Letras de Angol | Caratulado: ISAPRE CONSALUD S.A./FUNDACION EDUCACIONAL NUESTRA SEÑO | Fecha Ingreso: 05/02/2024 | Estado Procesal: Tramitación | RIT: P-50-2024 | Fecha Ing.: 05/02/2024 | RUC: 24- 3-0037042-6 | Est. Adm.: Sin archivar | Proc.: Ejecutivo Previsional | Forma Inicio.: Demanda | Estado Proc.: Tramitación | Etapa: Ingreso | Titulo Ejec.:  | Juez Asignado: CESAR ANDRES JARAMILLO GARRIDO | Tribunal: 1°Jdo. de Letras de Angol
FUNDACION EDUCACIONAL NUESTRA SEÑORA DEL ROSARIO;65156061-6;DDO.;1°Jdo. de Letras de Angol;RIT: P-50-2024 | Tribunal: 1°Jdo. de Letras de Angol | Caratulado: ISAPRE CONSALUD S.A./FUNDACION EDUCACIONAL NUESTRA SEÑO | Fecha Ingreso: 05/02/2024 | Estado Procesal: Tramitación | RIT: P-50-2024 | Fecha Ing.: 05/02/2024 | RUC: 24- 3-0037042-6 | Est. Adm.: Sin archivar | Proc.: Ejecutivo Previsional | Forma Inicio.: Demanda | Estado Proc.: Tramitación | Etapa: Ingreso | Titulo Ejec.:  | Juez Asignado: CESAR ANDRES JARAMILLO GARRIDO | Tribunal: 1°Jdo. de Letras de Angol
MARISOL LOBOS SILVA;8585894-7;DTE.;1°Jdo. de Letras de Angol;RIT: J-1-2024 | Tribunal: 1°Jdo. de Letras de Angol | Caratulado: LOBOS/ESCORPION SEGURIDAD PRIVADA SPA | Fecha Ingreso: 02/02/2024 | Estado Procesal: Tramitación | RIT: J-1-2024 | Fecha Ing.: 02/02/2024 | RUC: 24- 3-0035707-1 | Est. Adm.: Sin archivar | Proc.: Otros Títulos Ejecutivos | Forma Inicio.: Demanda | Estado Proc.: Tramitación | Etapa: Sentencia | Titulo Ejec.:  | Juez Asignado: IVAN SANTANDER VALENZUELA | Tribunal: 1°Jdo. de Letras de Angol
ESCORPION SEGURIDAD PRIVADA SPA;77454835-1;DDO.;1°Jdo. de Letras de Angol;RIT: J-1-2024 | Tribunal: 1°Jdo. de Letras de Angol | Caratulado: LOBOS/ESCORPION SEGURIDAD PRIVADA SPA | Fecha Ingreso: 02/02/2024 | Estado Procesal: Tramitación | RIT: J-1-2024 | Fecha Ing.: 02/02/2024 | RUC: 24- 3-0035707-1 | Est. Adm.: Sin archivar | Proc.: Otros Títulos Ejecutivos | Forma Inicio.: Demanda | Estado Proc.: Tramitación | Etapa: Sentencia | Titulo Ejec.:  | Juez Asignado: IVAN SANTANDER VALENZUELA | Tribunal: 1°Jdo. de Letras de Angol
RAÚL ENRIQUE CANDIA PÉREZ;14294470-7;AB.DTE;1°Jdo. de Letras de Angol;RIT: J-1-2024 | Tribunal: 1°Jdo. de Letras de Angol | Caratulado: LOBOS/ESCORPION SEGURIDAD PRIVADA SPA | Fecha Ingreso: 02/02/2024 | Estado Procesal: Tramitación | RIT: J-1-2024 | Fecha Ing.: 02/02/2024 | RUC: 24- 3-0035707-1 | Est. Adm.: Sin archivar | Proc.: Otros Títulos Ejecutivos | Forma Inicio.: Demanda | Estado Proc.: Tramitación | Etapa: Sentencia | Titulo Ejec.:  | Juez Asignado: IVAN SANTANDER VALENZUELA | Tribunal: 1°Jdo. de Letras de Angol
CAROLA ANDREA LOPEZ RIQUELME;16111686-6;AB.DDO;1°Jdo. de Letras de Angol;RIT: J-1-2024 | Tribunal: 1°Jdo. de Letras de Angol | Caratulado: LOBOS/ESCORPION SEGURIDAD PRIVADA SPA | Fecha Ingreso: 02/02/2024 | Estado Procesal: Tramitación | RIT: J-1-2024 | Fecha Ing.: 02/02/2024 | RUC: 24- 3-0035707-1 | Est. Adm.: Sin archivar | Proc.: Otros Títulos Ejecutivos | Forma Inicio.: Demanda | Estado Proc.: Tramitación | Etapa: Sentencia | Titulo Ejec.:  | Juez Asignado: IVAN SANTANDER VALENZUELA | Tribunal: 1°Jdo. de Letras de Angol
