NOMBRE;DOCUMENTO;CARGO;INSTITUCION;OBSERVACIONES
FRANCISCO JORGE CUESTA PANTOJA;7374907-7;AB.DDO;1º Juzgado de Letras de San Antonio;RIT: C-6-2023 | Tribunal: 1º Juzgado de Letras de San Antonio | Caratulado: SAN MARTÍN/SILVA | Fecha Ingreso: 13/02/2023 | Estado Procesal: Tramitación | RIT: C-6-2023 | Fecha Ing.: 13/02/2023 | RUC: 22- 4-0428447-2 | Est. Adm.: Sin archivar | Proc.: Cumplimiento Laboral | Forma Inicio.: Sitla | Estado Proc.: Tramitación | Etapa: Excepciones / Objeta Liquidación | Titulo Ejec.:  | Juez Asignado: JOSE LUIS MAYORGA SIMPSON | Tribunal: 1º Juzgado de Letras de San Antonio
RODRIGO DANIEL BUSTAMANTE TAPIA;13471592-8;AB.DTE;1º Juzgado de Letras de San Antonio;RIT: C-6-2023 | Tribunal: 1º Juzgado de Letras de San Antonio | Caratulado: SAN MARTÍN/SILVA | Fecha Ingreso: 13/02/2023 | Estado Procesal: Tramitación | RIT: C-6-2023 | Fecha Ing.: 13/02/2023 | RUC: 22- 4-0428447-2 | Est. Adm.: Sin archivar | Proc.: Cumplimiento Laboral | Forma Inicio.: Sitla | Estado Proc.: Tramitación | Etapa: Excepciones / Objeta Liquidación | Titulo Ejec.:  | Juez Asignado: JOSE LUIS MAYORGA SIMPSON | Tribunal: 1º Juzgado de Letras de San Antonio
MARÍA GRACIELA SAN MARTÍN NILO;13195591-K;DTE.;1º Juzgado de Letras de San Antonio;RIT: C-6-2023 | Tribunal: 1º Juzgado de Letras de San Antonio | Caratulado: SAN MARTÍN/SILVA | Fecha Ingreso: 13/02/2023 | Estado Procesal: Tramitación | RIT: C-6-2023 | Fecha Ing.: 13/02/2023 | RUC: 22- 4-0428447-2 | Est. Adm.: Sin archivar | Proc.: Cumplimiento Laboral | Forma Inicio.: Sitla | Estado Proc.: Tramitación | Etapa: Excepciones / Objeta Liquidación | Titulo Ejec.:  | Juez Asignado: JOSE LUIS MAYORGA SIMPSON | Tribunal: 1º Juzgado de Letras de San Antonio
BRUNO EDGARDO SILVA MARAMBIO;6934401-1;DDO.;1º Juzgado de Letras de San Antonio;RIT: C-6-2023 | Tribunal: 1º Juzgado de Letras de San Antonio | Caratulado: SAN MARTÍN/SILVA | Fecha Ingreso: 13/02/2023 | Estado Procesal: Tramitación | RIT: C-6-2023 | Fecha Ing.: 13/02/2023 | RUC: 22- 4-0428447-2 | Est. Adm.: Sin archivar | Proc.: Cumplimiento Laboral | Forma Inicio.: Sitla | Estado Proc.: Tramitación | Etapa: Excepciones / Objeta Liquidación | Titulo Ejec.:  | Juez Asignado: JOSE LUIS MAYORGA SIMPSON | Tribunal: 1º Juzgado de Letras de San Antonio
ADMINISTRADORA DE FONDOS DE PENSIONES MODELO;76762250-3;DTE.;1º Juzgado de Letras de San Antonio;RIT: P-83-2023 | Tribunal: 1º Juzgado de Letras de San Antonio | Caratulado: A.F.P. MODELO S.A. CON AGROCOMERCIAL SAN GABRIEL SPA | Fecha Ingreso: 10/02/2023 | Estado Procesal: Concluido | RIT: P-83-2023 | Fecha Ing.: 10/02/2023 | RUC: 23- 3-0035514-5 | Est. Adm.: Sin archivar | Proc.: Ejecutivo Previsional | Forma Inicio.: Demanda | Estado Proc.: Concluido | Etapa: Terminada | Titulo Ejec.:  | Juez Asignado: PALOMA FERNANDEZ FERNANDEZ | Tribunal: 1º Juzgado de Letras de San Antonio
AGROCOMERCIAL SAN GABRIEL SPA;77431119-K;DDO.;1º Juzgado de Letras de San Antonio;RIT: P-83-2023 | Tribunal: 1º Juzgado de Letras de San Antonio | Caratulado: A.F.P. MODELO S.A. CON AGROCOMERCIAL SAN GABRIEL SPA | Fecha Ingreso: 10/02/2023 | Estado Procesal: Concluido | RIT: P-83-2023 | Fecha Ing.: 10/02/2023 | RUC: 23- 3-0035514-5 | Est. Adm.: Sin archivar | Proc.: Ejecutivo Previsional | Forma Inicio.: Demanda | Estado Proc.: Concluido | Etapa: Terminada | Titulo Ejec.:  | Juez Asignado: PALOMA FERNANDEZ FERNANDEZ | Tribunal: 1º Juzgado de Letras de San Antonio
FRANCISCO JOSE TOCORNAL FUENZALIDA;8352676-9;AB.DTE;1º Juzgado de Letras de San Antonio;RIT: P-83-2023 | Tribunal: 1º Juzgado de Letras de San Antonio | Caratulado: A.F.P. MODELO S.A. CON AGROCOMERCIAL SAN GABRIEL SPA | Fecha Ingreso: 10/02/2023 | Estado Procesal: Concluido | RIT: P-83-2023 | Fecha Ing.: 10/02/2023 | RUC: 23- 3-0035514-5 | Est. Adm.: Sin archivar | Proc.: Ejecutivo Previsional | Forma Inicio.: Demanda | Estado Proc.: Concluido | Etapa: Terminada | Titulo Ejec.:  | Juez Asignado: PALOMA FERNANDEZ FERNANDEZ | Tribunal: 1º Juzgado de Letras de San Antonio
