NOMBRE;DOCUMENTO;CARGO;INSTITUCION;OBSERVACIONES
A.F.P. PLANVITAL S.A.;98001200-K;DTE.;Juzgado de Letras y Garantía de Traiguen;RIT: P-84-2024 | Tribunal: Juzgado de Letras y Garantía de Traiguen | Caratulado: A.F.P. PLANVITAL S.A./SOCIEDAD FORESTAL MEDINA MUNOZ SP | Fecha Ingreso: 26/09/2024 | Estado Procesal: Tramitación | RIT: P-84-2024 | Fecha Ing.: 26/09/2024 | RUC: 24- 3-0265665-3 | Est. Adm.: Sin archivar | Proc.: Ejecutivo Previsional | Forma Inicio.: Demanda | Estado Proc.: Tramitación | Etapa: Ingreso | Titulo Ejec.:  | Juez Asignado: KATERINE PAOLA LAVANDEROS CURAQUEO | Tribunal: Juzgado de Letras y Garantía de Traiguen
ANTONIO RICARDO ÁLAMOS AVENDAÑO;8270154-0;AB.DTE;Juzgado de Letras y Garantía de Traiguen;RIT: P-84-2024 | Tribunal: Juzgado de Letras y Garantía de Traiguen | Caratulado: A.F.P. PLANVITAL S.A./SOCIEDAD FORESTAL MEDINA MUNOZ SP | Fecha Ingreso: 26/09/2024 | Estado Procesal: Tramitación | RIT: P-84-2024 | Fecha Ing.: 26/09/2024 | RUC: 24- 3-0265665-3 | Est. Adm.: Sin archivar | Proc.: Ejecutivo Previsional | Forma Inicio.: Demanda | Estado Proc.: Tramitación | Etapa: Ingreso | Titulo Ejec.:  | Juez Asignado: KATERINE PAOLA LAVANDEROS CURAQUEO | Tribunal: Juzgado de Letras y Garantía de Traiguen
SOCIEDAD FORESTAL MEDINA MUNOZ SPA;77780506-1;DDO.;Juzgado de Letras y Garantía de Traiguen;RIT: P-84-2024 | Tribunal: Juzgado de Letras y Garantía de Traiguen | Caratulado: A.F.P. PLANVITAL S.A./SOCIEDAD FORESTAL MEDINA MUNOZ SP | Fecha Ingreso: 26/09/2024 | Estado Procesal: Tramitación | RIT: P-84-2024 | Fecha Ing.: 26/09/2024 | RUC: 24- 3-0265665-3 | Est. Adm.: Sin archivar | Proc.: Ejecutivo Previsional | Forma Inicio.: Demanda | Estado Proc.: Tramitación | Etapa: Ingreso | Titulo Ejec.:  | Juez Asignado: KATERINE PAOLA LAVANDEROS CURAQUEO | Tribunal: Juzgado de Letras y Garantía de Traiguen
AC SECURITY LIMITADA;76071685-5;DDO.;Juzgado de Letras y Garantía de Traiguen;RIT: C-3-2024 | Tribunal: Juzgado de Letras y Garantía de Traiguen | Caratulado: ROJAS/AC SECURITY LIMITADA | Fecha Ingreso: 24/09/2024 | Estado Procesal: Tramitación | RIT: C-3-2024 | Fecha Ing.: 24/09/2024 | RUC: 23- 4-0523977-9 | Est. Adm.: Sin archivar | Proc.: Cumplimiento Laboral | Forma Inicio.: Sitla | Estado Proc.: Tramitación | Etapa: Excepciones / Objeta Liquidación | Titulo Ejec.:  | Juez Asignado: JAIME MANRIQUEZ OYANADER | Tribunal: Juzgado de Letras y Garantía de Traiguen
CATHERINE SOLANGE ROJAS SILVA;17709937-6;DTE.;Juzgado de Letras y Garantía de Traiguen;RIT: C-3-2024 | Tribunal: Juzgado de Letras y Garantía de Traiguen | Caratulado: ROJAS/AC SECURITY LIMITADA | Fecha Ingreso: 24/09/2024 | Estado Procesal: Tramitación | RIT: C-3-2024 | Fecha Ing.: 24/09/2024 | RUC: 23- 4-0523977-9 | Est. Adm.: Sin archivar | Proc.: Cumplimiento Laboral | Forma Inicio.: Sitla | Estado Proc.: Tramitación | Etapa: Excepciones / Objeta Liquidación | Titulo Ejec.:  | Juez Asignado: JAIME MANRIQUEZ OYANADER | Tribunal: Juzgado de Letras y Garantía de Traiguen
RAÚL ENRIQUE CANDIA PÉREZ;14294470-7;AB.DTE;Juzgado de Letras y Garantía de Traiguen;RIT: C-3-2024 | Tribunal: Juzgado de Letras y Garantía de Traiguen | Caratulado: ROJAS/AC SECURITY LIMITADA | Fecha Ingreso: 24/09/2024 | Estado Procesal: Tramitación | RIT: C-3-2024 | Fecha Ing.: 24/09/2024 | RUC: 23- 4-0523977-9 | Est. Adm.: Sin archivar | Proc.: Cumplimiento Laboral | Forma Inicio.: Sitla | Estado Proc.: Tramitación | Etapa: Excepciones / Objeta Liquidación | Titulo Ejec.:  | Juez Asignado: JAIME MANRIQUEZ OYANADER | Tribunal: Juzgado de Letras y Garantía de Traiguen
CAROLINA ANDREA LOURDES BARCENAS MONARCHK;13741560-7;AB.DDO;Juzgado de Letras y Garantía de Traiguen;RIT: C-3-2024 | Tribunal: Juzgado de Letras y Garantía de Traiguen | Caratulado: ROJAS/AC SECURITY LIMITADA | Fecha Ingreso: 24/09/2024 | Estado Procesal: Tramitación | RIT: C-3-2024 | Fecha Ing.: 24/09/2024 | RUC: 23- 4-0523977-9 | Est. Adm.: Sin archivar | Proc.: Cumplimiento Laboral | Forma Inicio.: Sitla | Estado Proc.: Tramitación | Etapa: Excepciones / Objeta Liquidación | Titulo Ejec.:  | Juez Asignado: JAIME MANRIQUEZ OYANADER | Tribunal: Juzgado de Letras y Garantía de Traiguen
