NOMBRE;DOCUMENTO;CARGO;INSTITUCION;OBSERVACIONES
MANUEL JESÚS FIGUEROA SAAVEDRA;2415267-7;AB.DTE;1° Juzgado de Letras de Talagante;RIT: P-149-2023 | Tribunal: 1° Juzgado de Letras de Talagante | Caratulado: AFP UNO S.A/SANTO CARDUMEN GASTRONOMIA SP | Fecha Ingreso: 12/04/2023 | Estado Procesal: Tramitación | RIT: P-149-2023 | Fecha Ing.: 12/04/2023 | RUC: 23- 3-0086014-1 | Est. Adm.: Sin archivar | Proc.: Ejecutivo Previsional | Forma Inicio.: Demanda | Estado Proc.: Tramitación | Etapa: Ingreso | Titulo Ejec.:  | Juez Asignado: GERARDO MENA EDWARDS | Tribunal: 1° Juzgado de Letras de Talagante
ANTONIO RICARDO ÁLAMOS AVENDAÑO;8270154-0;AB.DTE;1° Juzgado de Letras de Talagante;RIT: P-149-2023 | Tribunal: 1° Juzgado de Letras de Talagante | Caratulado: AFP UNO S.A/SANTO CARDUMEN GASTRONOMIA SP | Fecha Ingreso: 12/04/2023 | Estado Procesal: Tramitación | RIT: P-149-2023 | Fecha Ing.: 12/04/2023 | RUC: 23- 3-0086014-1 | Est. Adm.: Sin archivar | Proc.: Ejecutivo Previsional | Forma Inicio.: Demanda | Estado Proc.: Tramitación | Etapa: Ingreso | Titulo Ejec.:  | Juez Asignado: GERARDO MENA EDWARDS | Tribunal: 1° Juzgado de Letras de Talagante
SANTO CARDUMEN GASTRONOMIA SP;77502666-9;DDO.;1° Juzgado de Letras de Talagante;RIT: P-149-2023 | Tribunal: 1° Juzgado de Letras de Talagante | Caratulado: AFP UNO S.A/SANTO CARDUMEN GASTRONOMIA SP | Fecha Ingreso: 12/04/2023 | Estado Procesal: Tramitación | RIT: P-149-2023 | Fecha Ing.: 12/04/2023 | RUC: 23- 3-0086014-1 | Est. Adm.: Sin archivar | Proc.: Ejecutivo Previsional | Forma Inicio.: Demanda | Estado Proc.: Tramitación | Etapa: Ingreso | Titulo Ejec.:  | Juez Asignado: GERARDO MENA EDWARDS | Tribunal: 1° Juzgado de Letras de Talagante
AFP UNO S.A;76960424-3;DTE.;1° Juzgado de Letras de Talagante;RIT: P-149-2023 | Tribunal: 1° Juzgado de Letras de Talagante | Caratulado: AFP UNO S.A/SANTO CARDUMEN GASTRONOMIA SP | Fecha Ingreso: 12/04/2023 | Estado Procesal: Tramitación | RIT: P-149-2023 | Fecha Ing.: 12/04/2023 | RUC: 23- 3-0086014-1 | Est. Adm.: Sin archivar | Proc.: Ejecutivo Previsional | Forma Inicio.: Demanda | Estado Proc.: Tramitación | Etapa: Ingreso | Titulo Ejec.:  | Juez Asignado: GERARDO MENA EDWARDS | Tribunal: 1° Juzgado de Letras de Talagante
Administradora de Fondos de Pensiones Planvital;98001200-K;DTE.;1° Juzgado de Letras de Talagante;RIT: E-8-2023 | Tribunal: 1° Juzgado de Letras de Talagante | Caratulado: A.F.P. PLANVITAL S.A. CON LUCIA CEA SANTIBANEZ | Fecha Ingreso: 11/04/2023 | Estado Procesal: Concluido | RIT: E-8-2023 | Fecha Ing.: 11/04/2023 | RUC: 19- 3-0088598-8 | Est. Adm.: Sin archivar | Proc.: Exhorto | Forma Inicio.: Exhorto | Estado Proc.: Concluido | Etapa: Terminada | Titulo Ejec.:  | Juez Asignado: GERARDO MENA EDWARDS | Tribunal: 1° Juzgado de Letras de Talagante
LUCIA CEA SANTIBANEZ;9145532-3;DDO.;1° Juzgado de Letras de Talagante;RIT: E-8-2023 | Tribunal: 1° Juzgado de Letras de Talagante | Caratulado: A.F.P. PLANVITAL S.A. CON LUCIA CEA SANTIBANEZ | Fecha Ingreso: 11/04/2023 | Estado Procesal: Concluido | RIT: E-8-2023 | Fecha Ing.: 11/04/2023 | RUC: 19- 3-0088598-8 | Est. Adm.: Sin archivar | Proc.: Exhorto | Forma Inicio.: Exhorto | Estado Proc.: Concluido | Etapa: Terminada | Titulo Ejec.:  | Juez Asignado: GERARDO MENA EDWARDS | Tribunal: 1° Juzgado de Letras de Talagante
Manuel Figueroa Saavedra;2415267-7;AB.DTE;1° Juzgado de Letras de Talagante;RIT: E-8-2023 | Tribunal: 1° Juzgado de Letras de Talagante | Caratulado: A.F.P. PLANVITAL S.A. CON LUCIA CEA SANTIBANEZ | Fecha Ingreso: 11/04/2023 | Estado Procesal: Concluido | RIT: E-8-2023 | Fecha Ing.: 11/04/2023 | RUC: 19- 3-0088598-8 | Est. Adm.: Sin archivar | Proc.: Exhorto | Forma Inicio.: Exhorto | Estado Proc.: Concluido | Etapa: Terminada | Titulo Ejec.:  | Juez Asignado: GERARDO MENA EDWARDS | Tribunal: 1° Juzgado de Letras de Talagante
Antonio Ricardo Alamos Avendano;8270154-0;AB.DTE;1° Juzgado de Letras de Talagante;RIT: E-8-2023 | Tribunal: 1° Juzgado de Letras de Talagante | Caratulado: A.F.P. PLANVITAL S.A. CON LUCIA CEA SANTIBANEZ | Fecha Ingreso: 11/04/2023 | Estado Procesal: Concluido | RIT: E-8-2023 | Fecha Ing.: 11/04/2023 | RUC: 19- 3-0088598-8 | Est. Adm.: Sin archivar | Proc.: Exhorto | Forma Inicio.: Exhorto | Estado Proc.: Concluido | Etapa: Terminada | Titulo Ejec.:  | Juez Asignado: GERARDO MENA EDWARDS | Tribunal: 1° Juzgado de Letras de Talagante
