NOMBRE;DOCUMENTO;CARGO;INSTITUCION;OBSERVACIONES
ISAPRE CONSALUD;96856780-2;DTE.;Jdo. de Letras de Colina;RIT: P-2027-2024 | Tribunal: Jdo. de Letras de Colina | Caratulado: ISAPRE CONSALUD/INDUSTRIA FRANCO CHILENA DE PLASTICOS S | Fecha Ingreso: 12/09/2024 | Estado Procesal: Concluido | RIT: P-2027-2024 | Fecha Ing.: 12/09/2024 | RUC: 24- 3-0251692-4 | Est. Adm.: Sin archivar | Proc.: Ejecutivo Previsional | Forma Inicio.: Demanda | Estado Proc.: Concluido | Etapa: Terminada | Titulo Ejec.:  | Juez Asignado: FRANCISCO ESTEBAN GUERRERO RETAMALES | Tribunal: Jdo. de Letras de Colina
INDUSTRIA FRANCO CHILENA DE PLASTICOS SA;96822950-8;DDO.;Jdo. de Letras de Colina;RIT: P-2027-2024 | Tribunal: Jdo. de Letras de Colina | Caratulado: ISAPRE CONSALUD/INDUSTRIA FRANCO CHILENA DE PLASTICOS S | Fecha Ingreso: 12/09/2024 | Estado Procesal: Concluido | RIT: P-2027-2024 | Fecha Ing.: 12/09/2024 | RUC: 24- 3-0251692-4 | Est. Adm.: Sin archivar | Proc.: Ejecutivo Previsional | Forma Inicio.: Demanda | Estado Proc.: Concluido | Etapa: Terminada | Titulo Ejec.:  | Juez Asignado: FRANCISCO ESTEBAN GUERRERO RETAMALES | Tribunal: Jdo. de Letras de Colina
PATRICIA LORETO LOURDES MATELUNA FLETCHER;11415851-8;AB.DTE;Jdo. de Letras de Colina;RIT: P-2027-2024 | Tribunal: Jdo. de Letras de Colina | Caratulado: ISAPRE CONSALUD/INDUSTRIA FRANCO CHILENA DE PLASTICOS S | Fecha Ingreso: 12/09/2024 | Estado Procesal: Concluido | RIT: P-2027-2024 | Fecha Ing.: 12/09/2024 | RUC: 24- 3-0251692-4 | Est. Adm.: Sin archivar | Proc.: Ejecutivo Previsional | Forma Inicio.: Demanda | Estado Proc.: Concluido | Etapa: Terminada | Titulo Ejec.:  | Juez Asignado: FRANCISCO ESTEBAN GUERRERO RETAMALES | Tribunal: Jdo. de Letras de Colina
Administradora de Fondos de Pensiones Provida;76265736-8;DTE.;Jdo. de Letras de Colina;RIT: P-2013-2024 | Tribunal: Jdo. de Letras de Colina | Caratulado: A.F.P. PROVIDA S.A. CON FFB INTEGRACION ELECTRICA SPA | Fecha Ingreso: 10/09/2024 | Estado Procesal: Concluido | RIT: P-2013-2024 | Fecha Ing.: 10/09/2024 | RUC: 24- 3-0248898-K | Est. Adm.: Sin archivar | Proc.: Ejecutivo Previsional | Forma Inicio.: Demanda | Estado Proc.: Concluido | Etapa: Terminada | Titulo Ejec.:  | Juez Asignado: CRISTIAN RODRIGO MARCHANT LILLO | Tribunal: Jdo. de Letras de Colina
FFB INTEGRACION ELECTRICA SPA;77736644-0;DDO.;Jdo. de Letras de Colina;RIT: P-2013-2024 | Tribunal: Jdo. de Letras de Colina | Caratulado: A.F.P. PROVIDA S.A. CON FFB INTEGRACION ELECTRICA SPA | Fecha Ingreso: 10/09/2024 | Estado Procesal: Concluido | RIT: P-2013-2024 | Fecha Ing.: 10/09/2024 | RUC: 24- 3-0248898-K | Est. Adm.: Sin archivar | Proc.: Ejecutivo Previsional | Forma Inicio.: Demanda | Estado Proc.: Concluido | Etapa: Terminada | Titulo Ejec.:  | Juez Asignado: CRISTIAN RODRIGO MARCHANT LILLO | Tribunal: Jdo. de Letras de Colina
Francisco Tocornal Fuenzalida;8352676-9;AB.DTE;Jdo. de Letras de Colina;RIT: P-2013-2024 | Tribunal: Jdo. de Letras de Colina | Caratulado: A.F.P. PROVIDA S.A. CON FFB INTEGRACION ELECTRICA SPA | Fecha Ingreso: 10/09/2024 | Estado Procesal: Concluido | RIT: P-2013-2024 | Fecha Ing.: 10/09/2024 | RUC: 24- 3-0248898-K | Est. Adm.: Sin archivar | Proc.: Ejecutivo Previsional | Forma Inicio.: Demanda | Estado Proc.: Concluido | Etapa: Terminada | Titulo Ejec.:  | Juez Asignado: CRISTIAN RODRIGO MARCHANT LILLO | Tribunal: Jdo. de Letras de Colina
