NOMBRE;DOCUMENTO;CARGO;INSTITUCION;OBSERVACIONES
Administradora de Fondos de Pensiones Habitat;98000100-8;DTE.;1° Juzgado de Letras de Melipilla;RIT: P-488-2021 | Tribunal: 1° Juzgado de Letras de Melipilla | Caratulado: A.F.P. HABITAT S.A. CON SOCIEDAD EDUCACIONAL FINLAND AC | Fecha Ingreso: 09/09/2021 | Estado Procesal: Concluido | RIT: P-488-2021 | Fecha Ing.: 09/09/2021 | RUC: 21- 3-0198675-8 | Est. Adm.: Archivada | Proc.: Ejecutivo Previsional | Forma Inicio.: Demanda | Estado Proc.: Concluido | Etapa: Terminada | Titulo Ejec.:  | Juez Asignado: CLAUDIA PAMELA SALGADO RUBILAR | Tribunal: 1° Juzgado de Letras de Melipilla
SOCIEDAD EDUCACIONAL FINLAND ACADEMY LIMITADA;77111905-0;DDO.;1° Juzgado de Letras de Melipilla;RIT: P-488-2021 | Tribunal: 1° Juzgado de Letras de Melipilla | Caratulado: A.F.P. HABITAT S.A. CON SOCIEDAD EDUCACIONAL FINLAND AC | Fecha Ingreso: 09/09/2021 | Estado Procesal: Concluido | RIT: P-488-2021 | Fecha Ing.: 09/09/2021 | RUC: 21- 3-0198675-8 | Est. Adm.: Archivada | Proc.: Ejecutivo Previsional | Forma Inicio.: Demanda | Estado Proc.: Concluido | Etapa: Terminada | Titulo Ejec.:  | Juez Asignado: CLAUDIA PAMELA SALGADO RUBILAR | Tribunal: 1° Juzgado de Letras de Melipilla
Francisco Tocornal Fuenzalida;8352676-9;AB.DTE;1° Juzgado de Letras de Melipilla;RIT: P-488-2021 | Tribunal: 1° Juzgado de Letras de Melipilla | Caratulado: A.F.P. HABITAT S.A. CON SOCIEDAD EDUCACIONAL FINLAND AC | Fecha Ingreso: 09/09/2021 | Estado Procesal: Concluido | RIT: P-488-2021 | Fecha Ing.: 09/09/2021 | RUC: 21- 3-0198675-8 | Est. Adm.: Archivada | Proc.: Ejecutivo Previsional | Forma Inicio.: Demanda | Estado Proc.: Concluido | Etapa: Terminada | Titulo Ejec.:  | Juez Asignado: CLAUDIA PAMELA SALGADO RUBILAR | Tribunal: 1° Juzgado de Letras de Melipilla
COLMENA GOLDEN CROSS S.A.;76296619-0;DTE.;1° Juzgado de Letras de Melipilla;RIT: E-143-2021 | Tribunal: 1° Juzgado de Letras de Melipilla | Caratulado: COLMENA GOLDEN CROSS S.A./DISTRIBUIDORA DISTABAC LIMITA | Fecha Ingreso: 09/09/2021 | Estado Procesal: Concluido | RIT: E-143-2021 | Fecha Ing.: 09/09/2021 | RUC: 20- 3-0295413-6 | Est. Adm.: Archivada | Proc.: Exhorto | Forma Inicio.: Exhorto | Estado Proc.: Concluido | Etapa: Terminada | Titulo Ejec.:  | Juez Asignado: CLAUDIA PAMELA SALGADO RUBILAR | Tribunal: 1° Juzgado de Letras de Melipilla
ESTEBAN JOSÉ GARCÍA NADAL;8538216-0;AB.DTE;1° Juzgado de Letras de Melipilla;RIT: E-143-2021 | Tribunal: 1° Juzgado de Letras de Melipilla | Caratulado: COLMENA GOLDEN CROSS S.A./DISTRIBUIDORA DISTABAC LIMITA | Fecha Ingreso: 09/09/2021 | Estado Procesal: Concluido | RIT: E-143-2021 | Fecha Ing.: 09/09/2021 | RUC: 20- 3-0295413-6 | Est. Adm.: Archivada | Proc.: Exhorto | Forma Inicio.: Exhorto | Estado Proc.: Concluido | Etapa: Terminada | Titulo Ejec.:  | Juez Asignado: CLAUDIA PAMELA SALGADO RUBILAR | Tribunal: 1° Juzgado de Letras de Melipilla
DISTRIBUIDORA DISTABAC LTDA;78185830-7;DDO.;1° Juzgado de Letras de Melipilla;RIT: E-143-2021 | Tribunal: 1° Juzgado de Letras de Melipilla | Caratulado: COLMENA GOLDEN CROSS S.A./DISTRIBUIDORA DISTABAC LIMITA | Fecha Ingreso: 09/09/2021 | Estado Procesal: Concluido | RIT: E-143-2021 | Fecha Ing.: 09/09/2021 | RUC: 20- 3-0295413-6 | Est. Adm.: Archivada | Proc.: Exhorto | Forma Inicio.: Exhorto | Estado Proc.: Concluido | Etapa: Terminada | Titulo Ejec.:  | Juez Asignado: CLAUDIA PAMELA SALGADO RUBILAR | Tribunal: 1° Juzgado de Letras de Melipilla
