NOMBRE;DOCUMENTO;CARGO;INSTITUCION;OBSERVACIONES
ADM. DE FONDOS DE CESANTIA CHILE II S.A.;76237243-6;DTE.;1° Juzgado de Letras de Coronel;RIT: E-14-2021 | Tribunal: 1° Juzgado de Letras de Coronel | Caratulado: ADM. DE FONDOS DE CESANTIA CHILE II S.A. CON IMPORTACIO | Fecha Ingreso: 13/04/2021 | Estado Procesal: Concluido | RIT: E-14-2021 | Fecha Ing.: 13/04/2021 | RUC: 15- 3-0041510-2 | Est. Adm.: Archivada | Proc.: Exhorto | Forma Inicio.: Exhorto | Estado Proc.: Concluido | Etapa: Terminada | Titulo Ejec.:  | Juez Asignado: FRANCIA ODETTE SANDOVAL TRONCOSO | Tribunal: 1° Juzgado de Letras de Coronel
ANTONIO RICARDO ALAMOS AVENDAÑO;8270154-0;AB.DTE;1° Juzgado de Letras de Coronel;RIT: E-14-2021 | Tribunal: 1° Juzgado de Letras de Coronel | Caratulado: ADM. DE FONDOS DE CESANTIA CHILE II S.A. CON IMPORTACIO | Fecha Ingreso: 13/04/2021 | Estado Procesal: Concluido | RIT: E-14-2021 | Fecha Ing.: 13/04/2021 | RUC: 15- 3-0041510-2 | Est. Adm.: Archivada | Proc.: Exhorto | Forma Inicio.: Exhorto | Estado Proc.: Concluido | Etapa: Terminada | Titulo Ejec.:  | Juez Asignado: FRANCIA ODETTE SANDOVAL TRONCOSO | Tribunal: 1° Juzgado de Letras de Coronel
IMPORTACIONES Y EXPORTACIONES DEMEX LTDA;77015880-K;DDO.;1° Juzgado de Letras de Coronel;RIT: E-14-2021 | Tribunal: 1° Juzgado de Letras de Coronel | Caratulado: ADM. DE FONDOS DE CESANTIA CHILE II S.A. CON IMPORTACIO | Fecha Ingreso: 13/04/2021 | Estado Procesal: Concluido | RIT: E-14-2021 | Fecha Ing.: 13/04/2021 | RUC: 15- 3-0041510-2 | Est. Adm.: Archivada | Proc.: Exhorto | Forma Inicio.: Exhorto | Estado Proc.: Concluido | Etapa: Terminada | Titulo Ejec.:  | Juez Asignado: FRANCIA ODETTE SANDOVAL TRONCOSO | Tribunal: 1° Juzgado de Letras de Coronel
MANUEL FIGUEROA SAAVEDRA;2415267-7;AB.DTE;1° Juzgado de Letras de Coronel;RIT: E-14-2021 | Tribunal: 1° Juzgado de Letras de Coronel | Caratulado: ADM. DE FONDOS DE CESANTIA CHILE II S.A. CON IMPORTACIO | Fecha Ingreso: 13/04/2021 | Estado Procesal: Concluido | RIT: E-14-2021 | Fecha Ing.: 13/04/2021 | RUC: 15- 3-0041510-2 | Est. Adm.: Archivada | Proc.: Exhorto | Forma Inicio.: Exhorto | Estado Proc.: Concluido | Etapa: Terminada | Titulo Ejec.:  | Juez Asignado: FRANCIA ODETTE SANDOVAL TRONCOSO | Tribunal: 1° Juzgado de Letras de Coronel
A.F.P UNO S.A;76960424-3;DTE.;1° Juzgado de Letras de Coronel;RIT: E-15-2021 | Tribunal: 1° Juzgado de Letras de Coronel | Caratulado: A.F.P UNO S.A/SERVIWOOD SPA | Fecha Ingreso: 13/04/2021 | Estado Procesal: Concluido | RIT: E-15-2021 | Fecha Ing.: 13/04/2021 | RUC: 20- 3-0225526-2 | Est. Adm.: Sin archivar | Proc.: Exhorto | Forma Inicio.: Exhorto | Estado Proc.: Concluido | Etapa: Terminada | Titulo Ejec.:  | Juez Asignado: EVA IVONNE SALGADO DIAZ | Tribunal: 1° Juzgado de Letras de Coronel
HEDY JACQUELINE MATTHEI FORNET;7989112-6;AB.DTE;1° Juzgado de Letras de Coronel;RIT: E-15-2021 | Tribunal: 1° Juzgado de Letras de Coronel | Caratulado: A.F.P UNO S.A/SERVIWOOD SPA | Fecha Ingreso: 13/04/2021 | Estado Procesal: Concluido | RIT: E-15-2021 | Fecha Ing.: 13/04/2021 | RUC: 20- 3-0225526-2 | Est. Adm.: Sin archivar | Proc.: Exhorto | Forma Inicio.: Exhorto | Estado Proc.: Concluido | Etapa: Terminada | Titulo Ejec.:  | Juez Asignado: EVA IVONNE SALGADO DIAZ | Tribunal: 1° Juzgado de Letras de Coronel
SERVIWOOD SPA;76849491-6;DDO.;1° Juzgado de Letras de Coronel;RIT: E-15-2021 | Tribunal: 1° Juzgado de Letras de Coronel | Caratulado: A.F.P UNO S.A/SERVIWOOD SPA | Fecha Ingreso: 13/04/2021 | Estado Procesal: Concluido | RIT: E-15-2021 | Fecha Ing.: 13/04/2021 | RUC: 20- 3-0225526-2 | Est. Adm.: Sin archivar | Proc.: Exhorto | Forma Inicio.: Exhorto | Estado Proc.: Concluido | Etapa: Terminada | Titulo Ejec.:  | Juez Asignado: EVA IVONNE SALGADO DIAZ | Tribunal: 1° Juzgado de Letras de Coronel
