NOMBRE;DOCUMENTO;CARGO;INSTITUCION;OBSERVACIONES
SOCIEDAD ADMINISTRADORA DE FONDOS DE CESANTIA DE CHILE II S.A.;76237243-6;DTE.;Juzgado de Letras de CasaBlanca;RIT: P-297-2022 | Tribunal: Juzgado de Letras de CasaBlanca | Caratulado: ADM. DE FONDOS DE CESANTIA CHILE II S.A. CON JOSE DEL C | Fecha Ingreso: 21/07/2022 | Estado Procesal: Tramitación | RIT: P-297-2022 | Fecha Ing.: 21/07/2022 | RUC: 22- 3-0145862-6 | Est. Adm.: Sin archivar | Proc.: Ejecutivo Previsional | Forma Inicio.: Demanda | Estado Proc.: Tramitación | Etapa: Ingreso | Titulo Ejec.:  | Juez Asignado: ALEXANDRA SOFIA YAÑEZ JARA | Tribunal: Juzgado de Letras de CasaBlanca
JOSE DEL CARMEN ALVAREZ CALDERON;5005120-K;DDO.;Juzgado de Letras de CasaBlanca;RIT: P-297-2022 | Tribunal: Juzgado de Letras de CasaBlanca | Caratulado: ADM. DE FONDOS DE CESANTIA CHILE II S.A. CON JOSE DEL C | Fecha Ingreso: 21/07/2022 | Estado Procesal: Tramitación | RIT: P-297-2022 | Fecha Ing.: 21/07/2022 | RUC: 22- 3-0145862-6 | Est. Adm.: Sin archivar | Proc.: Ejecutivo Previsional | Forma Inicio.: Demanda | Estado Proc.: Tramitación | Etapa: Ingreso | Titulo Ejec.:  | Juez Asignado: ALEXANDRA SOFIA YAÑEZ JARA | Tribunal: Juzgado de Letras de CasaBlanca
Raúl Horacio Troncoso Delpiano;7072258-5;AB.DTE;Juzgado de Letras de CasaBlanca;RIT: P-297-2022 | Tribunal: Juzgado de Letras de CasaBlanca | Caratulado: ADM. DE FONDOS DE CESANTIA CHILE II S.A. CON JOSE DEL C | Fecha Ingreso: 21/07/2022 | Estado Procesal: Tramitación | RIT: P-297-2022 | Fecha Ing.: 21/07/2022 | RUC: 22- 3-0145862-6 | Est. Adm.: Sin archivar | Proc.: Ejecutivo Previsional | Forma Inicio.: Demanda | Estado Proc.: Tramitación | Etapa: Ingreso | Titulo Ejec.:  | Juez Asignado: ALEXANDRA SOFIA YAÑEZ JARA | Tribunal: Juzgado de Letras de CasaBlanca
INSTITUTO DE PREVISION SOCIAL;61979440-0;DTE.;Juzgado de Letras de CasaBlanca;RIT: P-294-2022 | Tribunal: Juzgado de Letras de CasaBlanca | Caratulado: INSTITUTO DE PREVISION SOCIAL/CONSTRUCCION Y MANTENCION | Fecha Ingreso: 20/07/2022 | Estado Procesal: Tramitación | RIT: P-294-2022 | Fecha Ing.: 20/07/2022 | RUC: 22- 3-0145418-3 | Est. Adm.: Sin archivar | Proc.: Ejecutivo Previsional | Forma Inicio.: Demanda | Estado Proc.: Tramitación | Etapa: Ingreso | Titulo Ejec.:  | Juez Asignado: ALEXANDRA SOFIA YAÑEZ JARA | Tribunal: Juzgado de Letras de CasaBlanca
SERGIO MAURICIO BASÁEZ TOLEDO;12117160-0;AB.DTE;Juzgado de Letras de CasaBlanca;RIT: P-294-2022 | Tribunal: Juzgado de Letras de CasaBlanca | Caratulado: INSTITUTO DE PREVISION SOCIAL/CONSTRUCCION Y MANTENCION | Fecha Ingreso: 20/07/2022 | Estado Procesal: Tramitación | RIT: P-294-2022 | Fecha Ing.: 20/07/2022 | RUC: 22- 3-0145418-3 | Est. Adm.: Sin archivar | Proc.: Ejecutivo Previsional | Forma Inicio.: Demanda | Estado Proc.: Tramitación | Etapa: Ingreso | Titulo Ejec.:  | Juez Asignado: ALEXANDRA SOFIA YAÑEZ JARA | Tribunal: Juzgado de Letras de CasaBlanca
CONSTRUCCION Y MANTENCION DE JARDINES ERICK WEBER PERRIERE E.I.R.L.;76236455-7;DDO.;Juzgado de Letras de CasaBlanca;RIT: P-294-2022 | Tribunal: Juzgado de Letras de CasaBlanca | Caratulado: INSTITUTO DE PREVISION SOCIAL/CONSTRUCCION Y MANTENCION | Fecha Ingreso: 20/07/2022 | Estado Procesal: Tramitación | RIT: P-294-2022 | Fecha Ing.: 20/07/2022 | RUC: 22- 3-0145418-3 | Est. Adm.: Sin archivar | Proc.: Ejecutivo Previsional | Forma Inicio.: Demanda | Estado Proc.: Tramitación | Etapa: Ingreso | Titulo Ejec.:  | Juez Asignado: ALEXANDRA SOFIA YAÑEZ JARA | Tribunal: Juzgado de Letras de CasaBlanca
