NOMBRE;DOCUMENTO;CARGO;INSTITUCION;OBSERVACIONES
Administradora de Fondos de Pensiones Capital;98000000-1;DTE.;Juzgado de Letras y Garantía de Bulnes;RIT: E-18-2022 | Tribunal: Juzgado de Letras y Garantía de Bulnes | Caratulado: A.F.P. CAPITAL S.A. CON COMERCIALIZADORA DEL BOSQUE SPA | Fecha Ingreso: 27/07/2022 | Estado Procesal: Concluido | RIT: E-18-2022 | Fecha Ing.: 27/07/2022 | RUC: 15- 3-0267088-6 | Est. Adm.: Sin archivar | Proc.: Exhorto | Forma Inicio.: Exhorto | Estado Proc.: Concluido | Etapa: Terminada | Titulo Ejec.:  | Juez Asignado: CAROLINA ANDREA SANCHEZ ABARCA | Tribunal: Juzgado de Letras y Garantía de Bulnes
COMERCIALIZADORA DEL BOSQUE SPA;76367169-0;DDO.;Juzgado de Letras y Garantía de Bulnes;RIT: E-18-2022 | Tribunal: Juzgado de Letras y Garantía de Bulnes | Caratulado: A.F.P. CAPITAL S.A. CON COMERCIALIZADORA DEL BOSQUE SPA | Fecha Ingreso: 27/07/2022 | Estado Procesal: Concluido | RIT: E-18-2022 | Fecha Ing.: 27/07/2022 | RUC: 15- 3-0267088-6 | Est. Adm.: Sin archivar | Proc.: Exhorto | Forma Inicio.: Exhorto | Estado Proc.: Concluido | Etapa: Terminada | Titulo Ejec.:  | Juez Asignado: CAROLINA ANDREA SANCHEZ ABARCA | Tribunal: Juzgado de Letras y Garantía de Bulnes
Antonio Ricardo Alamos Avendaño;8270154-0;AB.DTE;Juzgado de Letras y Garantía de Bulnes;RIT: E-18-2022 | Tribunal: Juzgado de Letras y Garantía de Bulnes | Caratulado: A.F.P. CAPITAL S.A. CON COMERCIALIZADORA DEL BOSQUE SPA | Fecha Ingreso: 27/07/2022 | Estado Procesal: Concluido | RIT: E-18-2022 | Fecha Ing.: 27/07/2022 | RUC: 15- 3-0267088-6 | Est. Adm.: Sin archivar | Proc.: Exhorto | Forma Inicio.: Exhorto | Estado Proc.: Concluido | Etapa: Terminada | Titulo Ejec.:  | Juez Asignado: CAROLINA ANDREA SANCHEZ ABARCA | Tribunal: Juzgado de Letras y Garantía de Bulnes
Manuel Jesús Figueroa Saavedra;2415267-7;AB.DTE;Juzgado de Letras y Garantía de Bulnes;RIT: E-18-2022 | Tribunal: Juzgado de Letras y Garantía de Bulnes | Caratulado: A.F.P. CAPITAL S.A. CON COMERCIALIZADORA DEL BOSQUE SPA | Fecha Ingreso: 27/07/2022 | Estado Procesal: Concluido | RIT: E-18-2022 | Fecha Ing.: 27/07/2022 | RUC: 15- 3-0267088-6 | Est. Adm.: Sin archivar | Proc.: Exhorto | Forma Inicio.: Exhorto | Estado Proc.: Concluido | Etapa: Terminada | Titulo Ejec.:  | Juez Asignado: CAROLINA ANDREA SANCHEZ ABARCA | Tribunal: Juzgado de Letras y Garantía de Bulnes
Administradora de Fondos de Pensiones Provida;76265736-8;DTE.;Juzgado de Letras y Garantía de Bulnes;RIT: P-127-2022 | Tribunal: Juzgado de Letras y Garantía de Bulnes | Caratulado: A.F.P. PROVIDA S.A. CON ABRATEC S A | Fecha Ingreso: 22/07/2022 | Estado Procesal: Concluido | RIT: P-127-2022 | Fecha Ing.: 22/07/2022 | RUC: 22- 3-0146761-7 | Est. Adm.: Sin archivar | Proc.: Ejecutivo Previsional | Forma Inicio.: Demanda | Estado Proc.: Concluido | Etapa: Terminada | Titulo Ejec.:  | Juez Asignado: GONZALO HERNAN RIQUELME ALVEAR | Tribunal: Juzgado de Letras y Garantía de Bulnes
ABRATEC S A;96532510-7;DDO.;Juzgado de Letras y Garantía de Bulnes;RIT: P-127-2022 | Tribunal: Juzgado de Letras y Garantía de Bulnes | Caratulado: A.F.P. PROVIDA S.A. CON ABRATEC S A | Fecha Ingreso: 22/07/2022 | Estado Procesal: Concluido | RIT: P-127-2022 | Fecha Ing.: 22/07/2022 | RUC: 22- 3-0146761-7 | Est. Adm.: Sin archivar | Proc.: Ejecutivo Previsional | Forma Inicio.: Demanda | Estado Proc.: Concluido | Etapa: Terminada | Titulo Ejec.:  | Juez Asignado: GONZALO HERNAN RIQUELME ALVEAR | Tribunal: Juzgado de Letras y Garantía de Bulnes
Francisco Tocornal Fuenzalida;8352676-9;AB.DTE;Juzgado de Letras y Garantía de Bulnes;RIT: P-127-2022 | Tribunal: Juzgado de Letras y Garantía de Bulnes | Caratulado: A.F.P. PROVIDA S.A. CON ABRATEC S A | Fecha Ingreso: 22/07/2022 | Estado Procesal: Concluido | RIT: P-127-2022 | Fecha Ing.: 22/07/2022 | RUC: 22- 3-0146761-7 | Est. Adm.: Sin archivar | Proc.: Ejecutivo Previsional | Forma Inicio.: Demanda | Estado Proc.: Concluido | Etapa: Terminada | Titulo Ejec.:  | Juez Asignado: GONZALO HERNAN RIQUELME ALVEAR | Tribunal: Juzgado de Letras y Garantía de Bulnes
