NOMBRE;DOCUMENTO;CARGO;INSTITUCION;OBSERVACIONES
Administradora de Fondos de Pensiones Capital;98000000-1;DTE.;1º Juzgado de Letras de Quillota;RIT: E-38-2022 | Tribunal: 1º Juzgado de Letras de Quillota | Caratulado: A.F.P. CAPITAL S.A. CON SOC. ESTRADA Y BEAUSEJOUR LTDA. | Fecha Ingreso: 26/05/2022 | Estado Procesal: Concluido | RIT: E-38-2022 | Fecha Ing.: 26/05/2022 | RUC: 15- 3-0272585-0 | Est. Adm.: Archivada | Proc.: Exhorto | Forma Inicio.: Exhorto | Estado Proc.: Concluido | Etapa: Terminada | Titulo Ejec.:  | Juez Asignado: ROLANDO ANDRES ALVEAR VALENZUELA | Tribunal: 1º Juzgado de Letras de Quillota
SOC. ESTRADA Y BEAUSEJOUR LTDA.;76235307-5;DDO.;1º Juzgado de Letras de Quillota;RIT: E-38-2022 | Tribunal: 1º Juzgado de Letras de Quillota | Caratulado: A.F.P. CAPITAL S.A. CON SOC. ESTRADA Y BEAUSEJOUR LTDA. | Fecha Ingreso: 26/05/2022 | Estado Procesal: Concluido | RIT: E-38-2022 | Fecha Ing.: 26/05/2022 | RUC: 15- 3-0272585-0 | Est. Adm.: Archivada | Proc.: Exhorto | Forma Inicio.: Exhorto | Estado Proc.: Concluido | Etapa: Terminada | Titulo Ejec.:  | Juez Asignado: ROLANDO ANDRES ALVEAR VALENZUELA | Tribunal: 1º Juzgado de Letras de Quillota
Manuel Jesus Figueroa Saavedra;2415267-7;AB.DTE;1º Juzgado de Letras de Quillota;RIT: E-38-2022 | Tribunal: 1º Juzgado de Letras de Quillota | Caratulado: A.F.P. CAPITAL S.A. CON SOC. ESTRADA Y BEAUSEJOUR LTDA. | Fecha Ingreso: 26/05/2022 | Estado Procesal: Concluido | RIT: E-38-2022 | Fecha Ing.: 26/05/2022 | RUC: 15- 3-0272585-0 | Est. Adm.: Archivada | Proc.: Exhorto | Forma Inicio.: Exhorto | Estado Proc.: Concluido | Etapa: Terminada | Titulo Ejec.:  | Juez Asignado: ROLANDO ANDRES ALVEAR VALENZUELA | Tribunal: 1º Juzgado de Letras de Quillota
CAJA DE COMPENSACIÓN DE ASIGNACIÓN FAMILIAR LOS ANDES.;81826800-9;DTE.;1º Juzgado de Letras de Quillota;RIT: P-169-2022 | Tribunal: 1º Juzgado de Letras de Quillota | Caratulado: CAJA DE COMPENSACIÓN DE ASIGNACIÓN FAMILIAR LOS ANDES./ | Fecha Ingreso: 24/05/2022 | Estado Procesal: Concluido | RIT: P-169-2022 | Fecha Ing.: 24/05/2022 | RUC: 22- 3-0103058-8 | Est. Adm.: Archivada | Proc.: Ejecutivo Previsional | Forma Inicio.: Demanda | Estado Proc.: Concluido | Etapa: Terminada | Titulo Ejec.:  | Juez Asignado: ROLANDO ANDRES ALVEAR VALENZUELA | Tribunal: 1º Juzgado de Letras de Quillota
STEFANO RENATO BERTERO SICHEL;12013971-1;AB.DTE;1º Juzgado de Letras de Quillota;RIT: P-169-2022 | Tribunal: 1º Juzgado de Letras de Quillota | Caratulado: CAJA DE COMPENSACIÓN DE ASIGNACIÓN FAMILIAR LOS ANDES./ | Fecha Ingreso: 24/05/2022 | Estado Procesal: Concluido | RIT: P-169-2022 | Fecha Ing.: 24/05/2022 | RUC: 22- 3-0103058-8 | Est. Adm.: Archivada | Proc.: Ejecutivo Previsional | Forma Inicio.: Demanda | Estado Proc.: Concluido | Etapa: Terminada | Titulo Ejec.:  | Juez Asignado: ROLANDO ANDRES ALVEAR VALENZUELA | Tribunal: 1º Juzgado de Letras de Quillota
LORENA ÁLVAREZ TOLEDO;11657527-2;AP.DTE;1º Juzgado de Letras de Quillota;RIT: P-169-2022 | Tribunal: 1º Juzgado de Letras de Quillota | Caratulado: CAJA DE COMPENSACIÓN DE ASIGNACIÓN FAMILIAR LOS ANDES./ | Fecha Ingreso: 24/05/2022 | Estado Procesal: Concluido | RIT: P-169-2022 | Fecha Ing.: 24/05/2022 | RUC: 22- 3-0103058-8 | Est. Adm.: Archivada | Proc.: Ejecutivo Previsional | Forma Inicio.: Demanda | Estado Proc.: Concluido | Etapa: Terminada | Titulo Ejec.:  | Juez Asignado: ROLANDO ANDRES ALVEAR VALENZUELA | Tribunal: 1º Juzgado de Letras de Quillota
RALPH CRISTIAN CISTERNAS ACEVEDO;15063966-2;DDO.;1º Juzgado de Letras de Quillota;RIT: P-169-2022 | Tribunal: 1º Juzgado de Letras de Quillota | Caratulado: CAJA DE COMPENSACIÓN DE ASIGNACIÓN FAMILIAR LOS ANDES./ | Fecha Ingreso: 24/05/2022 | Estado Procesal: Concluido | RIT: P-169-2022 | Fecha Ing.: 24/05/2022 | RUC: 22- 3-0103058-8 | Est. Adm.: Archivada | Proc.: Ejecutivo Previsional | Forma Inicio.: Demanda | Estado Proc.: Concluido | Etapa: Terminada | Titulo Ejec.:  | Juez Asignado: ROLANDO ANDRES ALVEAR VALENZUELA | Tribunal: 1º Juzgado de Letras de Quillota
