NOMBRE;DOCUMENTO;CARGO;INSTITUCION;OBSERVACIONES
SOCIEDAD ADMINISTRADORA DE FONDOS DE CESANTIA DE CHILE II S.A.;76237243-6;DTE.;Juzgado de Letras de Parral;RIT: D-111-2022 | Tribunal: Juzgado de Letras de Parral | Caratulado: ADM. DE FONDOS DE CESANTIA CHILE II S.A. CON JOSE ALFON | Fecha Ingreso: 19/07/2022 | Estado Procesal: Tramitación | RIT: D-111-2022 | Fecha Ing.: 19/07/2022 | RUC: 22- 3-0144158-8 | Est. Adm.: Sin archivar | Proc.: Ejecutivo DNPA | Forma Inicio.: Demanda | Estado Proc.: Tramitación | Etapa: Ingreso | Titulo Ejec.:  | Juez Asignado: MICHEL ANTONELLO FRANCESCO GALASSO CABROLIER | Tribunal: Juzgado de Letras de Parral
JOSE ALFONSO RODRIGUEZ DEL RIO;5160020-7;DDO.;Juzgado de Letras de Parral;RIT: D-111-2022 | Tribunal: Juzgado de Letras de Parral | Caratulado: ADM. DE FONDOS DE CESANTIA CHILE II S.A. CON JOSE ALFON | Fecha Ingreso: 19/07/2022 | Estado Procesal: Tramitación | RIT: D-111-2022 | Fecha Ing.: 19/07/2022 | RUC: 22- 3-0144158-8 | Est. Adm.: Sin archivar | Proc.: Ejecutivo DNPA | Forma Inicio.: Demanda | Estado Proc.: Tramitación | Etapa: Ingreso | Titulo Ejec.:  | Juez Asignado: MICHEL ANTONELLO FRANCESCO GALASSO CABROLIER | Tribunal: Juzgado de Letras de Parral
Antonio Ricardo Alamos Avendaño;8270154-0;AB.DTE;Juzgado de Letras de Parral;RIT: D-111-2022 | Tribunal: Juzgado de Letras de Parral | Caratulado: ADM. DE FONDOS DE CESANTIA CHILE II S.A. CON JOSE ALFON | Fecha Ingreso: 19/07/2022 | Estado Procesal: Tramitación | RIT: D-111-2022 | Fecha Ing.: 19/07/2022 | RUC: 22- 3-0144158-8 | Est. Adm.: Sin archivar | Proc.: Ejecutivo DNPA | Forma Inicio.: Demanda | Estado Proc.: Tramitación | Etapa: Ingreso | Titulo Ejec.:  | Juez Asignado: MICHEL ANTONELLO FRANCESCO GALASSO CABROLIER | Tribunal: Juzgado de Letras de Parral
Manuel Jesús Figueroa Saavedra;2415267-7;AB.DTE;Juzgado de Letras de Parral;RIT: D-111-2022 | Tribunal: Juzgado de Letras de Parral | Caratulado: ADM. DE FONDOS DE CESANTIA CHILE II S.A. CON JOSE ALFON | Fecha Ingreso: 19/07/2022 | Estado Procesal: Tramitación | RIT: D-111-2022 | Fecha Ing.: 19/07/2022 | RUC: 22- 3-0144158-8 | Est. Adm.: Sin archivar | Proc.: Ejecutivo DNPA | Forma Inicio.: Demanda | Estado Proc.: Tramitación | Etapa: Ingreso | Titulo Ejec.:  | Juez Asignado: MICHEL ANTONELLO FRANCESCO GALASSO CABROLIER | Tribunal: Juzgado de Letras de Parral
Administradora de Fondos de Pensiones Habitat;98000100-8;DTE.;Juzgado de Letras de Parral;RIT: P-75-2022 | Tribunal: Juzgado de Letras de Parral | Caratulado: A.F.P. HABITAT S.A. CON SOCIEDAD AGRICOLA Y GANADERA ST | Fecha Ingreso: 19/07/2022 | Estado Procesal: Concluido | RIT: P-75-2022 | Fecha Ing.: 19/07/2022 | RUC: 22- 3-0143405-0 | Est. Adm.: Sin archivar | Proc.: Ejecutivo Previsional | Forma Inicio.: Demanda | Estado Proc.: Concluido | Etapa: Terminada | Titulo Ejec.:  | Juez Asignado: PABLO DIONISIO RAMOS ABARZUA | Tribunal: Juzgado de Letras de Parral
SOCIEDAD AGRICOLA Y GANADERA STA. CRISTINA LTDA.;78867570-4;DDO.;Juzgado de Letras de Parral;RIT: P-75-2022 | Tribunal: Juzgado de Letras de Parral | Caratulado: A.F.P. HABITAT S.A. CON SOCIEDAD AGRICOLA Y GANADERA ST | Fecha Ingreso: 19/07/2022 | Estado Procesal: Concluido | RIT: P-75-2022 | Fecha Ing.: 19/07/2022 | RUC: 22- 3-0143405-0 | Est. Adm.: Sin archivar | Proc.: Ejecutivo Previsional | Forma Inicio.: Demanda | Estado Proc.: Concluido | Etapa: Terminada | Titulo Ejec.:  | Juez Asignado: PABLO DIONISIO RAMOS ABARZUA | Tribunal: Juzgado de Letras de Parral
Manuel Jesús Figueroa Saavedra;2415267-7;AB.DTE;Juzgado de Letras de Parral;RIT: P-75-2022 | Tribunal: Juzgado de Letras de Parral | Caratulado: A.F.P. HABITAT S.A. CON SOCIEDAD AGRICOLA Y GANADERA ST | Fecha Ingreso: 19/07/2022 | Estado Procesal: Concluido | RIT: P-75-2022 | Fecha Ing.: 19/07/2022 | RUC: 22- 3-0143405-0 | Est. Adm.: Sin archivar | Proc.: Ejecutivo Previsional | Forma Inicio.: Demanda | Estado Proc.: Concluido | Etapa: Terminada | Titulo Ejec.:  | Juez Asignado: PABLO DIONISIO RAMOS ABARZUA | Tribunal: Juzgado de Letras de Parral
Antonio Ricardo Alamos Avendaño;8270154-0;AB.DTE;Juzgado de Letras de Parral;RIT: P-75-2022 | Tribunal: Juzgado de Letras de Parral | Caratulado: A.F.P. HABITAT S.A. CON SOCIEDAD AGRICOLA Y GANADERA ST | Fecha Ingreso: 19/07/2022 | Estado Procesal: Concluido | RIT: P-75-2022 | Fecha Ing.: 19/07/2022 | RUC: 22- 3-0143405-0 | Est. Adm.: Sin archivar | Proc.: Ejecutivo Previsional | Forma Inicio.: Demanda | Estado Proc.: Concluido | Etapa: Terminada | Titulo Ejec.:  | Juez Asignado: PABLO DIONISIO RAMOS ABARZUA | Tribunal: Juzgado de Letras de Parral
