NOMBRE;DOCUMENTO;CARGO;INSTITUCION;OBSERVACIONES
A.F.P. PLANVITAL S.A.;98001200-K;DTE.;Jdo. de Letras y Garantía de Alto Hospicio;RIT: P-356-2023 | Tribunal: Jdo. de Letras y Garantía de Alto Hospicio | Caratulado: A.F.P. PLANVITAL S.A./BRYAN RICHARD PLAZA VIEIRA TRASPO | Fecha Ingreso: 04/10/2023 | Estado Procesal: Tramitación | RIT: P-356-2023 | Fecha Ing.: 04/10/2023 | RUC: 23- 3-0266787-K | Est. Adm.: Sin archivar | Proc.: Ejecutivo Previsional | Forma Inicio.: Demanda | Estado Proc.: Tramitación | Etapa: Ingreso | Titulo Ejec.:  | Juez Asignado: ARACELI ALEJANDRA PEREZ GONZALEZ | Tribunal: Jdo. de Letras y Garantía de Alto Hospicio
MANUEL JESÚS FIGUEROA SAAVEDRA;2415267-7;AB.DTE;Jdo. de Letras y Garantía de Alto Hospicio;RIT: P-356-2023 | Tribunal: Jdo. de Letras y Garantía de Alto Hospicio | Caratulado: A.F.P. PLANVITAL S.A./BRYAN RICHARD PLAZA VIEIRA TRASPO | Fecha Ingreso: 04/10/2023 | Estado Procesal: Tramitación | RIT: P-356-2023 | Fecha Ing.: 04/10/2023 | RUC: 23- 3-0266787-K | Est. Adm.: Sin archivar | Proc.: Ejecutivo Previsional | Forma Inicio.: Demanda | Estado Proc.: Tramitación | Etapa: Ingreso | Titulo Ejec.:  | Juez Asignado: ARACELI ALEJANDRA PEREZ GONZALEZ | Tribunal: Jdo. de Letras y Garantía de Alto Hospicio
ANTONIO RICARDO ÁLAMOS AVENDAÑO;8270154-0;AB.DTE;Jdo. de Letras y Garantía de Alto Hospicio;RIT: P-356-2023 | Tribunal: Jdo. de Letras y Garantía de Alto Hospicio | Caratulado: A.F.P. PLANVITAL S.A./BRYAN RICHARD PLAZA VIEIRA TRASPO | Fecha Ingreso: 04/10/2023 | Estado Procesal: Tramitación | RIT: P-356-2023 | Fecha Ing.: 04/10/2023 | RUC: 23- 3-0266787-K | Est. Adm.: Sin archivar | Proc.: Ejecutivo Previsional | Forma Inicio.: Demanda | Estado Proc.: Tramitación | Etapa: Ingreso | Titulo Ejec.:  | Juez Asignado: ARACELI ALEJANDRA PEREZ GONZALEZ | Tribunal: Jdo. de Letras y Garantía de Alto Hospicio
BRYAN RICHARD PLAZA VIEIRA TRASPORTE Y ARRENDAMIENTO DE MAQUINARIAS EIRL;76080798-2;DDO.;Jdo. de Letras y Garantía de Alto Hospicio;RIT: P-356-2023 | Tribunal: Jdo. de Letras y Garantía de Alto Hospicio | Caratulado: A.F.P. PLANVITAL S.A./BRYAN RICHARD PLAZA VIEIRA TRASPO | Fecha Ingreso: 04/10/2023 | Estado Procesal: Tramitación | RIT: P-356-2023 | Fecha Ing.: 04/10/2023 | RUC: 23- 3-0266787-K | Est. Adm.: Sin archivar | Proc.: Ejecutivo Previsional | Forma Inicio.: Demanda | Estado Proc.: Tramitación | Etapa: Ingreso | Titulo Ejec.:  | Juez Asignado: ARACELI ALEJANDRA PEREZ GONZALEZ | Tribunal: Jdo. de Letras y Garantía de Alto Hospicio
Administradora de Fondos de Pensiones Cuprum S.A.;76240079-0;DTE.;Jdo. de Letras y Garantía de Alto Hospicio;RIT: P-345-2023 | Tribunal: Jdo. de Letras y Garantía de Alto Hospicio | Caratulado: A.F.P. CUPRUM S.A. CON BRAYAN RICHARD PLAZA VIEIRA TRAN | Fecha Ingreso: 29/09/2023 | Estado Procesal: Tramitación | RIT: P-345-2023 | Fecha Ing.: 29/09/2023 | RUC: 23- 3-0259021-4 | Est. Adm.: Sin archivar | Proc.: Ejecutivo Previsional | Forma Inicio.: Demanda | Estado Proc.: Tramitación | Etapa: Ingreso | Titulo Ejec.:  | Juez Asignado: VICTOR HUGO SANHUEZA BRAVO | Tribunal: Jdo. de Letras y Garantía de Alto Hospicio
BRAYAN RICHARD PLAZA VIEIRA TRANSPORTE Y ARRENDAMIENTO DE MAQUINARIAS E.I.R.L.;76080798-2;DDO.;Jdo. de Letras y Garantía de Alto Hospicio;RIT: P-345-2023 | Tribunal: Jdo. de Letras y Garantía de Alto Hospicio | Caratulado: A.F.P. CUPRUM S.A. CON BRAYAN RICHARD PLAZA VIEIRA TRAN | Fecha Ingreso: 29/09/2023 | Estado Procesal: Tramitación | RIT: P-345-2023 | Fecha Ing.: 29/09/2023 | RUC: 23- 3-0259021-4 | Est. Adm.: Sin archivar | Proc.: Ejecutivo Previsional | Forma Inicio.: Demanda | Estado Proc.: Tramitación | Etapa: Ingreso | Titulo Ejec.:  | Juez Asignado: VICTOR HUGO SANHUEZA BRAVO | Tribunal: Jdo. de Letras y Garantía de Alto Hospicio
Francisco Tocornal Fuenzalida;8352676-9;AB.DTE;Jdo. de Letras y Garantía de Alto Hospicio;RIT: P-345-2023 | Tribunal: Jdo. de Letras y Garantía de Alto Hospicio | Caratulado: A.F.P. CUPRUM S.A. CON BRAYAN RICHARD PLAZA VIEIRA TRAN | Fecha Ingreso: 29/09/2023 | Estado Procesal: Tramitación | RIT: P-345-2023 | Fecha Ing.: 29/09/2023 | RUC: 23- 3-0259021-4 | Est. Adm.: Sin archivar | Proc.: Ejecutivo Previsional | Forma Inicio.: Demanda | Estado Proc.: Tramitación | Etapa: Ingreso | Titulo Ejec.:  | Juez Asignado: VICTOR HUGO SANHUEZA BRAVO | Tribunal: Jdo. de Letras y Garantía de Alto Hospicio
