NOMBRE;DOCUMENTO;CARGO;INSTITUCION;OBSERVACIONES
ISAPRE COLMENA GOLDEN CROSS S.A.;76296619-0;DTE.;2º Juzgado de Letras de Quillota;RIT: P-116-2022 | Tribunal: 2º Juzgado de Letras de Quillota | Caratulado: ISAPRE COLMENA GOLDEN CROSS S.A./INGEAP SPA | Fecha Ingreso: 19/05/2022 | Estado Procesal: Tramitación | RIT: P-116-2022 | Fecha Ing.: 19/05/2022 | RUC: 22- 3-0100662-8 | Est. Adm.: Sin archivar | Proc.: Ejecutivo Previsional | Forma Inicio.: Demanda | Estado Proc.: Tramitación | Etapa: Ingreso | Titulo Ejec.:  | Juez Asignado: PATRICIA ZAVALA ASTUDILLO | Tribunal: 2º Juzgado de Letras de Quillota
STHEPHANIE ALEXANDRA VIDAL ALARCÓN;17044845-6;AB.DTE;2º Juzgado de Letras de Quillota;RIT: P-116-2022 | Tribunal: 2º Juzgado de Letras de Quillota | Caratulado: ISAPRE COLMENA GOLDEN CROSS S.A./INGEAP SPA | Fecha Ingreso: 19/05/2022 | Estado Procesal: Tramitación | RIT: P-116-2022 | Fecha Ing.: 19/05/2022 | RUC: 22- 3-0100662-8 | Est. Adm.: Sin archivar | Proc.: Ejecutivo Previsional | Forma Inicio.: Demanda | Estado Proc.: Tramitación | Etapa: Ingreso | Titulo Ejec.:  | Juez Asignado: PATRICIA ZAVALA ASTUDILLO | Tribunal: 2º Juzgado de Letras de Quillota
INGEAP SPA;76906788-4;DDO.;2º Juzgado de Letras de Quillota;RIT: P-116-2022 | Tribunal: 2º Juzgado de Letras de Quillota | Caratulado: ISAPRE COLMENA GOLDEN CROSS S.A./INGEAP SPA | Fecha Ingreso: 19/05/2022 | Estado Procesal: Tramitación | RIT: P-116-2022 | Fecha Ing.: 19/05/2022 | RUC: 22- 3-0100662-8 | Est. Adm.: Sin archivar | Proc.: Ejecutivo Previsional | Forma Inicio.: Demanda | Estado Proc.: Tramitación | Etapa: Ingreso | Titulo Ejec.:  | Juez Asignado: PATRICIA ZAVALA ASTUDILLO | Tribunal: 2º Juzgado de Letras de Quillota
ÁLVARO ANDRÉS MOLINA LEIVA;13671419-8;AB.DTE;2º Juzgado de Letras de Quillota;RIT: P-116-2022 | Tribunal: 2º Juzgado de Letras de Quillota | Caratulado: ISAPRE COLMENA GOLDEN CROSS S.A./INGEAP SPA | Fecha Ingreso: 19/05/2022 | Estado Procesal: Tramitación | RIT: P-116-2022 | Fecha Ing.: 19/05/2022 | RUC: 22- 3-0100662-8 | Est. Adm.: Sin archivar | Proc.: Ejecutivo Previsional | Forma Inicio.: Demanda | Estado Proc.: Tramitación | Etapa: Ingreso | Titulo Ejec.:  | Juez Asignado: PATRICIA ZAVALA ASTUDILLO | Tribunal: 2º Juzgado de Letras de Quillota
Administradora de Fondos de Pensiones Provida;76265736-8;DTE.;2º Juzgado de Letras de Quillota;RIT: P-112-2022 | Tribunal: 2º Juzgado de Letras de Quillota | Caratulado: A.F.P. PROVIDA S.A. CON INMOBILIARIA KENTUCKY LIMITADA | Fecha Ingreso: 17/05/2022 | Estado Procesal: Concluido | RIT: P-112-2022 | Fecha Ing.: 17/05/2022 | RUC: 22- 3-0098197-K | Est. Adm.: Archivada | Proc.: Ejecutivo Previsional | Forma Inicio.: Demanda | Estado Proc.: Concluido | Etapa: Terminada | Titulo Ejec.:  | Juez Asignado: PATRICIA ZAVALA ASTUDILLO | Tribunal: 2º Juzgado de Letras de Quillota
INMOBILIARIA KENTUCKY LIMITADA;77095550-5;DDO.;2º Juzgado de Letras de Quillota;RIT: P-112-2022 | Tribunal: 2º Juzgado de Letras de Quillota | Caratulado: A.F.P. PROVIDA S.A. CON INMOBILIARIA KENTUCKY LIMITADA | Fecha Ingreso: 17/05/2022 | Estado Procesal: Concluido | RIT: P-112-2022 | Fecha Ing.: 17/05/2022 | RUC: 22- 3-0098197-K | Est. Adm.: Archivada | Proc.: Ejecutivo Previsional | Forma Inicio.: Demanda | Estado Proc.: Concluido | Etapa: Terminada | Titulo Ejec.:  | Juez Asignado: PATRICIA ZAVALA ASTUDILLO | Tribunal: 2º Juzgado de Letras de Quillota
Raúl Horacio Troncoso Delpiano;7072258-5;AB.DTE;2º Juzgado de Letras de Quillota;RIT: P-112-2022 | Tribunal: 2º Juzgado de Letras de Quillota | Caratulado: A.F.P. PROVIDA S.A. CON INMOBILIARIA KENTUCKY LIMITADA | Fecha Ingreso: 17/05/2022 | Estado Procesal: Concluido | RIT: P-112-2022 | Fecha Ing.: 17/05/2022 | RUC: 22- 3-0098197-K | Est. Adm.: Archivada | Proc.: Ejecutivo Previsional | Forma Inicio.: Demanda | Estado Proc.: Concluido | Etapa: Terminada | Titulo Ejec.:  | Juez Asignado: PATRICIA ZAVALA ASTUDILLO | Tribunal: 2º Juzgado de Letras de Quillota
