NOMBRE;DOCUMENTO;CARGO;INSTITUCION;OBSERVACIONES
Administradora de Fondos de Pensiones Provida;76265736-8;DTE.;1° Juzgado de Letras de Buin;RIT: P-443-2022 | Tribunal: 1° Juzgado de Letras de Buin | Caratulado: A.F.P. PROVIDA S.A. CON EXPORTADORA DONA PAULA LTDA | Fecha Ingreso: 15/09/2022 | Estado Procesal: Concluido | RIT: P-443-2022 | Fecha Ing.: 15/09/2022 | RUC: 22- 3-0189731-K | Est. Adm.: Archivada | Proc.: Ejecutivo Previsional | Forma Inicio.: Demanda | Estado Proc.: Concluido | Etapa: Terminada | Titulo Ejec.:  | Juez Asignado: MARIA PAZ RODRIGUEZ MALUENDA | Tribunal: 1° Juzgado de Letras de Buin
EXPORTADORA DONA PAULA LTDA;76647220-6;DDO.;1° Juzgado de Letras de Buin;RIT: P-443-2022 | Tribunal: 1° Juzgado de Letras de Buin | Caratulado: A.F.P. PROVIDA S.A. CON EXPORTADORA DONA PAULA LTDA | Fecha Ingreso: 15/09/2022 | Estado Procesal: Concluido | RIT: P-443-2022 | Fecha Ing.: 15/09/2022 | RUC: 22- 3-0189731-K | Est. Adm.: Archivada | Proc.: Ejecutivo Previsional | Forma Inicio.: Demanda | Estado Proc.: Concluido | Etapa: Terminada | Titulo Ejec.:  | Juez Asignado: MARIA PAZ RODRIGUEZ MALUENDA | Tribunal: 1° Juzgado de Letras de Buin
Raúl Horacio Troncoso Delpiano;7072258-5;AB.DTE;1° Juzgado de Letras de Buin;RIT: P-443-2022 | Tribunal: 1° Juzgado de Letras de Buin | Caratulado: A.F.P. PROVIDA S.A. CON EXPORTADORA DONA PAULA LTDA | Fecha Ingreso: 15/09/2022 | Estado Procesal: Concluido | RIT: P-443-2022 | Fecha Ing.: 15/09/2022 | RUC: 22- 3-0189731-K | Est. Adm.: Archivada | Proc.: Ejecutivo Previsional | Forma Inicio.: Demanda | Estado Proc.: Concluido | Etapa: Terminada | Titulo Ejec.:  | Juez Asignado: MARIA PAZ RODRIGUEZ MALUENDA | Tribunal: 1° Juzgado de Letras de Buin
Administradora de Fondos de Pensiones Provida;76265736-8;DTE.;1° Juzgado de Letras de Buin;RIT: P-439-2022 | Tribunal: 1° Juzgado de Letras de Buin | Caratulado: A.F.P. PROVIDA S.A. CON SOCIEDAD LAVIN MARTINEZ ASOCIAD | Fecha Ingreso: 13/09/2022 | Estado Procesal: Concluido | RIT: P-439-2022 | Fecha Ing.: 13/09/2022 | RUC: 22- 3-0188317-3 | Est. Adm.: Sin archivar | Proc.: Ejecutivo Previsional | Forma Inicio.: Demanda | Estado Proc.: Concluido | Etapa: Terminada | Titulo Ejec.:  | Juez Asignado: MYRIAM VERONICA ORTIZ URRA | Tribunal: 1° Juzgado de Letras de Buin
SOCIEDAD LAVIN MARTINEZ ASOCIADOS LIMITA;76384393-9;DDO.;1° Juzgado de Letras de Buin;RIT: P-439-2022 | Tribunal: 1° Juzgado de Letras de Buin | Caratulado: A.F.P. PROVIDA S.A. CON SOCIEDAD LAVIN MARTINEZ ASOCIAD | Fecha Ingreso: 13/09/2022 | Estado Procesal: Concluido | RIT: P-439-2022 | Fecha Ing.: 13/09/2022 | RUC: 22- 3-0188317-3 | Est. Adm.: Sin archivar | Proc.: Ejecutivo Previsional | Forma Inicio.: Demanda | Estado Proc.: Concluido | Etapa: Terminada | Titulo Ejec.:  | Juez Asignado: MYRIAM VERONICA ORTIZ URRA | Tribunal: 1° Juzgado de Letras de Buin
Francisco Tocornal Fuenzalida;8352676-9;AB.DTE;1° Juzgado de Letras de Buin;RIT: P-439-2022 | Tribunal: 1° Juzgado de Letras de Buin | Caratulado: A.F.P. PROVIDA S.A. CON SOCIEDAD LAVIN MARTINEZ ASOCIAD | Fecha Ingreso: 13/09/2022 | Estado Procesal: Concluido | RIT: P-439-2022 | Fecha Ing.: 13/09/2022 | RUC: 22- 3-0188317-3 | Est. Adm.: Sin archivar | Proc.: Ejecutivo Previsional | Forma Inicio.: Demanda | Estado Proc.: Concluido | Etapa: Terminada | Titulo Ejec.:  | Juez Asignado: MYRIAM VERONICA ORTIZ URRA | Tribunal: 1° Juzgado de Letras de Buin
