NOMBRE;DOCUMENTO;CARGO;INSTITUCION;OBSERVACIONES
ISAPRE BANMÉDICA S. A.;96572800-7;DTE.;1º Juzgado de Letras de los Andes;RIT: P-288-2024 | Tribunal: 1º Juzgado de Letras de los Andes | Caratulado: ISAPRE BANMÉDICA S. A./INVERSIONES BLACKMONT SPA HOSPIT | Fecha Ingreso: 11/07/2024 | Estado Procesal: Tramitación | RIT: P-288-2024 | Fecha Ing.: 11/07/2024 | RUC: 24- 3-0198687-0 | Est. Adm.: Sin archivar | Proc.: Ejecutivo Previsional | Forma Inicio.: Demanda | Estado Proc.: Tramitación | Etapa: Ingreso | Titulo Ejec.:  | Juez Asignado: FERNANDO MARCOS ALVARADO PEÑA | Tribunal: 1º Juzgado de Letras de los Andes
ROSA ANDREA TERÁN REYES;18305709-K;AB.DTE;1º Juzgado de Letras de los Andes;RIT: P-288-2024 | Tribunal: 1º Juzgado de Letras de los Andes | Caratulado: ISAPRE BANMÉDICA S. A./INVERSIONES BLACKMONT SPA HOSPIT | Fecha Ingreso: 11/07/2024 | Estado Procesal: Tramitación | RIT: P-288-2024 | Fecha Ing.: 11/07/2024 | RUC: 24- 3-0198687-0 | Est. Adm.: Sin archivar | Proc.: Ejecutivo Previsional | Forma Inicio.: Demanda | Estado Proc.: Tramitación | Etapa: Ingreso | Titulo Ejec.:  | Juez Asignado: FERNANDO MARCOS ALVARADO PEÑA | Tribunal: 1º Juzgado de Letras de los Andes
INVERSIONES BLACKMONT SPA HOSPITAL CLINICO VETERIN;77515477-2;DDO.;1º Juzgado de Letras de los Andes;RIT: P-288-2024 | Tribunal: 1º Juzgado de Letras de los Andes | Caratulado: ISAPRE BANMÉDICA S. A./INVERSIONES BLACKMONT SPA HOSPIT | Fecha Ingreso: 11/07/2024 | Estado Procesal: Tramitación | RIT: P-288-2024 | Fecha Ing.: 11/07/2024 | RUC: 24- 3-0198687-0 | Est. Adm.: Sin archivar | Proc.: Ejecutivo Previsional | Forma Inicio.: Demanda | Estado Proc.: Tramitación | Etapa: Ingreso | Titulo Ejec.:  | Juez Asignado: FERNANDO MARCOS ALVARADO PEÑA | Tribunal: 1º Juzgado de Letras de los Andes
Administradora de Fondos de Pensiones Planvital;98001200-K;DTE.;1º Juzgado de Letras de los Andes;RIT: E-15-2024 | Tribunal: 1º Juzgado de Letras de los Andes | Caratulado: A.F.P. PLANVITAL S.A. CON ANA MARIA RODRIGUEZ GAETE | Fecha Ingreso: 05/07/2024 | Estado Procesal: Concluido | RIT: E-15-2024 | Fecha Ing.: 05/07/2024 | RUC: 16- 3-0140994-3 | Est. Adm.: Sin archivar | Proc.: Exhorto | Forma Inicio.: Exhorto | Estado Proc.: Concluido | Etapa: Terminada | Titulo Ejec.:  | Juez Asignado: MARTA ANDREA FUENTES VILLANUEVA | Tribunal: 1º Juzgado de Letras de los Andes
ANA MARIA RODRIGUEZ GAETE;7027160-5;DDO.;1º Juzgado de Letras de los Andes;RIT: E-15-2024 | Tribunal: 1º Juzgado de Letras de los Andes | Caratulado: A.F.P. PLANVITAL S.A. CON ANA MARIA RODRIGUEZ GAETE | Fecha Ingreso: 05/07/2024 | Estado Procesal: Concluido | RIT: E-15-2024 | Fecha Ing.: 05/07/2024 | RUC: 16- 3-0140994-3 | Est. Adm.: Sin archivar | Proc.: Exhorto | Forma Inicio.: Exhorto | Estado Proc.: Concluido | Etapa: Terminada | Titulo Ejec.:  | Juez Asignado: MARTA ANDREA FUENTES VILLANUEVA | Tribunal: 1º Juzgado de Letras de los Andes
Manuel Jesús Figueroa Saavedra;2415267-7;AB.DTE;1º Juzgado de Letras de los Andes;RIT: E-15-2024 | Tribunal: 1º Juzgado de Letras de los Andes | Caratulado: A.F.P. PLANVITAL S.A. CON ANA MARIA RODRIGUEZ GAETE | Fecha Ingreso: 05/07/2024 | Estado Procesal: Concluido | RIT: E-15-2024 | Fecha Ing.: 05/07/2024 | RUC: 16- 3-0140994-3 | Est. Adm.: Sin archivar | Proc.: Exhorto | Forma Inicio.: Exhorto | Estado Proc.: Concluido | Etapa: Terminada | Titulo Ejec.:  | Juez Asignado: MARTA ANDREA FUENTES VILLANUEVA | Tribunal: 1º Juzgado de Letras de los Andes
Antonio Ricardo Alamos Avendaño;8270154-0;AB.DTE;1º Juzgado de Letras de los Andes;RIT: E-15-2024 | Tribunal: 1º Juzgado de Letras de los Andes | Caratulado: A.F.P. PLANVITAL S.A. CON ANA MARIA RODRIGUEZ GAETE | Fecha Ingreso: 05/07/2024 | Estado Procesal: Concluido | RIT: E-15-2024 | Fecha Ing.: 05/07/2024 | RUC: 16- 3-0140994-3 | Est. Adm.: Sin archivar | Proc.: Exhorto | Forma Inicio.: Exhorto | Estado Proc.: Concluido | Etapa: Terminada | Titulo Ejec.:  | Juez Asignado: MARTA ANDREA FUENTES VILLANUEVA | Tribunal: 1º Juzgado de Letras de los Andes
