NOMBRE;DOCUMENTO;CARGO;INSTITUCION;OBSERVACIONES
SOCIEDAD ADMINISTRADORA DE FONDOS DE CESANTIA DE CHILE II S.A.;76237243-6;DTE.;Juzgado de Letras y Garantía de Quintero;RIT: P-146-2023 | Tribunal: Juzgado de Letras y Garantía de Quintero | Caratulado: ADM. DE FONDOS DE CESANTIA CHILE II S.A. CON BORIS HUMB | Fecha Ingreso: 01/06/2023 | Estado Procesal: Concluido | RIT: P-146-2023 | Fecha Ing.: 01/06/2023 | RUC: 23- 3-0139346-6 | Est. Adm.: Archivada | Proc.: Ejecutivo Previsional | Forma Inicio.: Demanda | Estado Proc.: Concluido | Etapa: Terminada | Titulo Ejec.:  | Juez Asignado: MATIAS FONTECILLA MILLAN | Tribunal: Juzgado de Letras y Garantía de Quintero
BORIS HUMBERTO MOROZIN BAJCIC;6931613-1;DDO.;Juzgado de Letras y Garantía de Quintero;RIT: P-146-2023 | Tribunal: Juzgado de Letras y Garantía de Quintero | Caratulado: ADM. DE FONDOS DE CESANTIA CHILE II S.A. CON BORIS HUMB | Fecha Ingreso: 01/06/2023 | Estado Procesal: Concluido | RIT: P-146-2023 | Fecha Ing.: 01/06/2023 | RUC: 23- 3-0139346-6 | Est. Adm.: Archivada | Proc.: Ejecutivo Previsional | Forma Inicio.: Demanda | Estado Proc.: Concluido | Etapa: Terminada | Titulo Ejec.:  | Juez Asignado: MATIAS FONTECILLA MILLAN | Tribunal: Juzgado de Letras y Garantía de Quintero
Roberto Gastón Romero Fuentes;9268850-K;AB.DTE;Juzgado de Letras y Garantía de Quintero;RIT: P-146-2023 | Tribunal: Juzgado de Letras y Garantía de Quintero | Caratulado: ADM. DE FONDOS DE CESANTIA CHILE II S.A. CON BORIS HUMB | Fecha Ingreso: 01/06/2023 | Estado Procesal: Concluido | RIT: P-146-2023 | Fecha Ing.: 01/06/2023 | RUC: 23- 3-0139346-6 | Est. Adm.: Archivada | Proc.: Ejecutivo Previsional | Forma Inicio.: Demanda | Estado Proc.: Concluido | Etapa: Terminada | Titulo Ejec.:  | Juez Asignado: MATIAS FONTECILLA MILLAN | Tribunal: Juzgado de Letras y Garantía de Quintero
Administradora de Fondos de Pensiones Cuprum S.A.;76240079-0;DTE.;Juzgado de Letras y Garantía de Quintero;RIT: P-144-2023 | Tribunal: Juzgado de Letras y Garantía de Quintero | Caratulado: A.F.P. CUPRUM S.A. CON SOC PESQUERA QUINTERO LIMITADA | Fecha Ingreso: 26/05/2023 | Estado Procesal: Acumulada | RIT: P-144-2023 | Fecha Ing.: 26/05/2023 | RUC: 23- 3-0133033-2 | Est. Adm.: Archivada | Proc.: Ejecutivo Previsional | Forma Inicio.: Demanda | Estado Proc.: Acumulada | Etapa: Terminada | Titulo Ejec.:  | Juez Asignado: DIEGO ALBERTO MUÑOZ PACHECO | Tribunal: Juzgado de Letras y Garantía de Quintero
SOC PESQUERA QUINTERO LIMITADA;78577670-4;DDO.;Juzgado de Letras y Garantía de Quintero;RIT: P-144-2023 | Tribunal: Juzgado de Letras y Garantía de Quintero | Caratulado: A.F.P. CUPRUM S.A. CON SOC PESQUERA QUINTERO LIMITADA | Fecha Ingreso: 26/05/2023 | Estado Procesal: Acumulada | RIT: P-144-2023 | Fecha Ing.: 26/05/2023 | RUC: 23- 3-0133033-2 | Est. Adm.: Archivada | Proc.: Ejecutivo Previsional | Forma Inicio.: Demanda | Estado Proc.: Acumulada | Etapa: Terminada | Titulo Ejec.:  | Juez Asignado: DIEGO ALBERTO MUÑOZ PACHECO | Tribunal: Juzgado de Letras y Garantía de Quintero
Francisco Tocornal Fuenzalida;8352676-9;AB.DTE;Juzgado de Letras y Garantía de Quintero;RIT: P-144-2023 | Tribunal: Juzgado de Letras y Garantía de Quintero | Caratulado: A.F.P. CUPRUM S.A. CON SOC PESQUERA QUINTERO LIMITADA | Fecha Ingreso: 26/05/2023 | Estado Procesal: Acumulada | RIT: P-144-2023 | Fecha Ing.: 26/05/2023 | RUC: 23- 3-0133033-2 | Est. Adm.: Archivada | Proc.: Ejecutivo Previsional | Forma Inicio.: Demanda | Estado Proc.: Acumulada | Etapa: Terminada | Titulo Ejec.:  | Juez Asignado: DIEGO ALBERTO MUÑOZ PACHECO | Tribunal: Juzgado de Letras y Garantía de Quintero
