NOMBRE;DOCUMENTO;CARGO;INSTITUCION;OBSERVACIONES
SOCIEDAD ADMINISTRADORA DE FONDOS DE CESANTIA DE CHILE II;76237243-6;DTE.;1° Juzgado de Letras de Melipilla;RIT: E-77-2022 | Tribunal: 1° Juzgado de Letras de Melipilla | Caratulado: SOCIEDAD ADMINISTRADORA DE FONDOS DE CESANTIA DE CHILE | Fecha Ingreso: 04/10/2022 | Estado Procesal: Concluido | RIT: E-77-2022 | Fecha Ing.: 04/10/2022 | RUC: 14- 3-0050739-6 | Est. Adm.: Archivada | Proc.: Exhorto | Forma Inicio.: Exhorto | Estado Proc.: Concluido | Etapa: Terminada | Titulo Ejec.:  | Juez Asignado: JOSE SVATO NESVARA HERRERA | Tribunal: 1° Juzgado de Letras de Melipilla
MANUEL FIGUEROA SAAVEDRA;2415267-7;AB.DTE;1° Juzgado de Letras de Melipilla;RIT: E-77-2022 | Tribunal: 1° Juzgado de Letras de Melipilla | Caratulado: SOCIEDAD ADMINISTRADORA DE FONDOS DE CESANTIA DE CHILE | Fecha Ingreso: 04/10/2022 | Estado Procesal: Concluido | RIT: E-77-2022 | Fecha Ing.: 04/10/2022 | RUC: 14- 3-0050739-6 | Est. Adm.: Archivada | Proc.: Exhorto | Forma Inicio.: Exhorto | Estado Proc.: Concluido | Etapa: Terminada | Titulo Ejec.:  | Juez Asignado: JOSE SVATO NESVARA HERRERA | Tribunal: 1° Juzgado de Letras de Melipilla
ANTONIO RICARDO ALAMOS AVENDAÑO;8270154-0;AP.DTE;1° Juzgado de Letras de Melipilla;RIT: E-77-2022 | Tribunal: 1° Juzgado de Letras de Melipilla | Caratulado: SOCIEDAD ADMINISTRADORA DE FONDOS DE CESANTIA DE CHILE | Fecha Ingreso: 04/10/2022 | Estado Procesal: Concluido | RIT: E-77-2022 | Fecha Ing.: 04/10/2022 | RUC: 14- 3-0050739-6 | Est. Adm.: Archivada | Proc.: Exhorto | Forma Inicio.: Exhorto | Estado Proc.: Concluido | Etapa: Terminada | Titulo Ejec.:  | Juez Asignado: JOSE SVATO NESVARA HERRERA | Tribunal: 1° Juzgado de Letras de Melipilla
LEONIDES DEL ROSARIO CAMPOS BORNE;9345386-7;DDO.;1° Juzgado de Letras de Melipilla;RIT: E-77-2022 | Tribunal: 1° Juzgado de Letras de Melipilla | Caratulado: SOCIEDAD ADMINISTRADORA DE FONDOS DE CESANTIA DE CHILE | Fecha Ingreso: 04/10/2022 | Estado Procesal: Concluido | RIT: E-77-2022 | Fecha Ing.: 04/10/2022 | RUC: 14- 3-0050739-6 | Est. Adm.: Archivada | Proc.: Exhorto | Forma Inicio.: Exhorto | Estado Proc.: Concluido | Etapa: Terminada | Titulo Ejec.:  | Juez Asignado: JOSE SVATO NESVARA HERRERA | Tribunal: 1° Juzgado de Letras de Melipilla
ADMINISTRADORA DE FONDOS DE PENSIONES MODELO;76762250-3;DTE.;1° Juzgado de Letras de Melipilla;RIT: P-532-2022 | Tribunal: 1° Juzgado de Letras de Melipilla | Caratulado: A.F.P. MODELO S.A. CON EISEN SERVICIOS INTEGRALES SPA | Fecha Ingreso: 30/09/2022 | Estado Procesal: Concluido | RIT: P-532-2022 | Fecha Ing.: 30/09/2022 | RUC: 22- 3-0200489-0 | Est. Adm.: Sin archivar | Proc.: Ejecutivo Previsional | Forma Inicio.: Demanda | Estado Proc.: Concluido | Etapa: Terminada | Titulo Ejec.:  | Juez Asignado: MARIA GLORIA CORBALAN RODRIGUEZ | Tribunal: 1° Juzgado de Letras de Melipilla
EISEN SERVICIOS INTEGRALES SPA;77513074-1;DDO.;1° Juzgado de Letras de Melipilla;RIT: P-532-2022 | Tribunal: 1° Juzgado de Letras de Melipilla | Caratulado: A.F.P. MODELO S.A. CON EISEN SERVICIOS INTEGRALES SPA | Fecha Ingreso: 30/09/2022 | Estado Procesal: Concluido | RIT: P-532-2022 | Fecha Ing.: 30/09/2022 | RUC: 22- 3-0200489-0 | Est. Adm.: Sin archivar | Proc.: Ejecutivo Previsional | Forma Inicio.: Demanda | Estado Proc.: Concluido | Etapa: Terminada | Titulo Ejec.:  | Juez Asignado: MARIA GLORIA CORBALAN RODRIGUEZ | Tribunal: 1° Juzgado de Letras de Melipilla
MANUEL JESUS FIGUEROA SAAVEDRA;2415267-7;AB.DTE;1° Juzgado de Letras de Melipilla;RIT: P-532-2022 | Tribunal: 1° Juzgado de Letras de Melipilla | Caratulado: A.F.P. MODELO S.A. CON EISEN SERVICIOS INTEGRALES SPA | Fecha Ingreso: 30/09/2022 | Estado Procesal: Concluido | RIT: P-532-2022 | Fecha Ing.: 30/09/2022 | RUC: 22- 3-0200489-0 | Est. Adm.: Sin archivar | Proc.: Ejecutivo Previsional | Forma Inicio.: Demanda | Estado Proc.: Concluido | Etapa: Terminada | Titulo Ejec.:  | Juez Asignado: MARIA GLORIA CORBALAN RODRIGUEZ | Tribunal: 1° Juzgado de Letras de Melipilla
ANTONIO RICARDO ALAMOS AVENDANO;8270154-0;AB.DTE;1° Juzgado de Letras de Melipilla;RIT: P-532-2022 | Tribunal: 1° Juzgado de Letras de Melipilla | Caratulado: A.F.P. MODELO S.A. CON EISEN SERVICIOS INTEGRALES SPA | Fecha Ingreso: 30/09/2022 | Estado Procesal: Concluido | RIT: P-532-2022 | Fecha Ing.: 30/09/2022 | RUC: 22- 3-0200489-0 | Est. Adm.: Sin archivar | Proc.: Ejecutivo Previsional | Forma Inicio.: Demanda | Estado Proc.: Concluido | Etapa: Terminada | Titulo Ejec.:  | Juez Asignado: MARIA GLORIA CORBALAN RODRIGUEZ | Tribunal: 1° Juzgado de Letras de Melipilla
