NOMBRE;DOCUMENTO;CARGO;INSTITUCION;OBSERVACIONES
SOCIEDAD ADMINISTRADORA DE FONDOS DE CESANTIA DE CHILE II S.A.;76237243-6;DTE.;1º Juzgado de Letras de Linares;RIT: P-24-2022 | Tribunal: 1º Juzgado de Letras de Linares | Caratulado: ADM. DE FONDOS DE CESANTIA CHILE II S.A. CON MAURICIO S | Fecha Ingreso: 19/01/2022 | Estado Procesal: Concluido | RIT: P-24-2022 | Fecha Ing.: 19/01/2022 | RUC: 22- 3-0013263-8 | Est. Adm.: Archivada | Proc.: Ejecutivo Previsional | Forma Inicio.: Demanda | Estado Proc.: Concluido | Etapa: Terminada | Titulo Ejec.:  | Juez Asignado: CAROLINA PILAR ROJAS ARAYA | Tribunal: 1º Juzgado de Letras de Linares
MAURICIO SANDRO DIAZ VALDES;12183399-9;DDO.;1º Juzgado de Letras de Linares;RIT: P-24-2022 | Tribunal: 1º Juzgado de Letras de Linares | Caratulado: ADM. DE FONDOS DE CESANTIA CHILE II S.A. CON MAURICIO S | Fecha Ingreso: 19/01/2022 | Estado Procesal: Concluido | RIT: P-24-2022 | Fecha Ing.: 19/01/2022 | RUC: 22- 3-0013263-8 | Est. Adm.: Archivada | Proc.: Ejecutivo Previsional | Forma Inicio.: Demanda | Estado Proc.: Concluido | Etapa: Terminada | Titulo Ejec.:  | Juez Asignado: CAROLINA PILAR ROJAS ARAYA | Tribunal: 1º Juzgado de Letras de Linares
Raúl Horacio Troncoso Delpiano;7072258-5;AB.DTE;1º Juzgado de Letras de Linares;RIT: P-24-2022 | Tribunal: 1º Juzgado de Letras de Linares | Caratulado: ADM. DE FONDOS DE CESANTIA CHILE II S.A. CON MAURICIO S | Fecha Ingreso: 19/01/2022 | Estado Procesal: Concluido | RIT: P-24-2022 | Fecha Ing.: 19/01/2022 | RUC: 22- 3-0013263-8 | Est. Adm.: Archivada | Proc.: Ejecutivo Previsional | Forma Inicio.: Demanda | Estado Proc.: Concluido | Etapa: Terminada | Titulo Ejec.:  | Juez Asignado: CAROLINA PILAR ROJAS ARAYA | Tribunal: 1º Juzgado de Letras de Linares
Administradora de Fondos de Pensiones Provida;76265736-8;DTE.;1º Juzgado de Letras de Linares;RIT: P-23-2022 | Tribunal: 1º Juzgado de Letras de Linares | Caratulado: A.F.P. PROVIDA S.A. CON PRESTADORA DE SERVICIOS LLAGAL | Fecha Ingreso: 19/01/2022 | Estado Procesal: Concluido | RIT: P-23-2022 | Fecha Ing.: 19/01/2022 | RUC: 22- 3-0013170-4 | Est. Adm.: Sin archivar | Proc.: Ejecutivo Previsional | Forma Inicio.: Demanda | Estado Proc.: Concluido | Etapa: Terminada | Titulo Ejec.:  | Juez Asignado: ALEJANDRO ANTONIO SUMONTE VERDEJO | Tribunal: 1º Juzgado de Letras de Linares
PRESTADORA DE SERVICIOS LLAGAL SPA;76276301-K;DDO.;1º Juzgado de Letras de Linares;RIT: P-23-2022 | Tribunal: 1º Juzgado de Letras de Linares | Caratulado: A.F.P. PROVIDA S.A. CON PRESTADORA DE SERVICIOS LLAGAL | Fecha Ingreso: 19/01/2022 | Estado Procesal: Concluido | RIT: P-23-2022 | Fecha Ing.: 19/01/2022 | RUC: 22- 3-0013170-4 | Est. Adm.: Sin archivar | Proc.: Ejecutivo Previsional | Forma Inicio.: Demanda | Estado Proc.: Concluido | Etapa: Terminada | Titulo Ejec.:  | Juez Asignado: ALEJANDRO ANTONIO SUMONTE VERDEJO | Tribunal: 1º Juzgado de Letras de Linares
Francisco Tocornal Fuenzalida;8352676-9;AB.DTE;1º Juzgado de Letras de Linares;RIT: P-23-2022 | Tribunal: 1º Juzgado de Letras de Linares | Caratulado: A.F.P. PROVIDA S.A. CON PRESTADORA DE SERVICIOS LLAGAL | Fecha Ingreso: 19/01/2022 | Estado Procesal: Concluido | RIT: P-23-2022 | Fecha Ing.: 19/01/2022 | RUC: 22- 3-0013170-4 | Est. Adm.: Sin archivar | Proc.: Ejecutivo Previsional | Forma Inicio.: Demanda | Estado Proc.: Concluido | Etapa: Terminada | Titulo Ejec.:  | Juez Asignado: ALEJANDRO ANTONIO SUMONTE VERDEJO | Tribunal: 1º Juzgado de Letras de Linares
NUEVA MASVIDA S.A. (EX ISAPRE ÓPTIMA);96504160-5;DTE.;1º Juzgado de Letras de Linares;RIT: P-22-2022 | Tribunal: 1º Juzgado de Letras de Linares | Caratulado: NUEVA MASVIDA S.A. (Ex Isapre Óptima)/SOCIEDAD AGRICOLA | Fecha Ingreso: 18/01/2022 | Estado Procesal: Concluido | RIT: P-22-2022 | Fecha Ing.: 18/01/2022 | RUC: 22- 3-0012975-0 | Est. Adm.: Sin archivar | Proc.: Ejecutivo Previsional | Forma Inicio.: Demanda | Estado Proc.: Concluido | Etapa: Terminada | Titulo Ejec.:  | Juez Asignado: CAROLINA PILAR ROJAS ARAYA | Tribunal: 1º Juzgado de Letras de Linares
PATRICIA LORETO LOURDES MATELUNA FLETCHER;11415851-8;AB.DTE;1º Juzgado de Letras de Linares;RIT: P-22-2022 | Tribunal: 1º Juzgado de Letras de Linares | Caratulado: NUEVA MASVIDA S.A. (Ex Isapre Óptima)/SOCIEDAD AGRICOLA | Fecha Ingreso: 18/01/2022 | Estado Procesal: Concluido | RIT: P-22-2022 | Fecha Ing.: 18/01/2022 | RUC: 22- 3-0012975-0 | Est. Adm.: Sin archivar | Proc.: Ejecutivo Previsional | Forma Inicio.: Demanda | Estado Proc.: Concluido | Etapa: Terminada | Titulo Ejec.:  | Juez Asignado: CAROLINA PILAR ROJAS ARAYA | Tribunal: 1º Juzgado de Letras de Linares
SOCIEDAD AGRICOLA Y COMERCIAL VITAL FRUIT LTDA;76390082-7;DDO.;1º Juzgado de Letras de Linares;RIT: P-22-2022 | Tribunal: 1º Juzgado de Letras de Linares | Caratulado: NUEVA MASVIDA S.A. (Ex Isapre Óptima)/SOCIEDAD AGRICOLA | Fecha Ingreso: 18/01/2022 | Estado Procesal: Concluido | RIT: P-22-2022 | Fecha Ing.: 18/01/2022 | RUC: 22- 3-0012975-0 | Est. Adm.: Sin archivar | Proc.: Ejecutivo Previsional | Forma Inicio.: Demanda | Estado Proc.: Concluido | Etapa: Terminada | Titulo Ejec.:  | Juez Asignado: CAROLINA PILAR ROJAS ARAYA | Tribunal: 1º Juzgado de Letras de Linares
