NOMBRE;DOCUMENTO;CARGO;INSTITUCION;OBSERVACIONES
SOCIEDAD ADMINISTRADORA DE FONDOS DE CESANTIA DE CHILE III S.A.;77601648-9;DTE.;2° Juzgado de Letras de Talagante;RIT: P-210-2024 | Tribunal: 2° Juzgado de Letras de Talagante | Caratulado: ADM. DE FONDOS DE CESANTIA CHILE III S.A. CON LUIS LOPE | Fecha Ingreso: 16/05/2024 | Estado Procesal: Concluido | RIT: P-210-2024 | Fecha Ing.: 16/05/2024 | RUC: 24- 3-0139436-1 | Est. Adm.: Sin archivar | Proc.: Ejecutivo Previsional | Forma Inicio.: Demanda | Estado Proc.: Concluido | Etapa: Terminada | Titulo Ejec.:  | Juez Asignado: GERARDO MENA EDWARDS | Tribunal: 2° Juzgado de Letras de Talagante
LUIS LOPEZ FAJARDO;4893343-2;DDO.;2° Juzgado de Letras de Talagante;RIT: P-210-2024 | Tribunal: 2° Juzgado de Letras de Talagante | Caratulado: ADM. DE FONDOS DE CESANTIA CHILE III S.A. CON LUIS LOPE | Fecha Ingreso: 16/05/2024 | Estado Procesal: Concluido | RIT: P-210-2024 | Fecha Ing.: 16/05/2024 | RUC: 24- 3-0139436-1 | Est. Adm.: Sin archivar | Proc.: Ejecutivo Previsional | Forma Inicio.: Demanda | Estado Proc.: Concluido | Etapa: Terminada | Titulo Ejec.:  | Juez Asignado: GERARDO MENA EDWARDS | Tribunal: 2° Juzgado de Letras de Talagante
Raúl Horacio Troncoso Delpiano;7072258-5;AB.DTE;2° Juzgado de Letras de Talagante;RIT: P-210-2024 | Tribunal: 2° Juzgado de Letras de Talagante | Caratulado: ADM. DE FONDOS DE CESANTIA CHILE III S.A. CON LUIS LOPE | Fecha Ingreso: 16/05/2024 | Estado Procesal: Concluido | RIT: P-210-2024 | Fecha Ing.: 16/05/2024 | RUC: 24- 3-0139436-1 | Est. Adm.: Sin archivar | Proc.: Ejecutivo Previsional | Forma Inicio.: Demanda | Estado Proc.: Concluido | Etapa: Terminada | Titulo Ejec.:  | Juez Asignado: GERARDO MENA EDWARDS | Tribunal: 2° Juzgado de Letras de Talagante
Administradora de Fondos de Pensiones Capital;98000000-1;DTE.;2° Juzgado de Letras de Talagante;RIT: P-207-2024 | Tribunal: 2° Juzgado de Letras de Talagante | Caratulado: A.F.P. CAPITAL S.A. CON ESTRUCTURAS METALICAS JAKE SPA | Fecha Ingreso: 14/05/2024 | Estado Procesal: Tramitación | RIT: P-207-2024 | Fecha Ing.: 14/05/2024 | RUC: 24- 3-0135757-1 | Est. Adm.: Sin archivar | Proc.: Ejecutivo Previsional | Forma Inicio.: Demanda | Estado Proc.: Tramitación | Etapa: Ingreso | Titulo Ejec.:  | Juez Asignado: GERARDO MENA EDWARDS | Tribunal: 2° Juzgado de Letras de Talagante
ESTRUCTURAS METALICAS JAKE SPA;76938884-2;DDO.;2° Juzgado de Letras de Talagante;RIT: P-207-2024 | Tribunal: 2° Juzgado de Letras de Talagante | Caratulado: A.F.P. CAPITAL S.A. CON ESTRUCTURAS METALICAS JAKE SPA | Fecha Ingreso: 14/05/2024 | Estado Procesal: Tramitación | RIT: P-207-2024 | Fecha Ing.: 14/05/2024 | RUC: 24- 3-0135757-1 | Est. Adm.: Sin archivar | Proc.: Ejecutivo Previsional | Forma Inicio.: Demanda | Estado Proc.: Tramitación | Etapa: Ingreso | Titulo Ejec.:  | Juez Asignado: GERARDO MENA EDWARDS | Tribunal: 2° Juzgado de Letras de Talagante
Francisco Tocornal Fuenzalida;8352676-9;AB.DTE;2° Juzgado de Letras de Talagante;RIT: P-207-2024 | Tribunal: 2° Juzgado de Letras de Talagante | Caratulado: A.F.P. CAPITAL S.A. CON ESTRUCTURAS METALICAS JAKE SPA | Fecha Ingreso: 14/05/2024 | Estado Procesal: Tramitación | RIT: P-207-2024 | Fecha Ing.: 14/05/2024 | RUC: 24- 3-0135757-1 | Est. Adm.: Sin archivar | Proc.: Ejecutivo Previsional | Forma Inicio.: Demanda | Estado Proc.: Tramitación | Etapa: Ingreso | Titulo Ejec.:  | Juez Asignado: GERARDO MENA EDWARDS | Tribunal: 2° Juzgado de Letras de Talagante
