NOMBRE;DOCUMENTO;CARGO;INSTITUCION;OBSERVACIONES
Administradora de Fondos de Pensiones Habitat;98000100-8;DTE.;2° Juzgado de Letras de Talagante;RIT: P-138-2022 | Tribunal: 2° Juzgado de Letras de Talagante | Caratulado: A.F.P. HABITAT S.A. CON CONSTRUCCIONES LUIS RODRIGO SAN | Fecha Ingreso: 29/06/2022 | Estado Procesal: Concluido | RIT: P-138-2022 | Fecha Ing.: 29/06/2022 | RUC: 22- 3-0129257-4 | Est. Adm.: Archivada | Proc.: Ejecutivo Previsional | Forma Inicio.: Demanda | Estado Proc.: Concluido | Etapa: Terminada | Titulo Ejec.:  | Juez Asignado: GERARDO MENA EDWARDS | Tribunal: 2° Juzgado de Letras de Talagante
CONSTRUCCIONES LUIS RODRIGO SANTIBANEZ SILVA EIRL.;77254471-5;DDO.;2° Juzgado de Letras de Talagante;RIT: P-138-2022 | Tribunal: 2° Juzgado de Letras de Talagante | Caratulado: A.F.P. HABITAT S.A. CON CONSTRUCCIONES LUIS RODRIGO SAN | Fecha Ingreso: 29/06/2022 | Estado Procesal: Concluido | RIT: P-138-2022 | Fecha Ing.: 29/06/2022 | RUC: 22- 3-0129257-4 | Est. Adm.: Archivada | Proc.: Ejecutivo Previsional | Forma Inicio.: Demanda | Estado Proc.: Concluido | Etapa: Terminada | Titulo Ejec.:  | Juez Asignado: GERARDO MENA EDWARDS | Tribunal: 2° Juzgado de Letras de Talagante
Alicia Soto Santaella;3332573-8;AB.DTE;2° Juzgado de Letras de Talagante;RIT: P-138-2022 | Tribunal: 2° Juzgado de Letras de Talagante | Caratulado: A.F.P. HABITAT S.A. CON CONSTRUCCIONES LUIS RODRIGO SAN | Fecha Ingreso: 29/06/2022 | Estado Procesal: Concluido | RIT: P-138-2022 | Fecha Ing.: 29/06/2022 | RUC: 22- 3-0129257-4 | Est. Adm.: Archivada | Proc.: Ejecutivo Previsional | Forma Inicio.: Demanda | Estado Proc.: Concluido | Etapa: Terminada | Titulo Ejec.:  | Juez Asignado: GERARDO MENA EDWARDS | Tribunal: 2° Juzgado de Letras de Talagante
Administradora de Fondos de Pensiones Provida;76265736-8;DTE.;2° Juzgado de Letras de Talagante;RIT: P-135-2022 | Tribunal: 2° Juzgado de Letras de Talagante | Caratulado: A.F.P. PROVIDA S.A. CON CARLOS MOYA HERRERA | Fecha Ingreso: 28/06/2022 | Estado Procesal: Concluido | RIT: P-135-2022 | Fecha Ing.: 28/06/2022 | RUC: 22- 3-0127839-3 | Est. Adm.: Sin archivar | Proc.: Ejecutivo Previsional | Forma Inicio.: Demanda | Estado Proc.: Concluido | Etapa: Terminada | Titulo Ejec.:  | Juez Asignado: GERARDO MENA EDWARDS | Tribunal: 2° Juzgado de Letras de Talagante
CARLOS MOYA HERRERA;13247827-9;DDO.;2° Juzgado de Letras de Talagante;RIT: P-135-2022 | Tribunal: 2° Juzgado de Letras de Talagante | Caratulado: A.F.P. PROVIDA S.A. CON CARLOS MOYA HERRERA | Fecha Ingreso: 28/06/2022 | Estado Procesal: Concluido | RIT: P-135-2022 | Fecha Ing.: 28/06/2022 | RUC: 22- 3-0127839-3 | Est. Adm.: Sin archivar | Proc.: Ejecutivo Previsional | Forma Inicio.: Demanda | Estado Proc.: Concluido | Etapa: Terminada | Titulo Ejec.:  | Juez Asignado: GERARDO MENA EDWARDS | Tribunal: 2° Juzgado de Letras de Talagante
Francisco Tocornal Fuenzalida;8352676-9;AB.DTE;2° Juzgado de Letras de Talagante;RIT: P-135-2022 | Tribunal: 2° Juzgado de Letras de Talagante | Caratulado: A.F.P. PROVIDA S.A. CON CARLOS MOYA HERRERA | Fecha Ingreso: 28/06/2022 | Estado Procesal: Concluido | RIT: P-135-2022 | Fecha Ing.: 28/06/2022 | RUC: 22- 3-0127839-3 | Est. Adm.: Sin archivar | Proc.: Ejecutivo Previsional | Forma Inicio.: Demanda | Estado Proc.: Concluido | Etapa: Terminada | Titulo Ejec.:  | Juez Asignado: GERARDO MENA EDWARDS | Tribunal: 2° Juzgado de Letras de Talagante
