NOMBRE;DOCUMENTO;CARGO;INSTITUCION;OBSERVACIONES
Administradora de Fondos de Pensiones Capital;98000000-1;DTE.;2º Juzgado de Letras de Ovalle;RIT: P-334-2023 | Tribunal: 2º Juzgado de Letras de Ovalle | Caratulado: A.F.P. CAPITAL S.A. CON SOC COMERCIAL IMPORTADORA Y EXP | Fecha Ingreso: 14/09/2023 | Estado Procesal: Concluido | RIT: P-334-2023 | Fecha Ing.: 14/09/2023 | RUC: 23- 3-0245266-0 | Est. Adm.: Sin archivar | Proc.: Ejecutivo Previsional | Forma Inicio.: Demanda | Estado Proc.: Concluido | Etapa: Terminada | Titulo Ejec.:  | Juez Asignado: CAROLINA ANDREA PRAT ALARCON | Tribunal: 2º Juzgado de Letras de Ovalle
SOC COMERCIAL IMPORTADORA Y EXPORTADORA DICAVE LIMITADA;77990270-6;DDO.;2º Juzgado de Letras de Ovalle;RIT: P-334-2023 | Tribunal: 2º Juzgado de Letras de Ovalle | Caratulado: A.F.P. CAPITAL S.A. CON SOC COMERCIAL IMPORTADORA Y EXP | Fecha Ingreso: 14/09/2023 | Estado Procesal: Concluido | RIT: P-334-2023 | Fecha Ing.: 14/09/2023 | RUC: 23- 3-0245266-0 | Est. Adm.: Sin archivar | Proc.: Ejecutivo Previsional | Forma Inicio.: Demanda | Estado Proc.: Concluido | Etapa: Terminada | Titulo Ejec.:  | Juez Asignado: CAROLINA ANDREA PRAT ALARCON | Tribunal: 2º Juzgado de Letras de Ovalle
Raúl Horacio Troncoso Delpiano;7072258-5;AB.DTE;2º Juzgado de Letras de Ovalle;RIT: P-334-2023 | Tribunal: 2º Juzgado de Letras de Ovalle | Caratulado: A.F.P. CAPITAL S.A. CON SOC COMERCIAL IMPORTADORA Y EXP | Fecha Ingreso: 14/09/2023 | Estado Procesal: Concluido | RIT: P-334-2023 | Fecha Ing.: 14/09/2023 | RUC: 23- 3-0245266-0 | Est. Adm.: Sin archivar | Proc.: Ejecutivo Previsional | Forma Inicio.: Demanda | Estado Proc.: Concluido | Etapa: Terminada | Titulo Ejec.:  | Juez Asignado: CAROLINA ANDREA PRAT ALARCON | Tribunal: 2º Juzgado de Letras de Ovalle
SOCIEDAD ADMINISTRADORA DE FONDOS DE CESANTIA DE CHILE III S.A.;77601648-9;DTE.;2º Juzgado de Letras de Ovalle;RIT: P-332-2023 | Tribunal: 2º Juzgado de Letras de Ovalle | Caratulado: ADM. DE FONDOS DE CESANTIA CHILE III S.A. CON SOCIEDAD | Fecha Ingreso: 12/09/2023 | Estado Procesal: Concluido | RIT: P-332-2023 | Fecha Ing.: 12/09/2023 | RUC: 23- 3-0243212-0 | Est. Adm.: Sin archivar | Proc.: Ejecutivo Previsional | Forma Inicio.: Demanda | Estado Proc.: Concluido | Etapa: Terminada | Titulo Ejec.:  | Juez Asignado: CAROLINA ANDREA PRAT ALARCON | Tribunal: 2º Juzgado de Letras de Ovalle
SOCIEDAD DE SERVICIOS ELECTRICOS LTDA;76340266-5;DDO.;2º Juzgado de Letras de Ovalle;RIT: P-332-2023 | Tribunal: 2º Juzgado de Letras de Ovalle | Caratulado: ADM. DE FONDOS DE CESANTIA CHILE III S.A. CON SOCIEDAD | Fecha Ingreso: 12/09/2023 | Estado Procesal: Concluido | RIT: P-332-2023 | Fecha Ing.: 12/09/2023 | RUC: 23- 3-0243212-0 | Est. Adm.: Sin archivar | Proc.: Ejecutivo Previsional | Forma Inicio.: Demanda | Estado Proc.: Concluido | Etapa: Terminada | Titulo Ejec.:  | Juez Asignado: CAROLINA ANDREA PRAT ALARCON | Tribunal: 2º Juzgado de Letras de Ovalle
Raúl Horacio Troncoso Delpiano;7072258-5;AB.DTE;2º Juzgado de Letras de Ovalle;RIT: P-332-2023 | Tribunal: 2º Juzgado de Letras de Ovalle | Caratulado: ADM. DE FONDOS DE CESANTIA CHILE III S.A. CON SOCIEDAD | Fecha Ingreso: 12/09/2023 | Estado Procesal: Concluido | RIT: P-332-2023 | Fecha Ing.: 12/09/2023 | RUC: 23- 3-0243212-0 | Est. Adm.: Sin archivar | Proc.: Ejecutivo Previsional | Forma Inicio.: Demanda | Estado Proc.: Concluido | Etapa: Terminada | Titulo Ejec.:  | Juez Asignado: CAROLINA ANDREA PRAT ALARCON | Tribunal: 2º Juzgado de Letras de Ovalle
