NOMBRE;DOCUMENTO;CARGO;INSTITUCION;OBSERVACIONES
Administradora de Fondos de Pensiones Planvital;98001200-K;DTE.;Juzgado de Letras y Garantía de Paillaco;RIT: E-13-2024 | Tribunal: Juzgado de Letras y Garantía de Paillaco | Caratulado: A.F.P. PLANVITAL S.A. CON HARDY RODEMIL MOLINA PIZARRO | Fecha Ingreso: 30/07/2024 | Estado Procesal: Concluido | RIT: E-13-2024 | Fecha Ing.: 30/07/2024 | RUC: 16- 3-0283895-3 | Est. Adm.: Archivada | Proc.: Exhorto | Forma Inicio.: Exhorto | Estado Proc.: Concluido | Etapa: Terminada | Titulo Ejec.:  | Juez Asignado: LUCIA ALEJANDRA MASSRI ERGAS | Tribunal: Juzgado de Letras y Garantía de Paillaco
HARDY RODEMIL MOLINA PIZARRO;13160754-7;DDO.;Juzgado de Letras y Garantía de Paillaco;RIT: E-13-2024 | Tribunal: Juzgado de Letras y Garantía de Paillaco | Caratulado: A.F.P. PLANVITAL S.A. CON HARDY RODEMIL MOLINA PIZARRO | Fecha Ingreso: 30/07/2024 | Estado Procesal: Concluido | RIT: E-13-2024 | Fecha Ing.: 30/07/2024 | RUC: 16- 3-0283895-3 | Est. Adm.: Archivada | Proc.: Exhorto | Forma Inicio.: Exhorto | Estado Proc.: Concluido | Etapa: Terminada | Titulo Ejec.:  | Juez Asignado: LUCIA ALEJANDRA MASSRI ERGAS | Tribunal: Juzgado de Letras y Garantía de Paillaco
Antonio Ricardo Alamos Avendano;8270154-0;AB.DTE;Juzgado de Letras y Garantía de Paillaco;RIT: E-13-2024 | Tribunal: Juzgado de Letras y Garantía de Paillaco | Caratulado: A.F.P. PLANVITAL S.A. CON HARDY RODEMIL MOLINA PIZARRO | Fecha Ingreso: 30/07/2024 | Estado Procesal: Concluido | RIT: E-13-2024 | Fecha Ing.: 30/07/2024 | RUC: 16- 3-0283895-3 | Est. Adm.: Archivada | Proc.: Exhorto | Forma Inicio.: Exhorto | Estado Proc.: Concluido | Etapa: Terminada | Titulo Ejec.:  | Juez Asignado: LUCIA ALEJANDRA MASSRI ERGAS | Tribunal: Juzgado de Letras y Garantía de Paillaco
Manuel Jesus Figueroa Saavedra;2415267-7;AB.DTE;Juzgado de Letras y Garantía de Paillaco;RIT: E-13-2024 | Tribunal: Juzgado de Letras y Garantía de Paillaco | Caratulado: A.F.P. PLANVITAL S.A. CON HARDY RODEMIL MOLINA PIZARRO | Fecha Ingreso: 30/07/2024 | Estado Procesal: Concluido | RIT: E-13-2024 | Fecha Ing.: 30/07/2024 | RUC: 16- 3-0283895-3 | Est. Adm.: Archivada | Proc.: Exhorto | Forma Inicio.: Exhorto | Estado Proc.: Concluido | Etapa: Terminada | Titulo Ejec.:  | Juez Asignado: LUCIA ALEJANDRA MASSRI ERGAS | Tribunal: Juzgado de Letras y Garantía de Paillaco
SOCIEDAD ADMINISTRADORA DE FONDOS DE CESANTIA DE CHILE III S.A.;77601648-9;DTE.;Juzgado de Letras y Garantía de Paillaco;RIT: P-33-2024 | Tribunal: Juzgado de Letras y Garantía de Paillaco | Caratulado: ADM. DE FONDOS DE CESANTIA CHILE III S.A. CON TRANSPORT | Fecha Ingreso: 26/07/2024 | Estado Procesal: Concluido | RIT: P-33-2024 | Fecha Ing.: 26/07/2024 | RUC: 24- 3-0210684-K | Est. Adm.: Sin archivar | Proc.: Ejecutivo Previsional | Forma Inicio.: Demanda | Estado Proc.: Concluido | Etapa: Terminada | Titulo Ejec.:  | Juez Asignado: LUCIA ALEJANDRA MASSRI ERGAS | Tribunal: Juzgado de Letras y Garantía de Paillaco
TRANSPORTES HV LTDA.;77066098-K;DDO.;Juzgado de Letras y Garantía de Paillaco;RIT: P-33-2024 | Tribunal: Juzgado de Letras y Garantía de Paillaco | Caratulado: ADM. DE FONDOS DE CESANTIA CHILE III S.A. CON TRANSPORT | Fecha Ingreso: 26/07/2024 | Estado Procesal: Concluido | RIT: P-33-2024 | Fecha Ing.: 26/07/2024 | RUC: 24- 3-0210684-K | Est. Adm.: Sin archivar | Proc.: Ejecutivo Previsional | Forma Inicio.: Demanda | Estado Proc.: Concluido | Etapa: Terminada | Titulo Ejec.:  | Juez Asignado: LUCIA ALEJANDRA MASSRI ERGAS | Tribunal: Juzgado de Letras y Garantía de Paillaco
Antonio Ricardo Alamos Avendaño;8270154-0;AB.DTE;Juzgado de Letras y Garantía de Paillaco;RIT: P-33-2024 | Tribunal: Juzgado de Letras y Garantía de Paillaco | Caratulado: ADM. DE FONDOS DE CESANTIA CHILE III S.A. CON TRANSPORT | Fecha Ingreso: 26/07/2024 | Estado Procesal: Concluido | RIT: P-33-2024 | Fecha Ing.: 26/07/2024 | RUC: 24- 3-0210684-K | Est. Adm.: Sin archivar | Proc.: Ejecutivo Previsional | Forma Inicio.: Demanda | Estado Proc.: Concluido | Etapa: Terminada | Titulo Ejec.:  | Juez Asignado: LUCIA ALEJANDRA MASSRI ERGAS | Tribunal: Juzgado de Letras y Garantía de Paillaco
