NOMBRE;DOCUMENTO;CARGO;INSTITUCION;OBSERVACIONES
SOCIEDAD ADMINISTRADORA DE FONDOS DE CESANTIA DE CHILE II S.A.;76237243-6;DTE.;1º Juzgado de Letras de Quillota;RIT: P-16-2022 | Tribunal: 1º Juzgado de Letras de Quillota | Caratulado: ADM. DE FONDOS DE CESANTIA CHILE II S.A. CON GARAGE SER | Fecha Ingreso: 19/01/2022 | Estado Procesal: Concluido | RIT: P-16-2022 | Fecha Ing.: 19/01/2022 | RUC: 22- 3-0013305-7 | Est. Adm.: Sin archivar | Proc.: Ejecutivo Previsional | Forma Inicio.: Demanda | Estado Proc.: Concluido | Etapa: Terminada | Titulo Ejec.:  | Juez Asignado: MIRIAM DEL CARMEN ARMIJO INDELLICATI | Tribunal: 1º Juzgado de Letras de Quillota
GARAGE SERVICIO INTEGRAL AUTOMOTRIZ LIMITADA;76544094-7;DDO.;1º Juzgado de Letras de Quillota;RIT: P-16-2022 | Tribunal: 1º Juzgado de Letras de Quillota | Caratulado: ADM. DE FONDOS DE CESANTIA CHILE II S.A. CON GARAGE SER | Fecha Ingreso: 19/01/2022 | Estado Procesal: Concluido | RIT: P-16-2022 | Fecha Ing.: 19/01/2022 | RUC: 22- 3-0013305-7 | Est. Adm.: Sin archivar | Proc.: Ejecutivo Previsional | Forma Inicio.: Demanda | Estado Proc.: Concluido | Etapa: Terminada | Titulo Ejec.:  | Juez Asignado: MIRIAM DEL CARMEN ARMIJO INDELLICATI | Tribunal: 1º Juzgado de Letras de Quillota
Raúl Horacio Troncoso Delpiano;7072258-5;AB.DTE;1º Juzgado de Letras de Quillota;RIT: P-16-2022 | Tribunal: 1º Juzgado de Letras de Quillota | Caratulado: ADM. DE FONDOS DE CESANTIA CHILE II S.A. CON GARAGE SER | Fecha Ingreso: 19/01/2022 | Estado Procesal: Concluido | RIT: P-16-2022 | Fecha Ing.: 19/01/2022 | RUC: 22- 3-0013305-7 | Est. Adm.: Sin archivar | Proc.: Ejecutivo Previsional | Forma Inicio.: Demanda | Estado Proc.: Concluido | Etapa: Terminada | Titulo Ejec.:  | Juez Asignado: MIRIAM DEL CARMEN ARMIJO INDELLICATI | Tribunal: 1º Juzgado de Letras de Quillota
Administradora de Fondos de Pensiones Provida;76265736-8;DTE.;1º Juzgado de Letras de Quillota;RIT: E-6-2022 | Tribunal: 1º Juzgado de Letras de Quillota | Caratulado: A.F.P. PROVIDA S.A. CON ALICIA BOZZOLO LEJEUNE | Fecha Ingreso: 17/01/2022 | Estado Procesal: Concluido | RIT: E-6-2022 | Fecha Ing.: 17/01/2022 | RUC: 21- 3-0120621-3 | Est. Adm.: Archivada | Proc.: Exhorto | Forma Inicio.: Exhorto | Estado Proc.: Concluido | Etapa: Terminada | Titulo Ejec.:  | Juez Asignado: MIRIAM DEL CARMEN ARMIJO INDELLICATI | Tribunal: 1º Juzgado de Letras de Quillota
ALICIA BOZZOLO LEJEUNE;1560961-3;DDO.;1º Juzgado de Letras de Quillota;RIT: E-6-2022 | Tribunal: 1º Juzgado de Letras de Quillota | Caratulado: A.F.P. PROVIDA S.A. CON ALICIA BOZZOLO LEJEUNE | Fecha Ingreso: 17/01/2022 | Estado Procesal: Concluido | RIT: E-6-2022 | Fecha Ing.: 17/01/2022 | RUC: 21- 3-0120621-3 | Est. Adm.: Archivada | Proc.: Exhorto | Forma Inicio.: Exhorto | Estado Proc.: Concluido | Etapa: Terminada | Titulo Ejec.:  | Juez Asignado: MIRIAM DEL CARMEN ARMIJO INDELLICATI | Tribunal: 1º Juzgado de Letras de Quillota
PATRICIO ELGUETA ADROVEZ;5402197-6;AB.DTE;1º Juzgado de Letras de Quillota;RIT: E-6-2022 | Tribunal: 1º Juzgado de Letras de Quillota | Caratulado: A.F.P. PROVIDA S.A. CON ALICIA BOZZOLO LEJEUNE | Fecha Ingreso: 17/01/2022 | Estado Procesal: Concluido | RIT: E-6-2022 | Fecha Ing.: 17/01/2022 | RUC: 21- 3-0120621-3 | Est. Adm.: Archivada | Proc.: Exhorto | Forma Inicio.: Exhorto | Estado Proc.: Concluido | Etapa: Terminada | Titulo Ejec.:  | Juez Asignado: MIRIAM DEL CARMEN ARMIJO INDELLICATI | Tribunal: 1º Juzgado de Letras de Quillota
