NOMBRE;DOCUMENTO;CARGO;INSTITUCION;OBSERVACIONES
Administradora de Fondos de Pensiones Provida;76265736-8;DTE.;Juzgado de Letras de CasaBlanca;RIT: P-767-2023 | Tribunal: Juzgado de Letras de CasaBlanca | Caratulado: A.F.P. PROVIDA S.A. CON NELLY CASTRO MONTOYA | Fecha Ingreso: 19/10/2023 | Estado Procesal: Concluido | RIT: P-767-2023 | Fecha Ing.: 19/10/2023 | RUC: 23- 3-0282841-5 | Est. Adm.: Archivada | Proc.: Ejecutivo Previsional | Forma Inicio.: Demanda | Estado Proc.: Concluido | Etapa: Terminada | Titulo Ejec.:  | Juez Asignado: ALEXANDRA SOFIA YAÑEZ JARA | Tribunal: Juzgado de Letras de CasaBlanca
NELLY CASTRO MONTOYA;10385943-3;DDO.;Juzgado de Letras de CasaBlanca;RIT: P-767-2023 | Tribunal: Juzgado de Letras de CasaBlanca | Caratulado: A.F.P. PROVIDA S.A. CON NELLY CASTRO MONTOYA | Fecha Ingreso: 19/10/2023 | Estado Procesal: Concluido | RIT: P-767-2023 | Fecha Ing.: 19/10/2023 | RUC: 23- 3-0282841-5 | Est. Adm.: Archivada | Proc.: Ejecutivo Previsional | Forma Inicio.: Demanda | Estado Proc.: Concluido | Etapa: Terminada | Titulo Ejec.:  | Juez Asignado: ALEXANDRA SOFIA YAÑEZ JARA | Tribunal: Juzgado de Letras de CasaBlanca
Francisco Tocornal Fuenzalida;8352676-9;AB.DTE;Juzgado de Letras de CasaBlanca;RIT: P-767-2023 | Tribunal: Juzgado de Letras de CasaBlanca | Caratulado: A.F.P. PROVIDA S.A. CON NELLY CASTRO MONTOYA | Fecha Ingreso: 19/10/2023 | Estado Procesal: Concluido | RIT: P-767-2023 | Fecha Ing.: 19/10/2023 | RUC: 23- 3-0282841-5 | Est. Adm.: Archivada | Proc.: Ejecutivo Previsional | Forma Inicio.: Demanda | Estado Proc.: Concluido | Etapa: Terminada | Titulo Ejec.:  | Juez Asignado: ALEXANDRA SOFIA YAÑEZ JARA | Tribunal: Juzgado de Letras de CasaBlanca
SOCIEDAD ADMINISTRADORA DE FONDOS DE CESANTIA DE CHILE III S.A.;77601648-9;DTE.;Juzgado de Letras de CasaBlanca;RIT: P-754-2023 | Tribunal: Juzgado de Letras de CasaBlanca | Caratulado: ADM. DE FONDOS DE CESANTIA CHILE III S.A. CON MEDIAPRIN | Fecha Ingreso: 13/10/2023 | Estado Procesal: Tramitación | RIT: P-754-2023 | Fecha Ing.: 13/10/2023 | RUC: 23- 3-0276692-4 | Est. Adm.: Sin archivar | Proc.: Ejecutivo Previsional | Forma Inicio.: Demanda | Estado Proc.: Tramitación | Etapa: Ingreso | Titulo Ejec.:  | Juez Asignado: ALEXANDRA SOFIA YAÑEZ JARA | Tribunal: Juzgado de Letras de CasaBlanca
MEDIAPRINT SPA;76765351-4;DDO.;Juzgado de Letras de CasaBlanca;RIT: P-754-2023 | Tribunal: Juzgado de Letras de CasaBlanca | Caratulado: ADM. DE FONDOS DE CESANTIA CHILE III S.A. CON MEDIAPRIN | Fecha Ingreso: 13/10/2023 | Estado Procesal: Tramitación | RIT: P-754-2023 | Fecha Ing.: 13/10/2023 | RUC: 23- 3-0276692-4 | Est. Adm.: Sin archivar | Proc.: Ejecutivo Previsional | Forma Inicio.: Demanda | Estado Proc.: Tramitación | Etapa: Ingreso | Titulo Ejec.:  | Juez Asignado: ALEXANDRA SOFIA YAÑEZ JARA | Tribunal: Juzgado de Letras de CasaBlanca
Roberto Gastón Romero Fuentes;9268850-K;AB.DTE;Juzgado de Letras de CasaBlanca;RIT: P-754-2023 | Tribunal: Juzgado de Letras de CasaBlanca | Caratulado: ADM. DE FONDOS DE CESANTIA CHILE III S.A. CON MEDIAPRIN | Fecha Ingreso: 13/10/2023 | Estado Procesal: Tramitación | RIT: P-754-2023 | Fecha Ing.: 13/10/2023 | RUC: 23- 3-0276692-4 | Est. Adm.: Sin archivar | Proc.: Ejecutivo Previsional | Forma Inicio.: Demanda | Estado Proc.: Tramitación | Etapa: Ingreso | Titulo Ejec.:  | Juez Asignado: ALEXANDRA SOFIA YAÑEZ JARA | Tribunal: Juzgado de Letras de CasaBlanca
