NOMBRE;DOCUMENTO;CARGO;INSTITUCION;OBSERVACIONES
Administradora de Fondos de Pensiones Capital;98000000-1;DTE.;2º Juzgado de Letras de Ovalle;RIT: D-152-2023 | Tribunal: 2º Juzgado de Letras de Ovalle | Caratulado: A.F.P. CAPITAL S.A. CON INMOBILIARIA RENACER LIMITADA | Fecha Ingreso: 31/08/2023 | Estado Procesal: Concluido | RIT: D-152-2023 | Fecha Ing.: 31/08/2023 | RUC: 23- 3-0232457-3 | Est. Adm.: Sin archivar | Proc.: Ejecutivo DNPA | Forma Inicio.: Demanda | Estado Proc.: Concluido | Etapa: Terminada | Titulo Ejec.:  | Juez Asignado: CAROLINA ANDREA PRAT ALARCON | Tribunal: 2º Juzgado de Letras de Ovalle
INMOBILIARIA RENACER LIMITADA;76311650-6;DDO.;2º Juzgado de Letras de Ovalle;RIT: D-152-2023 | Tribunal: 2º Juzgado de Letras de Ovalle | Caratulado: A.F.P. CAPITAL S.A. CON INMOBILIARIA RENACER LIMITADA | Fecha Ingreso: 31/08/2023 | Estado Procesal: Concluido | RIT: D-152-2023 | Fecha Ing.: 31/08/2023 | RUC: 23- 3-0232457-3 | Est. Adm.: Sin archivar | Proc.: Ejecutivo DNPA | Forma Inicio.: Demanda | Estado Proc.: Concluido | Etapa: Terminada | Titulo Ejec.:  | Juez Asignado: CAROLINA ANDREA PRAT ALARCON | Tribunal: 2º Juzgado de Letras de Ovalle
Antonio Ricardo Alamos Avendaño;8270154-0;AB.DTE;2º Juzgado de Letras de Ovalle;RIT: D-152-2023 | Tribunal: 2º Juzgado de Letras de Ovalle | Caratulado: A.F.P. CAPITAL S.A. CON INMOBILIARIA RENACER LIMITADA | Fecha Ingreso: 31/08/2023 | Estado Procesal: Concluido | RIT: D-152-2023 | Fecha Ing.: 31/08/2023 | RUC: 23- 3-0232457-3 | Est. Adm.: Sin archivar | Proc.: Ejecutivo DNPA | Forma Inicio.: Demanda | Estado Proc.: Concluido | Etapa: Terminada | Titulo Ejec.:  | Juez Asignado: CAROLINA ANDREA PRAT ALARCON | Tribunal: 2º Juzgado de Letras de Ovalle
Manuel Jesús Figueroa Saavedra;2415267-7;AB.DTE;2º Juzgado de Letras de Ovalle;RIT: D-152-2023 | Tribunal: 2º Juzgado de Letras de Ovalle | Caratulado: A.F.P. CAPITAL S.A. CON INMOBILIARIA RENACER LIMITADA | Fecha Ingreso: 31/08/2023 | Estado Procesal: Concluido | RIT: D-152-2023 | Fecha Ing.: 31/08/2023 | RUC: 23- 3-0232457-3 | Est. Adm.: Sin archivar | Proc.: Ejecutivo DNPA | Forma Inicio.: Demanda | Estado Proc.: Concluido | Etapa: Terminada | Titulo Ejec.:  | Juez Asignado: CAROLINA ANDREA PRAT ALARCON | Tribunal: 2º Juzgado de Letras de Ovalle
SOCIEDAD ADMINISTRADORA DE FONDOS DE CESANTIA DE CHILE III S.A.;77601648-9;DTE.;2º Juzgado de Letras de Ovalle;RIT: P-313-2023 | Tribunal: 2º Juzgado de Letras de Ovalle | Caratulado: ADM. DE FONDOS DE CESANTIA CHILE III S.A. CON SOCIEDAD | Fecha Ingreso: 28/08/2023 | Estado Procesal: Concluido | RIT: P-313-2023 | Fecha Ing.: 28/08/2023 | RUC: 23- 3-0226365-5 | Est. Adm.: Sin archivar | Proc.: Ejecutivo Previsional | Forma Inicio.: Demanda | Estado Proc.: Concluido | Etapa: Terminada | Titulo Ejec.:  | Juez Asignado: CAROLINA ANDREA PRAT ALARCON | Tribunal: 2º Juzgado de Letras de Ovalle
SOCIEDAD AGRICOLA EL RECREO LTDA.;89946900-3;DDO.;2º Juzgado de Letras de Ovalle;RIT: P-313-2023 | Tribunal: 2º Juzgado de Letras de Ovalle | Caratulado: ADM. DE FONDOS DE CESANTIA CHILE III S.A. CON SOCIEDAD | Fecha Ingreso: 28/08/2023 | Estado Procesal: Concluido | RIT: P-313-2023 | Fecha Ing.: 28/08/2023 | RUC: 23- 3-0226365-5 | Est. Adm.: Sin archivar | Proc.: Ejecutivo Previsional | Forma Inicio.: Demanda | Estado Proc.: Concluido | Etapa: Terminada | Titulo Ejec.:  | Juez Asignado: CAROLINA ANDREA PRAT ALARCON | Tribunal: 2º Juzgado de Letras de Ovalle
Raúl Horacio Troncoso Delpiano;7072258-5;AB.DTE;2º Juzgado de Letras de Ovalle;RIT: P-313-2023 | Tribunal: 2º Juzgado de Letras de Ovalle | Caratulado: ADM. DE FONDOS DE CESANTIA CHILE III S.A. CON SOCIEDAD | Fecha Ingreso: 28/08/2023 | Estado Procesal: Concluido | RIT: P-313-2023 | Fecha Ing.: 28/08/2023 | RUC: 23- 3-0226365-5 | Est. Adm.: Sin archivar | Proc.: Ejecutivo Previsional | Forma Inicio.: Demanda | Estado Proc.: Concluido | Etapa: Terminada | Titulo Ejec.:  | Juez Asignado: CAROLINA ANDREA PRAT ALARCON | Tribunal: 2º Juzgado de Letras de Ovalle
