NOMBRE;DOCUMENTO;CARGO;INSTITUCION;OBSERVACIONES
A.F.P. PLANVITAL S.A.;98001200-K;DTE.;2º Juzgado de Letras de Vallenar;RIT: P-164-2023 | Tribunal: 2º Juzgado de Letras de Vallenar | Caratulado: A.F.P. PLANVITAL S.A./SERGIO M. OLIVARES VARAS E HIJO C | Fecha Ingreso: 15/06/2023 | Estado Procesal: Acumulada | RIT: P-164-2023 | Fecha Ing.: 15/06/2023 | RUC: 23- 3-0156092-3 | Est. Adm.: Archivada | Proc.: Ejecutivo Previsional | Forma Inicio.: Demanda | Estado Proc.: Acumulada | Etapa: Terminada | Titulo Ejec.:  | Juez Asignado: KERIMA SCHICHASCHWILI CARVAJAL | Tribunal: 2º Juzgado de Letras de Vallenar
MANUEL JESÚS FIGUEROA SAAVEDRA;2415267-7;AB.DTE;2º Juzgado de Letras de Vallenar;RIT: P-164-2023 | Tribunal: 2º Juzgado de Letras de Vallenar | Caratulado: A.F.P. PLANVITAL S.A./SERGIO M. OLIVARES VARAS E HIJO C | Fecha Ingreso: 15/06/2023 | Estado Procesal: Acumulada | RIT: P-164-2023 | Fecha Ing.: 15/06/2023 | RUC: 23- 3-0156092-3 | Est. Adm.: Archivada | Proc.: Ejecutivo Previsional | Forma Inicio.: Demanda | Estado Proc.: Acumulada | Etapa: Terminada | Titulo Ejec.:  | Juez Asignado: KERIMA SCHICHASCHWILI CARVAJAL | Tribunal: 2º Juzgado de Letras de Vallenar
ANTONIO RICARDO ÁLAMOS AVENDAÑO;8270154-0;AB.DTE;2º Juzgado de Letras de Vallenar;RIT: P-164-2023 | Tribunal: 2º Juzgado de Letras de Vallenar | Caratulado: A.F.P. PLANVITAL S.A./SERGIO M. OLIVARES VARAS E HIJO C | Fecha Ingreso: 15/06/2023 | Estado Procesal: Acumulada | RIT: P-164-2023 | Fecha Ing.: 15/06/2023 | RUC: 23- 3-0156092-3 | Est. Adm.: Archivada | Proc.: Ejecutivo Previsional | Forma Inicio.: Demanda | Estado Proc.: Acumulada | Etapa: Terminada | Titulo Ejec.:  | Juez Asignado: KERIMA SCHICHASCHWILI CARVAJAL | Tribunal: 2º Juzgado de Letras de Vallenar
SERGIO M. OLIVARES VARAS E HIJO CIA LTDA.;77292460-7;DDO.;2º Juzgado de Letras de Vallenar;RIT: P-164-2023 | Tribunal: 2º Juzgado de Letras de Vallenar | Caratulado: A.F.P. PLANVITAL S.A./SERGIO M. OLIVARES VARAS E HIJO C | Fecha Ingreso: 15/06/2023 | Estado Procesal: Acumulada | RIT: P-164-2023 | Fecha Ing.: 15/06/2023 | RUC: 23- 3-0156092-3 | Est. Adm.: Archivada | Proc.: Ejecutivo Previsional | Forma Inicio.: Demanda | Estado Proc.: Acumulada | Etapa: Terminada | Titulo Ejec.:  | Juez Asignado: KERIMA SCHICHASCHWILI CARVAJAL | Tribunal: 2º Juzgado de Letras de Vallenar
ISAPRE CONSALUD S.A.;96856780-2;DTE.;2º Juzgado de Letras de Vallenar;RIT: P-159-2023 | Tribunal: 2º Juzgado de Letras de Vallenar | Caratulado: ISAPRE CONSALUD S.A./AGRO-VALLENAR SPA | Fecha Ingreso: 14/06/2023 | Estado Procesal: Concluido | RIT: P-159-2023 | Fecha Ing.: 14/06/2023 | RUC: 23- 3-0153304-7 | Est. Adm.: Sin archivar | Proc.: Ejecutivo Previsional | Forma Inicio.: Demanda | Estado Proc.: Concluido | Etapa: Terminada | Titulo Ejec.:  | Juez Asignado: KERIMA SCHICHASCHWILI CARVAJAL | Tribunal: 2º Juzgado de Letras de Vallenar
ÁLVARO ANDRÉS MOLINA LEIVA;13671419-8;AB.DTE;2º Juzgado de Letras de Vallenar;RIT: P-159-2023 | Tribunal: 2º Juzgado de Letras de Vallenar | Caratulado: ISAPRE CONSALUD S.A./AGRO-VALLENAR SPA | Fecha Ingreso: 14/06/2023 | Estado Procesal: Concluido | RIT: P-159-2023 | Fecha Ing.: 14/06/2023 | RUC: 23- 3-0153304-7 | Est. Adm.: Sin archivar | Proc.: Ejecutivo Previsional | Forma Inicio.: Demanda | Estado Proc.: Concluido | Etapa: Terminada | Titulo Ejec.:  | Juez Asignado: KERIMA SCHICHASCHWILI CARVAJAL | Tribunal: 2º Juzgado de Letras de Vallenar
AGRO-VALLENAR SPA;76502418-8;DDO.;2º Juzgado de Letras de Vallenar;RIT: P-159-2023 | Tribunal: 2º Juzgado de Letras de Vallenar | Caratulado: ISAPRE CONSALUD S.A./AGRO-VALLENAR SPA | Fecha Ingreso: 14/06/2023 | Estado Procesal: Concluido | RIT: P-159-2023 | Fecha Ing.: 14/06/2023 | RUC: 23- 3-0153304-7 | Est. Adm.: Sin archivar | Proc.: Ejecutivo Previsional | Forma Inicio.: Demanda | Estado Proc.: Concluido | Etapa: Terminada | Titulo Ejec.:  | Juez Asignado: KERIMA SCHICHASCHWILI CARVAJAL | Tribunal: 2º Juzgado de Letras de Vallenar
