NOMBRE;DOCUMENTO;CARGO;INSTITUCION;OBSERVACIONES
Administradora de Fondos de Pensiones Provida;76265736-8;DTE.;Jdo. de Letras y Garantía de Peumo;RIT: P-122-2021 | Tribunal: Jdo. de Letras y Garantía de Peumo | Caratulado: A.F.P. PROVIDA S.A. CON ARIDOS H Y F SPA | Fecha Ingreso: 19/08/2021 | Estado Procesal: Concluido | RIT: P-122-2021 | Fecha Ing.: 19/08/2021 | RUC: 21- 3-0181354-3 | Est. Adm.: Archivada | Proc.: Ejecutivo Previsional | Forma Inicio.: Demanda | Estado Proc.: Concluido | Etapa: Terminada | Titulo Ejec.:  | Juez Asignado: DANIEL ALEJANDRO HIDALGO LEIVA | Tribunal: Jdo. de Letras y Garantía de Peumo
ARIDOS H Y F SPA;76896641-9;DDO.;Jdo. de Letras y Garantía de Peumo;RIT: P-122-2021 | Tribunal: Jdo. de Letras y Garantía de Peumo | Caratulado: A.F.P. PROVIDA S.A. CON ARIDOS H Y F SPA | Fecha Ingreso: 19/08/2021 | Estado Procesal: Concluido | RIT: P-122-2021 | Fecha Ing.: 19/08/2021 | RUC: 21- 3-0181354-3 | Est. Adm.: Archivada | Proc.: Ejecutivo Previsional | Forma Inicio.: Demanda | Estado Proc.: Concluido | Etapa: Terminada | Titulo Ejec.:  | Juez Asignado: DANIEL ALEJANDRO HIDALGO LEIVA | Tribunal: Jdo. de Letras y Garantía de Peumo
PATRICIO ELGUETA ADROVEZ;5402197-6;AB.DTE;Jdo. de Letras y Garantía de Peumo;RIT: P-122-2021 | Tribunal: Jdo. de Letras y Garantía de Peumo | Caratulado: A.F.P. PROVIDA S.A. CON ARIDOS H Y F SPA | Fecha Ingreso: 19/08/2021 | Estado Procesal: Concluido | RIT: P-122-2021 | Fecha Ing.: 19/08/2021 | RUC: 21- 3-0181354-3 | Est. Adm.: Archivada | Proc.: Ejecutivo Previsional | Forma Inicio.: Demanda | Estado Proc.: Concluido | Etapa: Terminada | Titulo Ejec.:  | Juez Asignado: DANIEL ALEJANDRO HIDALGO LEIVA | Tribunal: Jdo. de Letras y Garantía de Peumo
A.F.P UNO S.A;76960424-3;DTE.;Jdo. de Letras y Garantía de Peumo;RIT: P-119-2021 | Tribunal: Jdo. de Letras y Garantía de Peumo | Caratulado: A.F.P UNO S.A/ARIEL ARRIAZA ASESORIAS AGRICOLAS E.I.R.L | Fecha Ingreso: 13/08/2021 | Estado Procesal: Tramitación | RIT: P-119-2021 | Fecha Ing.: 13/08/2021 | RUC: 21- 3-0176991-9 | Est. Adm.: Sin archivar | Proc.: Ejecutivo Previsional | Forma Inicio.: Demanda | Estado Proc.: Tramitación | Etapa: Ingreso | Titulo Ejec.:  | Juez Asignado: RAUL MATIAS CASTRO VALDERRAMA | Tribunal: Jdo. de Letras y Garantía de Peumo
MANUEL JESÚS FIGUEROA SAAVEDRA;2415267-7;AB.DTE;Jdo. de Letras y Garantía de Peumo;RIT: P-119-2021 | Tribunal: Jdo. de Letras y Garantía de Peumo | Caratulado: A.F.P UNO S.A/ARIEL ARRIAZA ASESORIAS AGRICOLAS E.I.R.L | Fecha Ingreso: 13/08/2021 | Estado Procesal: Tramitación | RIT: P-119-2021 | Fecha Ing.: 13/08/2021 | RUC: 21- 3-0176991-9 | Est. Adm.: Sin archivar | Proc.: Ejecutivo Previsional | Forma Inicio.: Demanda | Estado Proc.: Tramitación | Etapa: Ingreso | Titulo Ejec.:  | Juez Asignado: RAUL MATIAS CASTRO VALDERRAMA | Tribunal: Jdo. de Letras y Garantía de Peumo
ANTONIO RICARDO ÁLAMOS AVENDAÑO;8270154-0;AB.DTE;Jdo. de Letras y Garantía de Peumo;RIT: P-119-2021 | Tribunal: Jdo. de Letras y Garantía de Peumo | Caratulado: A.F.P UNO S.A/ARIEL ARRIAZA ASESORIAS AGRICOLAS E.I.R.L | Fecha Ingreso: 13/08/2021 | Estado Procesal: Tramitación | RIT: P-119-2021 | Fecha Ing.: 13/08/2021 | RUC: 21- 3-0176991-9 | Est. Adm.: Sin archivar | Proc.: Ejecutivo Previsional | Forma Inicio.: Demanda | Estado Proc.: Tramitación | Etapa: Ingreso | Titulo Ejec.:  | Juez Asignado: RAUL MATIAS CASTRO VALDERRAMA | Tribunal: Jdo. de Letras y Garantía de Peumo
ARIEL ARRIAZA ASESORIAS AGRICOLAS E.I.R.L.;76864245-1;DDO.;Jdo. de Letras y Garantía de Peumo;RIT: P-119-2021 | Tribunal: Jdo. de Letras y Garantía de Peumo | Caratulado: A.F.P UNO S.A/ARIEL ARRIAZA ASESORIAS AGRICOLAS E.I.R.L | Fecha Ingreso: 13/08/2021 | Estado Procesal: Tramitación | RIT: P-119-2021 | Fecha Ing.: 13/08/2021 | RUC: 21- 3-0176991-9 | Est. Adm.: Sin archivar | Proc.: Ejecutivo Previsional | Forma Inicio.: Demanda | Estado Proc.: Tramitación | Etapa: Ingreso | Titulo Ejec.:  | Juez Asignado: RAUL MATIAS CASTRO VALDERRAMA | Tribunal: Jdo. de Letras y Garantía de Peumo
