NOMBRE;DOCUMENTO;CARGO;INSTITUCION;OBSERVACIONES
A.F.P UNO S.A;76960424-3;DTE.;Juzgado de Letras de Parral;RIT: P-26-2022 | Tribunal: Juzgado de Letras de Parral | Caratulado: A.F.P UNO S.A/SOCIEDAD AGRÍCOLA MILLAHUE LTDA. | Fecha Ingreso: 28/02/2022 | Estado Procesal: Concluido | RIT: P-26-2022 | Fecha Ing.: 28/02/2022 | RUC: 22- 3-0042688-7 | Est. Adm.: Archivada | Proc.: Ejecutivo Previsional | Forma Inicio.: Demanda | Estado Proc.: Concluido | Etapa: Terminada | Titulo Ejec.:  | Juez Asignado: MICHEL ANTONELLO FRANCESCO GALASSO CABROLIER | Tribunal: Juzgado de Letras de Parral
FRANCISCO JOSÉ TOCORNAL FUENZALIDA;8352676-9;AB.DTE;Juzgado de Letras de Parral;RIT: P-26-2022 | Tribunal: Juzgado de Letras de Parral | Caratulado: A.F.P UNO S.A/SOCIEDAD AGRÍCOLA MILLAHUE LTDA. | Fecha Ingreso: 28/02/2022 | Estado Procesal: Concluido | RIT: P-26-2022 | Fecha Ing.: 28/02/2022 | RUC: 22- 3-0042688-7 | Est. Adm.: Archivada | Proc.: Ejecutivo Previsional | Forma Inicio.: Demanda | Estado Proc.: Concluido | Etapa: Terminada | Titulo Ejec.:  | Juez Asignado: MICHEL ANTONELLO FRANCESCO GALASSO CABROLIER | Tribunal: Juzgado de Letras de Parral
SOCIEDAD AGRÍCOLA MILLAHUE LTDA.;78030080-9;DDO.;Juzgado de Letras de Parral;RIT: P-26-2022 | Tribunal: Juzgado de Letras de Parral | Caratulado: A.F.P UNO S.A/SOCIEDAD AGRÍCOLA MILLAHUE LTDA. | Fecha Ingreso: 28/02/2022 | Estado Procesal: Concluido | RIT: P-26-2022 | Fecha Ing.: 28/02/2022 | RUC: 22- 3-0042688-7 | Est. Adm.: Archivada | Proc.: Ejecutivo Previsional | Forma Inicio.: Demanda | Estado Proc.: Concluido | Etapa: Terminada | Titulo Ejec.:  | Juez Asignado: MICHEL ANTONELLO FRANCESCO GALASSO CABROLIER | Tribunal: Juzgado de Letras de Parral
Administradora de Fondos de Pensiones Cuprum S.A.;76240079-0;DTE.;Juzgado de Letras de Parral;RIT: P-25-2022 | Tribunal: Juzgado de Letras de Parral | Caratulado: A.F.P. CUPRUM S.A. CON AGRICOLA CAMILO CORREA COX E I R | Fecha Ingreso: 25/02/2022 | Estado Procesal: Concluido | RIT: P-25-2022 | Fecha Ing.: 25/02/2022 | RUC: 22- 3-0040837-4 | Est. Adm.: Archivada | Proc.: Ejecutivo Previsional | Forma Inicio.: Demanda | Estado Proc.: Concluido | Etapa: Terminada | Titulo Ejec.:  | Juez Asignado: PABLO DIONISIO RAMOS ABARZUA | Tribunal: Juzgado de Letras de Parral
AGRICOLA CAMILO CORREA COX E I R L;76218589-K;DDO.;Juzgado de Letras de Parral;RIT: P-25-2022 | Tribunal: Juzgado de Letras de Parral | Caratulado: A.F.P. CUPRUM S.A. CON AGRICOLA CAMILO CORREA COX E I R | Fecha Ingreso: 25/02/2022 | Estado Procesal: Concluido | RIT: P-25-2022 | Fecha Ing.: 25/02/2022 | RUC: 22- 3-0040837-4 | Est. Adm.: Archivada | Proc.: Ejecutivo Previsional | Forma Inicio.: Demanda | Estado Proc.: Concluido | Etapa: Terminada | Titulo Ejec.:  | Juez Asignado: PABLO DIONISIO RAMOS ABARZUA | Tribunal: Juzgado de Letras de Parral
Francisco Tocornal Fuenzalida;8352676-9;AB.DTE;Juzgado de Letras de Parral;RIT: P-25-2022 | Tribunal: Juzgado de Letras de Parral | Caratulado: A.F.P. CUPRUM S.A. CON AGRICOLA CAMILO CORREA COX E I R | Fecha Ingreso: 25/02/2022 | Estado Procesal: Concluido | RIT: P-25-2022 | Fecha Ing.: 25/02/2022 | RUC: 22- 3-0040837-4 | Est. Adm.: Archivada | Proc.: Ejecutivo Previsional | Forma Inicio.: Demanda | Estado Proc.: Concluido | Etapa: Terminada | Titulo Ejec.:  | Juez Asignado: PABLO DIONISIO RAMOS ABARZUA | Tribunal: Juzgado de Letras de Parral
