NOMBRE;DOCUMENTO;CARGO;INSTITUCION;OBSERVACIONES
Administradora de Fondos de Pensiones Habitat;98000100-8;DTE.;Juzgado de Letras de Parral;RIT: P-84-2022 | Tribunal: Juzgado de Letras de Parral | Caratulado: A.F.P. HABITAT S.A. CON AGRICOLA CAMILO CORREA COX E I | Fecha Ingreso: 24/08/2022 | Estado Procesal: Concluido | RIT: P-84-2022 | Fecha Ing.: 24/08/2022 | RUC: 22- 3-0172161-0 | Est. Adm.: Archivada | Proc.: Ejecutivo Previsional | Forma Inicio.: Demanda | Estado Proc.: Concluido | Etapa: Terminada | Titulo Ejec.:  | Juez Asignado: PABLO DIONISIO RAMOS ABARZUA | Tribunal: Juzgado de Letras de Parral
AGRICOLA CAMILO CORREA COX E I R L;76218589-K;DDO.;Juzgado de Letras de Parral;RIT: P-84-2022 | Tribunal: Juzgado de Letras de Parral | Caratulado: A.F.P. HABITAT S.A. CON AGRICOLA CAMILO CORREA COX E I | Fecha Ingreso: 24/08/2022 | Estado Procesal: Concluido | RIT: P-84-2022 | Fecha Ing.: 24/08/2022 | RUC: 22- 3-0172161-0 | Est. Adm.: Archivada | Proc.: Ejecutivo Previsional | Forma Inicio.: Demanda | Estado Proc.: Concluido | Etapa: Terminada | Titulo Ejec.:  | Juez Asignado: PABLO DIONISIO RAMOS ABARZUA | Tribunal: Juzgado de Letras de Parral
Patricio Elgueta Adrovez;5402197-6;AB.DTE;Juzgado de Letras de Parral;RIT: P-84-2022 | Tribunal: Juzgado de Letras de Parral | Caratulado: A.F.P. HABITAT S.A. CON AGRICOLA CAMILO CORREA COX E I | Fecha Ingreso: 24/08/2022 | Estado Procesal: Concluido | RIT: P-84-2022 | Fecha Ing.: 24/08/2022 | RUC: 22- 3-0172161-0 | Est. Adm.: Archivada | Proc.: Ejecutivo Previsional | Forma Inicio.: Demanda | Estado Proc.: Concluido | Etapa: Terminada | Titulo Ejec.:  | Juez Asignado: PABLO DIONISIO RAMOS ABARZUA | Tribunal: Juzgado de Letras de Parral
SOCIEDAD ADMINISTRADORA DE FONDOS DE CESANTIA DE CHILE II S.A.;76237243-6;DTE.;Juzgado de Letras de Parral;RIT: P-85-2022 | Tribunal: Juzgado de Letras de Parral | Caratulado: ADM. DE FONDOS DE CESANTIA CHILE II S.A. CON SOCIEDAD A | Fecha Ingreso: 24/08/2022 | Estado Procesal: Acumulada | RIT: P-85-2022 | Fecha Ing.: 24/08/2022 | RUC: 22- 3-0172447-4 | Est. Adm.: Archivada | Proc.: Ejecutivo Previsional | Forma Inicio.: Demanda | Estado Proc.: Acumulada | Etapa: Terminada | Titulo Ejec.:  | Juez Asignado: PABLO DIONISIO RAMOS ABARZUA | Tribunal: Juzgado de Letras de Parral
SOCIEDAD AGRICOLA Y GANADERA STA CRISTINA LTDA;78867570-4;DDO.;Juzgado de Letras de Parral;RIT: P-85-2022 | Tribunal: Juzgado de Letras de Parral | Caratulado: ADM. DE FONDOS DE CESANTIA CHILE II S.A. CON SOCIEDAD A | Fecha Ingreso: 24/08/2022 | Estado Procesal: Acumulada | RIT: P-85-2022 | Fecha Ing.: 24/08/2022 | RUC: 22- 3-0172447-4 | Est. Adm.: Archivada | Proc.: Ejecutivo Previsional | Forma Inicio.: Demanda | Estado Proc.: Acumulada | Etapa: Terminada | Titulo Ejec.:  | Juez Asignado: PABLO DIONISIO RAMOS ABARZUA | Tribunal: Juzgado de Letras de Parral
Manuel Jesús Figueroa Saavedra;2415267-7;AB.DTE;Juzgado de Letras de Parral;RIT: P-85-2022 | Tribunal: Juzgado de Letras de Parral | Caratulado: ADM. DE FONDOS DE CESANTIA CHILE II S.A. CON SOCIEDAD A | Fecha Ingreso: 24/08/2022 | Estado Procesal: Acumulada | RIT: P-85-2022 | Fecha Ing.: 24/08/2022 | RUC: 22- 3-0172447-4 | Est. Adm.: Archivada | Proc.: Ejecutivo Previsional | Forma Inicio.: Demanda | Estado Proc.: Acumulada | Etapa: Terminada | Titulo Ejec.:  | Juez Asignado: PABLO DIONISIO RAMOS ABARZUA | Tribunal: Juzgado de Letras de Parral
Antonio Ricardo Alamos Avendaño;8270154-0;AB.DTE;Juzgado de Letras de Parral;RIT: P-85-2022 | Tribunal: Juzgado de Letras de Parral | Caratulado: ADM. DE FONDOS DE CESANTIA CHILE II S.A. CON SOCIEDAD A | Fecha Ingreso: 24/08/2022 | Estado Procesal: Acumulada | RIT: P-85-2022 | Fecha Ing.: 24/08/2022 | RUC: 22- 3-0172447-4 | Est. Adm.: Archivada | Proc.: Ejecutivo Previsional | Forma Inicio.: Demanda | Estado Proc.: Acumulada | Etapa: Terminada | Titulo Ejec.:  | Juez Asignado: PABLO DIONISIO RAMOS ABARZUA | Tribunal: Juzgado de Letras de Parral
