NOMBRE;DOCUMENTO;CARGO;INSTITUCION;OBSERVACIONES
CORPORACIÓN MUNICIP ANCUD PARA LA EDUCAC SALUD;71420700-8;DDO.;Juzgado de Letras de Ancud;RIT: P-99-2023 | Tribunal: Juzgado de Letras de Ancud | Caratulado: MUTUAL DE SEGURIDAD CÁMARA CHILENA DE LA CONSTRUCCIÓN/C | Fecha Ingreso: 04/07/2023 | Estado Procesal: Concluido | RIT: P-99-2023 | Fecha Ing.: 04/07/2023 | RUC: 23- 3-0178263-2 | Est. Adm.: Sin archivar | Proc.: Ejecutivo Previsional | Forma Inicio.: Demanda | Estado Proc.: Concluido | Etapa: Terminada | Titulo Ejec.:  | Juez Asignado: VANIA CAROLA ANGULO TORREZ | Tribunal: Juzgado de Letras de Ancud
MUTUAL DE SEGURIDAD CÁMARA CHILENA DE LA CONSTRUCCIÓN;70285100-9;DTE.;Juzgado de Letras de Ancud;RIT: P-99-2023 | Tribunal: Juzgado de Letras de Ancud | Caratulado: MUTUAL DE SEGURIDAD CÁMARA CHILENA DE LA CONSTRUCCIÓN/C | Fecha Ingreso: 04/07/2023 | Estado Procesal: Concluido | RIT: P-99-2023 | Fecha Ing.: 04/07/2023 | RUC: 23- 3-0178263-2 | Est. Adm.: Sin archivar | Proc.: Ejecutivo Previsional | Forma Inicio.: Demanda | Estado Proc.: Concluido | Etapa: Terminada | Titulo Ejec.:  | Juez Asignado: VANIA CAROLA ANGULO TORREZ | Tribunal: Juzgado de Letras de Ancud
PÍA PAULINA BUSTOS FUENTES;13767739-3;AB.DTE;Juzgado de Letras de Ancud;RIT: P-99-2023 | Tribunal: Juzgado de Letras de Ancud | Caratulado: MUTUAL DE SEGURIDAD CÁMARA CHILENA DE LA CONSTRUCCIÓN/C | Fecha Ingreso: 04/07/2023 | Estado Procesal: Concluido | RIT: P-99-2023 | Fecha Ing.: 04/07/2023 | RUC: 23- 3-0178263-2 | Est. Adm.: Sin archivar | Proc.: Ejecutivo Previsional | Forma Inicio.: Demanda | Estado Proc.: Concluido | Etapa: Terminada | Titulo Ejec.:  | Juez Asignado: VANIA CAROLA ANGULO TORREZ | Tribunal: Juzgado de Letras de Ancud
RICHARD NAAMAN VARGAS MONTIEL;17714498-3;AB.DDO;Juzgado de Letras de Ancud;RIT: P-99-2023 | Tribunal: Juzgado de Letras de Ancud | Caratulado: MUTUAL DE SEGURIDAD CÁMARA CHILENA DE LA CONSTRUCCIÓN/C | Fecha Ingreso: 04/07/2023 | Estado Procesal: Concluido | RIT: P-99-2023 | Fecha Ing.: 04/07/2023 | RUC: 23- 3-0178263-2 | Est. Adm.: Sin archivar | Proc.: Ejecutivo Previsional | Forma Inicio.: Demanda | Estado Proc.: Concluido | Etapa: Terminada | Titulo Ejec.:  | Juez Asignado: VANIA CAROLA ANGULO TORREZ | Tribunal: Juzgado de Letras de Ancud
Administradora de Fondos de Pensiones Habitat;98000100-8;DTE.;Juzgado de Letras de Ancud;RIT: P-98-2023 | Tribunal: Juzgado de Letras de Ancud | Caratulado: A.F.P. HABITAT S.A. CON HERNAN CULIPICHUN VENEGAS | Fecha Ingreso: 03/07/2023 | Estado Procesal: Tramitación | RIT: P-98-2023 | Fecha Ing.: 03/07/2023 | RUC: 23- 3-0176239-9 | Est. Adm.: Sin archivar | Proc.: Ejecutivo Previsional | Forma Inicio.: Demanda | Estado Proc.: Tramitación | Etapa: Ingreso | Titulo Ejec.:  | Juez Asignado: VANIA CAROLA ANGULO TORREZ | Tribunal: Juzgado de Letras de Ancud
HERNAN CULIPICHUN VENEGAS;10925968-3;DDO.;Juzgado de Letras de Ancud;RIT: P-98-2023 | Tribunal: Juzgado de Letras de Ancud | Caratulado: A.F.P. HABITAT S.A. CON HERNAN CULIPICHUN VENEGAS | Fecha Ingreso: 03/07/2023 | Estado Procesal: Tramitación | RIT: P-98-2023 | Fecha Ing.: 03/07/2023 | RUC: 23- 3-0176239-9 | Est. Adm.: Sin archivar | Proc.: Ejecutivo Previsional | Forma Inicio.: Demanda | Estado Proc.: Tramitación | Etapa: Ingreso | Titulo Ejec.:  | Juez Asignado: VANIA CAROLA ANGULO TORREZ | Tribunal: Juzgado de Letras de Ancud
Antonio Ricardo Alamos Avendaño;8270154-0;AB.DTE;Juzgado de Letras de Ancud;RIT: P-98-2023 | Tribunal: Juzgado de Letras de Ancud | Caratulado: A.F.P. HABITAT S.A. CON HERNAN CULIPICHUN VENEGAS | Fecha Ingreso: 03/07/2023 | Estado Procesal: Tramitación | RIT: P-98-2023 | Fecha Ing.: 03/07/2023 | RUC: 23- 3-0176239-9 | Est. Adm.: Sin archivar | Proc.: Ejecutivo Previsional | Forma Inicio.: Demanda | Estado Proc.: Tramitación | Etapa: Ingreso | Titulo Ejec.:  | Juez Asignado: VANIA CAROLA ANGULO TORREZ | Tribunal: Juzgado de Letras de Ancud
Manuel Jesús Figueroa Saavedra;2415267-7;AB.DTE;Juzgado de Letras de Ancud;RIT: P-98-2023 | Tribunal: Juzgado de Letras de Ancud | Caratulado: A.F.P. HABITAT S.A. CON HERNAN CULIPICHUN VENEGAS | Fecha Ingreso: 03/07/2023 | Estado Procesal: Tramitación | RIT: P-98-2023 | Fecha Ing.: 03/07/2023 | RUC: 23- 3-0176239-9 | Est. Adm.: Sin archivar | Proc.: Ejecutivo Previsional | Forma Inicio.: Demanda | Estado Proc.: Tramitación | Etapa: Ingreso | Titulo Ejec.:  | Juez Asignado: VANIA CAROLA ANGULO TORREZ | Tribunal: Juzgado de Letras de Ancud
